2031|Jest could not locate modules exported from an index.ts file from a folder
2032|While trying to change the written text on a tkinter button (widget) I can only access the last widget in my widget dictionary
2033|Add some extra info into /proc/cpuinfo file
2034|How to apply QLinearGradient on a round QWidget border using style sheet?
2035|Bootstrap Dropdown in Navbar is not working with NextJs
2036|Passing image as props to styled components in Next.js
2037|How to resolve No qualifying bean of type in Spring integration test in a sub module?
2038|Is there a way to download APK of AAB file from Amazon&#39;s Developer Console?
2039|API with a PUT request in Modelviewset which has not null values
2040|Bash get return value of a command and exit with this value
2041|python imaging library: Can I simply fill my image with one color?
2042|Problem to send data toJava sprint client API multipart/form-data
2043|Data Streaming with Kafka in PieCloudDB
2044|How to re-render static block from a dynamic block
2045|Is there a way to access ITokenAcquisition from a static class in .NET Core 6.0?
2046|Azure Devops - Can Impediments show up on Sprint Boards / Backlogs as task level children to PBIs?
2047|Is there ant event or way to execute code while Unpublishing package in acumatica
2048|Pyspark encoding with cp1047 issue
2049|FFMPEG Encoding to prores 4444 with alpha doesn&#39;t retain original alpha
2050|Rich Text Editor Image Upload Handler
2051|java.net.ConnectException: Connection timed out: connect. Have tried everything so far
2052|How to override default theme button mat-badge-content in angular material 15?
2053|How to edit unity HoloLens Program from a Desktop App
2054|Custom deserialize from JSON navigating the response
2055|Can we write a generic type in TypeScript that converts a Record to a type that we get when we specify `as const`?
2056|How to validate Azure Managed Identity setup of app service is working as per expectation0 in azure portal
2057|Spring batch local task launcher - Argument list too long
2058|Replacing element in a list in Python
2059|ffmpeg: how to extract keyframes from certain time ranges into filenames with timestamps from the original video?
2060|AWS CodeBuild failed CLIENT_ERROR: authorization failed for primary source and source version
2061|Call &#39;document / redirect&#39; API inside express controller
2062|Google fit permission problems
2063|Deserialization Error of Member &#39;HelpURL&#39; was not found
2064|Mutate new columns and intercalate them with old ones
2065|GitHub pages app takes .zip text and send to Claude API ERROR
2066|Running Yocto on Raspberry Pi CM4
2067|PyMongo alternatives for Google App Engine
2068|Which is the bestPlatform to send OTP as a SMS in Nodejs? i have tried twilio but they keep suspending my account due to the Geo location
2069|log RangeError (index): Invalid value: Valid value range is empty: 0
2070|Error when trying to access image stored on server using Angular app
2071|The calender of my react tailwindcss datepicker goes up rather than displaying at bottom
2072|Convert all existing tabs to spaces in VS Code
2073|Combining JSON Data Model from Server with Locally Added Data in SwiftUI
2074|@typescript-eslint/no-unsafe-assignment and browser fetch
2075|I tried mapping a React state but it is not returning data
2076|Can I use IMPORTRANGE twice on a google spreadsheet?
2077|How to tap a button remotely in App1 from App2 in Flutter
2078|CS1525: Invalid expression term &#39;.&#39;
2079|ld: library not found for -lcrypto.1.0.0 on OSX 10.11.6
2080|Writing Mainframe format file through Pyspark
2081|BiLSTM-CNN Model structure
2082|How to make a layout like google play or spotify?
2083|How can I easily export a Jira-Zephyr test case with all the steps to Excel?
2084|I Need to send Push Notification in Ionic 6 Using firebase console
2085|Drop GST_EVENT_EOS on a rtspsrc connection
2086|export &#39;unstable_batchedUpdates&#39; (reexported as &#39;unstable_batchedUpdates&#39;) was not found in &#39;react-dom&#39;
2087|error: method updateChildren in class DatabaseReference cannot be applied to given types;
2088|can get the value from map-get in SCSS
2089|How to specify \r\n in replacement text in php preg_replace?
2090|Unable to create service : Java.lang.ClassNotFoundException in Android
2091|Interservice communication without Rest calls
2092|Running curl with exec.Command failed with &quot;curl: (3) URL using bad/illegal format or missing URL&quot;
2093|ASP.NET Core Web API - JWT authentication always throwing 401 unauthorized
2094|Android: append a character to my textview after every second
2095|D3: change font size of axis labels
2096|Custom Nodes template issue
2097|I need to reload the Rest API deployed using Render/Cyclic everytime I need to see my project working
2098|Common Dynamic Header in Next JS
2099|Is it possible to calculate the CPD of a parent node in a Bayesian Network using Pythons pgmpy?
2100|Unable to read calendars of all users in my tenant
2111|How to re-render parent from child component
2112|Need help, I want to shuffle between 2 payment method in Woocommerce
2113|User input to determine the displayed results
2114|Cypress API testing. Can not find property
2115|Visual for simple increase/decrease
2116|How to make unique name for image during upload in laravel?
2117|How to get the ticker-id of the main symbol that is currently selected, in a multi-security chart
2118|Get last message from Telegram Chat (API)
2119|Is it possible to change the uninstall icon in Inno Setup?
2120|how to hide a discount value when it is zero?
2121|Logging Document Views in SharePoint: How to Save Logs or Create Custom Triggers?
2122|How to block dynamic array of phone number using Callkit swift
2123|How to export a branch name i.e. env.BRANCH_NAME even after a merge to a target branch in multibranch pipeline?
2124|How on earth are these Functions supposed to be written? There was no example for this specific type. They&#39;re mostly arguments
2125|Downloding Email attachment in C
2126|MarketStack End of Day API results stop at May 3 for London Stock Exchange
2127|react-native-otp-input giving cannot read property &#39;getString&#39; of null error
2128|Non-Unique Snapshot version deploy in Nexus Repository
2129|What does &#39;new Object(*this)&#39; mean in C++?
2130|Single exe for Flutter Windows
2131|Android web socket - socket io -telnet
2132|Oracle Apex 2 actions not performed together in modal dialog buttons
2133|NodeJS app deployment to Azure linux server
2134|Error when trying to fit a dataset. (python)
2135|Edit one-to-one parent and child together
2136|My flutter app is not running after adding screenshot package
2137|Rendering Quarto Markdown (qmd) in multiple formats simultaneously using Quarto extension for VScode by pressing Ctrl + Shift + K
2138|Flask how to redireect url_for
2139|Unable to perform mathematical operations on Java List
2140|Is there a way to download AAB or APK from Amazon&#39;s Developer Console?
