13723|Undefined function (but present) on HTTP request - Angular and Capacitor
13724|Iterating elements of HTML using Jsoup but the document is really long
13725|How to insert into an existing temp table in SQL Server
13726|Azure Devops OData Descendants doesn&#39;t return any result
13727|AttributeError: module &#39;torch&#39; has no attribute &#39;__version__&#39;
13728|How to create elementor widget to get all groups for a particular location if a group is selected?
13729|a vba code to attach the excel i am working on to an outlook email and send to specific person along with CC , also display a message at the end
13730|How to fix noSuchFileException in maven library
13731|How to keep OS and latest security patches up to date on instances created with terraform?
13732|Execution default-test of goal org.apache.maven.plugins:maven-surefire-plugin
13733|Monit host identify
13734|SOAP Spyne Requested Resource not found WSDL
13735|VHDL Case/When: multiple cases, single clause
13736|Why are some commands in cmder not found?
13737|Finding all the roots inside a DiGraph (networkx)
13738|Better understanding DyamoDB compound sort keys
13739|R: Randomly Sampling Groups of Coin Flips
13740|How would I construct a regular expression for the following
13741|MYSQL compare 2 tables and show the max result from first and all max result from all tables
13742|Finding the oldest commit in a GitHub repository via the API
13743|replacing the items of a nested list based on indices?
13744|MSAL: No connection could be made because the target machine actively refused it. (login.microsoftonline.com:7002)
13745|Service did not call startForeground even though it does
13746|Module not found: Can&#39;t resolve &#39;fs&#39;
13747|ScaNN weight features for similary search
13748|Javascript - Group AND sort (by date) array elements
13749|Bindable command in NET Maui for custom control is always null?
13750|nullpointer exception with amazonhttpclient
13751|Can Someonce correct this code for fixed range volume profile to ask to select two bars and display poc with poc price label
13752|Permission error when using Snyk for gradle wrapper in GitLab
13753|&quot;headers already sent&quot; Error returned during PHPUnit tests
13754|Flutter Camera takePicture not working on Android 12
13755|New Method or Constructor found as reachable after static analysis on Native test/build
13756|No logs when running command from docker container in jenkins
13757|how to understand Python object?
13758|Select and update filtering
13759|Move GIT including their branchs and tags from A to B
13760|How to Restrict Unpacking of app.asar of an electron app?
13761|Difference between production and test environment in behavior of a method
13762|VS Code: Input and Output as files instead of terminal
13763|How can i separate code coverage reports for covered APIs and Non covered APIs
13764|How can I overlap widgets on a window?
13765|fritzbox - reached a limit on wireguard connections, how to make more?
13766|validate variable value using Regex in C#
13767|Node.js - &#39;ReferenceError: body is not defined&#39; when connecting to server
13768|Jenkins Slave JNLP connection gets terminated
13769|Compress string in Sql server and decompress in javascript
13770|Spring data jpa Join fetch paging
13771|How can I assert that a function is called with certain arguments? (the function is called more than once in the parametrization)
13772|Check if my Python has all required packages
13773|Sorting with special characters and space in the string
13774|Intval in Twig Template
13775|TextBox OnPaint method is not called?
13776|Configure Serilog to filter certain logs to a different file using appsettings.json
13777|Ruby factorial function
13778|Finding Max number out of 4 numbers in C WITHOUT USING TERNERAY OR A SEPRATE VALUE TO STORE WHICH IS BIG just use beginners logic
13779|query is not working after upgrade Hibernate/Quarkus upgrade
13780|Is there a way to procedure results as a subquery?
13781|POST request in GWT application
13782|raspberry pi&#39;s linux agent unable to connect cumulocity platform
13783|Get error 23 and error 7 when selecting Datagrid WPF
13784|Scrolling textfield above keyboard flutter
13785|Railway me arroja el siguiente error. &quot;npm ERR! Cannot read property &#39;axios&#39; of undefined&quot;
13786|Not able to see any options for Jetpack Compose in New Project wizard of Android Studio
13787|The debugger is unable to evaluate this expression. LINQ does not evaluate the expression and program terminates without any exception
13788|Kerberos5: Authentication handshake failure at stage: Could not load file or assembly &#39;Oracle.ManagedDataAccessIOP, Version=4.122.21.1,
13789|Await ContinueWith before assert on mocked task
13790|Cannot invoke &quot;org.springframework.http.ResponseEntity.getBody()&quot; because &quot;responseEntity&quot; is null
13791|makefile script is showing error while checking particular directory is present or not
13792|Can Constraint Provider and Score Calculator be set and used at same time
13793|Convert DateTime to Epoch timestamp in Azure Data Explorer
13794|basic confusion about vector environment combined with stable baseline model predict
13795|PowerBI Matrix showing data from two date ranges
13796|javascript not changing anything in tables
13797|Fastlane gym error regarding to firebase_crashlytics
13798|friend function was not declared in this scope
13799|SQL update script to update multiple rows in nested JSON field
13800|passing local variables in Node.js with ejs -Files
13801|SQL-Full of the duplicated data need to be removed
13802|Python Customtkinter Entry box
13803|jackson objectMapper how to set exact return type of Map
13804|Is Django 4 async faster then sync queries
13805|dyld[3169]: Library not loaded: @rpath/libtbb.dylib
13806|materialize dbt model in custom schema
13807|find element_by(by=&quot;tagName&quot;, value=&quot;body&quot;)
13808|Why wont my div icon go over my other div?
13809|How does the trigger time on Steaming Dataset works for joins
13810|What are the repositories to add for libsundials (with specific versions)?
13811|Unable to generate and sign a JWT for GitHub app authentification with Quarkus &amp; Smallrye jwt
13812|Error while installing PyQt6 using pip3 in Ubuntu
13813|Convert strings to variable name in Netlogo
13814|Maven Reactor Build Order Print Format
13815|Generic callback parameter pairs in TypeScript
13816|How to use Google Text-To-Speech on Unity?
13817|How to run &quot;flutter test&quot; on every run in Android Studio?
13818|Deploying microservice to be tested within the test
13819|Count bars lower since new highest high
13820|How can I remove comma from string if value is empty?
13821|How to convert values of recurring elements row by row to columns?
13822|Unable to send record for docusign signature
