7591|ValueError: Feature not in features dictionary
7592|How can I round the corners of a QPushButton using style sheet?
7593|I&#39;m wondering how to use xss code for code without malicious intent
7594|How to add raw HTML / custom elements on amp-story-consent
7595|Can&#39;t link .elf with esp-idf in a esp-matter project
7596|Undefiend when alerting div inner text
7597|Plotly chart has extra numbers on y-axis between the expected values
7598|Search by value in a multimap in O(log(n)) complexity
7599|Kabeja 0.4 How to save changes?
7600|R Session fails while debugging inside the observeEvent
7601|Register the Best Model from AzureML AutoML as Custom Model
7602|No method found annotated with @Named#value
7603|Use SSL self-signed certificate to connect to ScyllaDB (cassandra) node on Windows?
7604|TypeError: execute_script() takes from 1 to 2 positional arguments but 3 were given
7605|Android Studio: Gradle: error: cannot find symbol variable
7606|Wordpress sites doesn&#39;t load CSS &amp; JS files on any browser on my device but loads all of them on other computers
7607|How can I use Dependency Injection to pass Application() to ViewModel() using Hilt in Android Studio?
7608|Python Implementing protobuf --decode-raw in python
7609|Need to save data from an HTML file but bowser gives an undefined error
7610|Django MiddlewareMixin replacement
7611|env: node\r: No such file or directory with cordova cli
7612|Django-Pycharm problem on Windows &quot; OSError: no library called &quot;cairo-2&quot; was found &quot;
7613|Creating Pairs by Group and Keep the Groups ids
7614|Java script operator / with decimal number
7615|Updating the table showing column &quot;latitude&quot; does not exist
7616|Create a talking avatar with lipsync
7617|Mock HttpContext.Current in HangFire
7618|Is it possible to stream a response from a Python AWS Lambda
7619|how can I get the list of file names using the log committ message as filter in SVN
7620|In spring data cassandra updating udf field via update.query results in error
7621|How does PUN2 synchronize character movements in multiplayer VR scenarios (not simple animation)
7622|the question of &#39;list&#39; object has no attribute &#39;shape&#39;
7623|MySQL where condition unexpected behaviour
7624|Date picker in angular
7625|Trouble making two Docker containers talk via TLS
7626|error MSB4066: The attribute &quot;Version&quot; in element &lt;PackageReference&gt; is unrecognized. in teamcity
7627|Is it possible to change the query resultset?
7628|Plotting XRD Spectra with Python
7629|I want to convert any image in my flutter project to qr code
7630|Docker image doesn&#39;t work after installing sample data Magento 2
7631|How fit a curve with scipy with restriction on the parameter range
7632|Is it possible to name individual subtests in python unittest (HtmlTestRunner)?
7633|what is the road map of flutter
7634|Doesn&#39;t connect production websockets server with laravel
7635|rocket chip riscv rtl simulation
7636|Magento 2 - Custom customer address attributes not shown in order billing/shipping addresses
7637|Save and load nlp results in spacy
7638|is there a way to make this if-function not case sensitive
7639|c++ Eigen: Why does summing up a chipped and sliced tensor give a different (wrong) result as opposed to when you use nested loops?
7640|Try &#39;sentinel register --help&#39; for help. Error: No such option: -c
7641|How to upgrade SpringBoot-Starter to support SpringBoot3?
7642|Await Firestore collection to be done before applying listener
7643|C malloc/free + fgets performance
7644|How do I add PHP code into javascript and display a value from that section?
7645|PyQt5 QThread is run on same thread as GUI thread
7646|Confluent S3 Sink Connector for Kafka unable to connect to S3 using MSK / MSK Connect
7647|Unable to handle signal SIGSEGV in C++
7648|error【TypeError: ufunc &#39;isfinite&#39; not supported for the input types, and the inputs could not be safely coerced to ... ... 】when using kneed
7649|Import a whole folder of Python files
7650|the expression inside th:field gives Neither BindingResult nor plain target object for bean name error
7651|EF Core 7 Json column projections - LINQKit - LINQ expression could not be translated
7652|Rearrange Clipboard Text to Fit in Google Translation Box
7653|C# generics how to pass T parameter which extends from interface
7654|Visual Studio Code Docker React TypeScript syntax highlighting
7655|Flutter: Need to hide suggestion/correction text space in iOS keyboard
7656|Difficulty displaying a date in a Cognos BI 10.2.2 crosstab node member
7657|reading from the same queue simultaneously with multiple subprocesses
7658|ajax call request and response is not working below ios 11
7659|ValueError: Document prompt requires documents to have metadata variables: [&#39;source&#39;]. Received document with missing metadata: [&#39;source&#39;]
7660|Databricks spark configuration using secrets in property name
7661|Parallel processes that make use of the same base directory?
7662|MultiValueMap causing the application/x-www-form-urlencoded;charset=UTF-8 not supported
7663|SVG picture is returning black image in flutter inspite of giving a color image from assests
7664|Is it a better practice to store a lambda expression to a variable?
7665|saving strings in las/laz data format
7666|Intervention / Image Upload Error {{ Image source not readable }}
7667|Create nested `dict` with list compression
7668|Black screen in url launcher flutter
7669|Use Gob to write logs to a file in an append style
7670|How to upload file in django and access in another module?
7671|TYPO3 Repository query returns uid and pid but no other fields
7672|found a virtual manifest at &lt;path&gt; instead of a package manifest
7673|Where in the documentation/spec does it describe how &#39;\n&#39; is converted in text-mode to platform-specific line-endings?
7674|Tensorflow Custom test question selection based on user success
7675|How to subtract the field value in between timestamp in mongodb
7676|CMake Nested Projects and Targets
7677|Running javascript in Selenium using Python
7678|UWP HandwritingView can be enabled only for English
7679|Add-on not visible in sheet
7680|How to install curl/curl.h c++ module (fatal error: curl/curl.h: No such file or directory)
7681|Impact of custom train_step function in Keras
7682|Failed to load ressource: the server responded with a status of 403 (Forbidden)
7683|Get file information .bmp
7684|Have keyword with arguments as argument
7685|Get a record outside of an `Include&#39;`
7686|Download and copy function is not working on mobile devices
7687|How do I set working directory for R scripts in Snakemake?
7688|Setup Intent with Google Pay shows 0$
7689|Speed up a while loop using list filtering procedures for 200 turtles
7690|Dart: Wait for WebSocket reponse
