20005|How to make sure the label&#39;s for attribute references the correct id of a form field?
20006|I want to stick the website header to the top of the page
20007|[Sharing]Create a runnable JAR file that contains images - a trick
20008|Flutter Web - Call to Google Analytics API &quot;message&quot;: &quot;User does not have sufficient permissions for this profile.&quot;
20009|Shortcut to duplicate line in SQL Server Studio Management?
20010|Blazor isn&#39;t passing my object as a Parameter
20011|How to remove duplicate vertices/edges in Apache AGE
20012|re.search is not returning complete match
20013|Hide multiple DIV ID elements using Javascript If url has specific text (Already have code that hides one)
20014|Write a program to check whether a number can be expressed as the sum of two prime numbers
20015|Add a shape to word document by overlapping with present paragraphs
20016|Haskell-like pattern matching in Raku
20017|Connect to DynamoDB using NoSQL Workbench and the IAM role ARN option
20018|JSON value &#39;{assetid =&quot;xx&quot;; fileName = &quot;IMG_8189.PNG&quot;; uri = &quot;file:///var/mobile/cpntainers/Application/&quot;} of type NSMutableDictionary != Valid url
20019|How do you solve the Praat error &#39;Wrong xmin and xmax&quot; whentrying to open an export from ELAN?
20020|How can i move from http to https?
20021|How to define a class for table to control the style of table rows
20022|SwiftUI .position modifier with coordinates
20023|SpringBoot 3 (Data) keyword isTrue doesn&#39;t work
20024|is there a way to make a get request with token and data with both axios and fetch?
20025|cdk error - Module &#39;&quot;constructs&quot;&#39; has no exported member &#39;IDependable&#39;
20026|How to slugify on get_root() function of django-mptt on overriding save method
20027|Module Placement on other fog nodes in iFogSim2
20028|In Visual Studio Code, for my React project I am getting error while doing &quot;npm start&quot;
20029|flask command not found in windows 10
20030|Running javascript in R markdown - cannot import library
20031|&#39;Step Into&#39; is suddenly not working in Visual Studio
20032|Nifi container running but not accessible via UI
20033|Java / JavaFX - java.lang.OutOfMemoryError in a short and relatively simple programm
20034|Expo tunnel not working: CommandError: Please install @expo/ngrok@^4.1.0 and try again
20035|How to target a component in svelte with css?
20036|RabbitMQ - Use case for non-durable queues
20037|How do I get data from my Microsoft SQL Server database to populate fields in my Ranorex project?
20038|How to setup App Check in dev environment and last next js 13.4 project with app directory and reactfire?
20039|Converting External CSS to Inline CSS for Mail in Rails
20040|Querying data in s3 using parquet or s3 select
20041|Pybullet: controlling collision of a floating gripper
20042|Problem with my EventSubscriber in a Symfony 6 project
20043|How to control Google Home Accessories From Different Android App
20044|PHP can&#39;t find php.ini configuration file
20045|MATLAB: Find R waves on a ECG signal without using findpeaks gives me Error : Array indices must be positive integers or logical values
20046|Synology DS215+ PHP8.0 NGINX I want to create a new site in port 80 without Transfer-Encoding: chunked
20047|How many calls would you expect to ASP.Net SQL Server session state SP ASPStateTempSessions
20048|Android Studio: trouble with getResourceAsStream() in TSAGeoMag.java
20049|Reading environment variables from more than one &quot;.env&quot; file in Python
20050|cannot remove rewrite rule (selected) using php from .htaccess
20051|Javascript format date / time
20052|Is there MS doc about c# class name role?
20053|PHP extensions are showing not enabled through web browser but working through command line
20054|discord pynacl issue pls
20055|What permissions required for GitHub updateTeamsRepository GraphQL mutation?
20056|Why is this ggplot not working when I change the column name?
20057|VS Code auto suggest selection not working as expected on pressing enter or tab
20058|Laravel / Livewire form upload issues with application/pdf
20059|Regex for pivot longer multiple columns get names between _
20060|How to locally develop EventHub Triggered Functions in Python (programming model v2)?
20061|Convert character variable to factor and keep old levels
20062|Does the Windows 7 API provide an equivalent to Apple&#39;s NEPacketTunnelProvider?
20063|PhpStorm v2021.3.3 debugging with PHP 8.x on remote host extremely slow. Need to downgrade to PHP 7.4 on remote host to work okay
20064|Exposing a container in Colima to a Docker container on host
20065|Failed to start service jboss.deployment.subunit.&quot;PTU_NP_NM_EAR.ear&quot;.&quot;PTU_EJB.jar&quot;.POST_MODULE: org.jboss.msc.service.StartException in service
20066|socket.gaierror: [Errno -3] Temporary failure in name resolution
20067|Warning: Uninitialized string offset 0 in
20068|Laravel Ckfinder How to config error 403 Forbidden
20069|Can’t autowire. No beans of type String found
20070|placeholders for table names in python mysql
20071|Inductive Transfer Learning state-of-the-art algorithm
20072|saving datetime with milliseconds and time zone - python
20073|Messaging broker which support for multi tenancy, persistence and web socket support
20074|Cumulatively add values to python dictionary
20075|Riscv: mhartid register
20076|NLog detect if LogLevel is enabled for Target
20077|How to formulate C# generic types so that one service can be applied to many request / response pair types
20078|How can I add query string to NavLink?
20079|How do I integrate custom exception handling with the FastAPI exception handling?
20080|vueChart.js child component not updating with data
20081|What version of Apache ActiveMQ corresponds to the JBoss A-MQ v6.3?
20082|Is there a way to programmatically upload files to a GA4 property
20083|Are there any dialects of scheme that support multiple integer sizes?
20084|Unity Mirror Commands problem. (damaging)
20085|I tried creating a cookbook in chef but why this is showing this error?
20086|What is causing low bounce rate?
20087|gitlab Request to merge branch-A into develop (3 commits behind) should I worry?
20088|How can I create a native component of Android in ReactNative using Here Maps SDK
20089|How do i get the &#39;usertoken&#39; under the Local Storage section from a url using python
20090|how can i get the SDK for digitalpersona 4500 fingerprint scanner?
20091|Logging in the Open AI python library
20092|JS filter tree based on multiple conditions
20093|How to detect command + arrow key in a Swift 3 Cocoa app
20094|How to use a == b== c for &quot;or&quot; operation?
20095|fileImporter or fileExporter open external usb by default
20096|What does the conflict &quot;Both Modified&quot; mean in git
20097|Not understanding given byte and position in UnicodeDecodeError error message
20098|AppSettings.json not using custom TypeConverter for IpAddress
20099|SQL Server stored procedure accessing Oracle runs in Management Studio but not in Delphi client via ADO
20100|Network Modem for Gammu Device
20101|R programmable fixing of parameters in `optim`
20102|Angular stackblitz Error: Uncaught (in promise): Error: Providers from the `BrowserModule` have already been loaded
20103|How use async service into angular httpClient interceptor
20104|How to know scroll to element is done in Javascript?
