2651|Errors when connecting to an offline .cub file by using C# ADOMD Connection
2652|webpack 5 - Parsed request is a module
2653|How to fix ‘No such file or directory’ error in PHP
2654|Creating .ICS files, adding to outlook
2655|asp.net date validation with three drop down list
2656|React AntDesign Calendar Component selects last selected day on month change
2657|Need Help Identifying the Issue with &#39;Include&#39; and &#39;ThenInclude&#39;
2658|Is weights value of range(-2,2) different that in range(-1,1)?
2659|How can I try Google Places API from my browser?
2660|&quot;Error: No connection info returned&quot; when attempting to connect to SQL Server from Azure Data Studio
2661|Generate a random number which is greater than a specific number
2662|Changing background color (and other elements) of a ColorDialog
2663|Prediction for quantile regression using grf package in R
2664|Can someone help me resolve the ValueError in this Pandas code?
2665|Data Use Checkup is complete but still getting &quot;Feature Unavailable: ...&quot; - Facebook Login React Native Android
2666|The difference between &quot;SDN Platform&quot; and &quot;SDN Controller Platform&quot;
2667|How to write Spark dataframe output as parquet output in Azure Machine Learning?
2668|OpenAPI for Alation
2669|Configure Nginx static and Django site
2670|AttributeError: &#39;list&#39; object has no attribute &#39;setRentBy&#39;
2671|There&#39;s no place for entering basic username and password on Azure Data Studio?
2672|ODP.net 4.0, Why extra call is made and how to remove another call to fetch row count
2673|Install maven : Problem: cannot install the best candidate for the job
2674|Trying to understand Average Sales Per Hour
2675|Tkinter GUI in for loop
2676|How to shift 3rd yaxis leftward in plotly?
2677|How can I use threading in Python?
2678|how to pass user data to a modal?
2679|How to sniff network packets using golang?
2680|Cosmos DB - Deleting a document
2681|How to find official Android Studio older versions?
2682|Cloud Api Gateway not working with ^ special character
2683|TransactionScope in Azure SQL Database with primary and failover database server
2684|Initial value of custom properties not persisting
2685|Azure function. &#39;Could not load type &#39;Microsoft.Azure.WebJobs.ParameterBindingData&#39; from assembly &#39;Microsoft.Azure.WebJobs, Version=3.0.34.0&#39;
2686|Change column name in pivot_wider for Boolean column
2687|scraping a URL address for reviews
2688|Lambda cannot connect to RDS: Task timed out after 60.01 seconds in the same account
2689|Why does RStudio repeat the R startup message 4 times over when I start it?
2690|How to update the whole collection using mongoose and nodejs?
2691|Agenda not running the job after server restart - NodeJS, Express
2692|ILP constraints for connectivity in a matrix
2693|responsive &quot;overflow-x: hidden !important;&quot; not working
2694|how to write an aws iam policy to deny action for all users except a specific one
2695|Running ngrok in background
2696|Can PyQt dialogs be shown in all threads or processes of multi-thread/process applications?
2697|Make JSON Consistent format - Pyspark
2698|Code only works normally if I loop it four times
2699|Unable to Knit my code in Rmarkdown because of no file directory error?
2700|How to call Pinia action from another action?
2711|Certificate authentication to access an api in java
2712|C++ client : Ensuring Message Consumption Consistency in Aeron with Multiple Consumers on same channel
2713|ASP.NET Core: Session Id Always Changes
2714|How to randomly select x number of values from a pool of values in python
2715|Flutter intl package formats minutes incorrectly
2716|How to trigger function after change to background/foreground?
2717|TypeError: &#39;MultiPolygon&#39; object is not iterable
2718|&quot;sh: 1: [MY FUNCTION]: not found &quot; error while using os.system in python
2719|How to solve &quot; [ERR_REQUIRE_ESM]: require() of ES Module&quot; for Webpack case?
2720|Trying to use next-export-i18n with next js
2721|Android Jetpack Compose - scale image to the size of its sibling composable
2722|Exception when implementing HTTP/2 over HTTPS in Java 11 / Jetty 11
2723|How to get the class through reflection and then pass in the generic?
2724|Project-Specific Omnisharp Formatting Not Working
2725|If condition to get userid from different fields from JSON
2726|Target is not instantiable. Laravel 5 - App binding service provider
2727|How export objects to the given location in Liquibase
2728|How do I summarize the failed assertions in Ansible Tower at the end of execution?
2729|How to access hash&#39;s key as an object attribute
2730|If float has 6 digits of precision, why can we display more than 6 digits of floats with printf?
2731|Laravel scheduler by supervisord running multiple time
2732|Classification with Features with Variable Sizes
2733|Group pandas dataframe and flag corresponding rows where all values from a list exist in a column
2734|flask-socket.io problems with backend to frontend updates
2735|How to use PyPDF2 get the amazon summary report info
2736|Logcat displays Empty SMPTE 2094-40 data
2737|How to proper healthcheck a db2 container so my app container can go up safely?
2738|How to unify different fields of different devices into one time series in Apache IoTDB?
2739|getting not authorized error while my spring-cloud-config server is trying to access the properties files present in a private repository
2740|How to allow public access to a specific file inside a restricted &lt;Location&gt; statement in Apache 2.4
2741|Error No. 2003. Can&#39;t connect to mysql server
2742|Newtonsoft.Json.JsonReaderException : Current JsonReader item is not an object: EndObject
2743|Uncaught TypeError: Cannot create property &#39;guid&#39; on string &#39;#partnercode&#39;
2744|How to add custom field in ModelSerializer?
2745|Azure - How to update the password profile of a user in Azure AD B2C using the Microsoft Graph API?
2746|host PDF on AWS S3
2747|How do I load data from XML where date is in %W %e, %Y format?
2748|Android studio not connecting my phone over wifi
2749|What is height texture used for?
2750|Is it valid (in theory and practice)to pass numerical token to BERT directly?
2751|When you delete an app, does it also delete the SQLite database stored on the device?
2752|How to unit test code inside Response.OnCompleted() in a finally block
2753|Amazon Quicksight Functions - SQL JOIN equivalent
2754|Background location tracking not working - Expo - Android
2755|how to get a value of a progress bar in kivymd inside its class
2756|ffmpeg Flip video horizontally
2757|Calculating mean annual runoff from monthly data in a netCDF file
2758|Not allowed to connect to Database using sqlcl
2759|Serializing SQL Json response
2760|getting data from API with useFetch. How to destructure to get meta and data objects and extend Respone type to include
