14823|disable kotlin-android-extensions deprecation warning
14824|Jetpack Compose Use FlowRow with Text Justify
14825|what exactly is the difference between warning and error in jupyter notebook?
14826|Run-time error 33 - SessionNotCreatedError
14827|Android deprecation and warning suppression best practice?
14828|FLUTTER: Lexical or Preprocessor Issue (Xcode): &#39;TensorFlowLiteC.h&#39; file not found
14829|same object returns two different values
14830|SQL Server Error during dacpac deployment via Octopus
14831|Retcode=10016 when executing a trade in metatrader 5
14832|Installed node js getting &quot;The syntax of the command is incoorect&quot;
14833|Vue3 Transition not working for Router-Link within Route
14834|Java Applet output
14835|Error building esp-idf-template on Windows
14836|KerasRegressor DeprecationWarning
14837|Use only one feature flag attribute with multiple use statements in Rust
14838|Word count command returning incorrect row count for CSV files
14839|pytorch regression model showed its learning, but when test the trained model, output is always the same
14840|making a user input a number and not allowing them to input a blank input
14841|Differentiate line type in geom_path depending on whether variable is negative or positive
14842|c# selenium how to findelements to style range?
14843|Failed to update the product details
14844|Largest Contentful Paint element &quot;Error!&quot;
14845|Pydantic Reponse Model for List of dictionary and Integer
14846|Programmatically open AddLinkForm with @draft-js-plugins/anchor
14847|i am trying to find correlation between in one column to itself
14848|What programming language is displayed?
14849|Kubo, invalid memory address or nil pointer dereference from IpfsNode.Bootstrap
14850|How do .razor files behave as both HTML and CS files and how could I recreate this behaviour
14851|Makefile string comparison #ifeq
14852|Generics: Type argument is not within its bounds
14853|Embedded base64 image has random background color (Making signature html rtf txt files)
14854|How to simulate mouse click on specific virtual keyboard button?
14855|Deep learning for chatbot training
14856|What is the semantic Bootstrap markup for yes/no radio buttons with a third &#39;question&#39; label?
14857|Is there a way to configure a Jenkins Linux Node/Slave at startup?
14858|How to apply custom FetchXML to a Subgrid using JavaScript
14859|How to define day and night hours depending on the time of the day in Python
14860|Angular modules imported but components and directory binding not working
14861|Get elapsed time since some instant in embedded rust
14862|How to make chatbot using QnA data?
14863|how to efficiently update lottery results in real-time using a tool or technology
14864|How to refresh the textblock in real-time in WPF?
14865|How to create ediatble form in CKEditor5 with React
14866|Best practice for using an external library on the window object
14867|Either open mutliple web URLs or disable the button on specific condition
14868|with openCV / aruco, express rvecs and tvecs in a specific tag coordinate system
14869|IdentityServer4.AccessTokenValidation + .NET 6 compatibility error - NuGet restore?
14870|Creating JWT token with x5c header parameter using System.IdentityModel.Tokens.Jwt
14871|How to change background of Altair plot in VSCode
14872|how to test children for specific types using typescript
14873|In Azure AD B2C, is it possible to have a password less sign in policy where user enters email and OTP is sent to associated mobile number?
14874|can GA4 custom dimensions be updated after the initial &#39;config&#39; call?
14875|how to toggle vs code&#39;s little outline with a shortcut rather than a click on the current variable/function?
14876|jps command shows process_id files for all jars
14877|That compression method is not supported
14878|Does postgres hash string based primary keys under the hood?
14879|Worker service picking up appsettings.Prodcution.json in AWS ECS QA environment
14880|Methods For Selective (or Ranked) Chatbot
14881|Improving First-Time Query Performance in SQL Server for Data Migration Scenarios
14882|Azure WAF with Application Gateway and Custom Domains
14883|How to use test-id in Material UI Textfield
14884|Disable Kafka Warnings for Spark Streaming Application
14885|TypeError: Could not convert malefemalemalemalefemalemalefemalefemalema
14886|Does Android Studio Emulator support OpenGL ES 3.2?
14887|RabbitMQ MassTransit batching competing consumers
14888|Passport.js custom error for unauthorized and bad request
14889|Display a popup when user change or close the tab
14890|DDD java: Value object validations using javax.validation (when to validation)
14891|How to extract the Text in the following Image
14892|Issue connecting to SQL Server
14893|Start thread of class member
14894|Android - open Telegram specific account from my own Android app
14895|Ocelot gatway doesn&#39;t work with selected port
14896|How to start a process when tomcat is full started?
14897|Having Issues connecting to MySQL Database build from Docker Image with Python (PyMySQL/SQLAlchemy)
14898|"Mac M1 and Pyaudio. ||PaMacCore (AUHAL)|| AUHAL component not found"
14899|Migrate database from Mysql to Postgres in YII2 .How to ignore the string case of Table Name and Column Name
14900|Is there a way to use qr code scanner as a search text box and qrcode for text to display rows of its content
14901|Problem while creating logs using logback.xml
14902|How to create a higher order DCG parser in Prolog?
14903|Pycharm find usages of duck typed property
14904|Adding smallrye tracing to Wildfly 23
14905|How to get original stack in Sentry from VueJS?
14906|AG Grid paste: asynchronous processCellFromClipboard
14907|Generic deep diff between two objects
14908|Failed to load resource: the server responded with a status of 404 with website
14909|Issue with uploading and displaying images copied directly into Summernote editor
14910|ElasticSearch Healthcheck on docker-compose failing
14911|when I added spring-security (basic Auth) then the getMpping works but the postMaping show 403 Forbidden
14912|R - Convert columns of type list to type str
14913|Wait .5 seconds before continuing code VB.net
14914|Project with path could not be found in root project
14915|JavaScript aws-sdk S3 deleteObject(s) succedes but doesn&#39;t actually delete anything
14916|scraping xml data using import lxml.etree as ElementTree
14917|Is it possible to use docker commands in Sagemaker Studio
14918|How to hook functions like fopen, fwrite in windows
14919|Why can&#39;t I import requests in VS Code?
14920|Interpreter throwing error after running the code
14921|Merging DataFrames by Datetime with pd.merge is not possible
14922|How to refer to a private variable declared in &lt;script&gt; in &lt;script setup&gt;
