17378|Testing first call succeeds, second call fails with whenNew
17379|Unable to update the font-family and its size on GitHub using Chrome/Brave
17380|Unable to use aws-amplify with NextJS 13.4 api routes
17381|Your app is uploading users&#39; Contact List and Images information to without posting a privacy policy in Play Distributed App
17382|How to count unique views to a blog post (logged in and non logged in user)?
17383|Kubernetes ingress nginx not working for HTTP but works on HTTPS
17384|how to copy Stucture, Constraints and triggers from one table to another?
17385|How can I prevent targets from added subdirectories of external dependencies from being built in CMake?
17386|Import arbitrary python source file. (Python 3.3+)
17387|Adding Hyphen (-) in the Path Segment causes issues with response when using Odata (4.0)
17388|ReactNative FlatList is there a way to track if user scrolled to the other end?
17389|Disable form button if required field has no value
17390|Monorepo Version Tags Conventions
17391|What does &quot;secret base64 encoded&quot; on jwt.io mean and how would I simulate it with `openssl dgst`
17392|Using out variable from previuos step in if condition
17393|Cannot read properties of undefined (reading &#39;maps&#39;) using React and @google-maps-api
17394|cannot load parquet file (Parquet type not supported: INT32 (UINT_8);) with pyspark
17395|Google Oauth2 redirect_uri_mismatch from angular localhost application
17396|Angular Electron - Uncaught Exception
17397|How to show value of two column from different table of db and show it in 1 column of datagridview
17398|Consistency of hashCode() on a Java string
17399|Google Chrome Extension chrome.browserAction.setIcon not working
17400|&quot;ESLint error: Expected an assignment or function call instead of an expression in React component&quot;
17401|next.js &amp; express.js have an insecure transport issue
17402|Find out if a python script is running in IDLE or terminal/command prompt
17403|Signing SOAP header using Wss4j in Spring throwing errors &quot;Caused by: java.security.UnrecoverableKeyException: Given final block not properly padded&quot;
17404|react &#39;component&#39; cannot be used as a JSX component
17405|Failing to load HTML from bundle
17406|Creating procedure with dynamic conditions is failing
17407|Next-Auth deployment to aws amplify in a NextJS application
17408|Accessing a markdown file into a component in gatsby
17409|when perform git commit command getting the following issue Please enter the commit message for your changes
17410|How To create a Keyword in robot framework if xpath is the only different
17411|convert log4j.xml from version 1.x to 2.17.1
17412|Add row number column to jquery datatables
17413|React Native application is being rejected by Android Play console
17414|Windows Driver can&#39;t build normally
17415|C - MCU code has 3 error prone regions on my graph output
17416|Email sending to multiple mail ID&#39;s in frappe
17417|rxjs6 - TypeError: Cannot read property &#39;pipe&#39; of undefined
17418|Angular $location.state() vs history.pushState behavior
17419|Azure Website ASP.net WebPages &quot;The page cannot be displayed because an internal server error has occurred.&quot;
17420|Pass an array of objects from model to JSP using Spring and jQuery
17421|Unresponsive webpack-internal:// URLs in Chrome Dev Tools Stack Trace
17422|Raspberry Pi GPIO error &quot;valueerror the channel sent is invalid on a raspberry pi&quot;
17423|1)	Write a REST API with token-based authentication and handling various HTTP status codes as per REST standards
17424|How to upload wallet secret key to aws kms
17425|PHP - 21 Game (like blackjack)
17426|Is Microsoft supporting Active Scripting APIs for Custom Debugging? - IActiveScriptDebug
17427|Java Aspect oriented - interface Around not working as expected when applied on a class
17428|how to check with jQuery if dropdown list has values which populates dynamically
17429|How can I perform ADMIXTURE analysis from a genlight object in R?
17430|WebDriverException: unhandled inspector error - No node with given id found at a specific iteration point
17431|FileNotFoundError in subprocess.py(which is called internally not explicitly)
17432|RecyclerView lost data if wifi network change
17433|How to add unseen message count in a $lookup in MongoDB
17434|What is the proper way to delay a service worker update check?
17435|Javascript what is difference between `map.set(&#39;key&#39;,value)` and `map[&#39;key&#39;]=value`?
17436|Warning: isInitialValid has been deprecated and will be removed in future versions of Formik
17437|How to dynamically load JavaScript file in ReactJS
17438|How to set application as service which can start at the boot of the system in installer it self
17439|Diart (torchaudio) on Windows x64 results in torchaudio error &quot;ImportError: FFmpeg libraries are not found. Please install FFmpeg.&quot;
17440|Automate move file from one folder to other specific folder by name on Google Drive
17441|How to send notification to activity tab of Microsoft teams using Teamsjs?
17442|How to Quit Flower Dashboard for Celery
17443|Redux Toolkit Queries or/and memoized selectors?
17444|Unwanted package name prompt with create-vite
17445|docker: Error response from daemon: failed to create shim task: OCI runtime create failed: runc create failed, Runing container binary as host binary
17446|Multiple plot are displayed on one plot by matplotlib
17447|Command to automatically input password for pscp
17448|Different font sizes in the same annotation of matplotlib
17449|Simplest way to generate a X509Certificate2 for testing purposes
17450|Adding rectangles to a specific column in a ReportLab table dynamically
17451|Most efficient way for storing geolocations in a database
17452|TWIG Query Builder In Repo
17453|Update Azure DevOps artifact properties using API call
17454|Translation from R to Python (data.table -&gt; pandas): how to replace with values from another column?
17455|Upgrade to Magento 2.4.6 and Elasticsearch results in elasticsearch error and no products on Category pages
17456|How to count image When it overflow view screen
17457|macOS Mojave &#39;ruby/config.h&#39; file not found
17458|Django - limiting query results
17459|Insert a message in a Blazor SignlR Chat from outside the hub
17460|Python: programmatically running &quot;pip list&quot;
17461|How to Play and Save AudioFile from filePath iOS Swift
17462|Joining a meeting with Zoom meeting SDK sample app Android (Error 5003)
17463|Getting 403 in Facebook sharing debugger
17464|How do I filter with the REST API in Astra DB?
17465|Convert string to integer recursively?
17466|read NetCDF into R as a raster stack
17467|HTTP request failing – but only when run through Cocoapods
17468|Emulator&#39;s Location simulation not working
17469|Uncaught TypeError: curl_file_create(): Argument #1 ($filename) must be of type string, Closure given
17470|How to Pick/browse audio files from device library like photo library?
17471|sendbox notification not delivered from Apple
17472|Why is mammoth unable to read the docx I&#39;ve passed to the server?
17473|Trying to make glue in Unity for VR game
17474|Compile-time std::string obfuscation
17475|Regex to find sequences of two given characters that alternate
17476|How can I attach file with the latest date filename to an email from Share point folder using power automate?
17477|react-router v6 how to match the url?
