23425|C# - Serializing to XML information as to which Function to bind a delegate too
23426|Vite 4.2 HTML Env Replacement doesn&#39;t work with vue3.js
23427|is Dependency Injection auto registration considered bad practice?
23428|How to Redirect to a Private-Use URI Scheme From a LogIn Page?
23429|Mongoose findOne with exec do nothing
23430|Can we make Multi line mat-label
23431|NameError: name &#39;pd&#39; is not defined when loading a pickled file - but pandas IS defined
23432|About serializers as a mechanism for dealing with concurrency
23433|Is there a way to allow downgrades with apt Ansible module?
23434|Datadog monitor to group an alert by request query parameter value
23435|An error occurred while registering a ClassTransformer with PersistenceUnitInfo
23436|Swift/SwiftUI toolbar .principal creates awkward gap between toolbar and content
23437|Build error with gradle Could not find method testCompile()
23438|Missing Push Notification Entitlement
23439|How to use ngrok with puma-dev rails server
23440|flutter downgrade error - There is no previously recorded version for channel
23441|element.find_element searches in driver, not element
23442|Cannot update array in object firebase firestore version 9.0
23443|additional lading from iOS14 Carplay
23444|What is InternalNode in chrome heap profile
23445|AndroidManifest.xml is missing
23446|Bi gram from a list
23447|Selenium WebDriver Java issue with drop down menu
23448|Shall we apply a limit for pagetoken, Because I am getting 400000 rows, due to this api&#39;s getting worker unresponsive error
23449|Uncaught SyntaxError: &quot;[object Object]&quot; is not valid JSON at JSON.parse (&lt;anonymous&gt;)
23450|String.Split only on first separator in C#?
23451|Convert Jalali calendar to Gregorian by PHP in CodeIgniter
23452|how to make a DIV unfocusable?
23453|String xml file in Flutter
23454|Create Upload Session in Sharepoint
23455|Does OpenAPI client Generator of SAP Cloud SDK supports extensibility fields?
23456|How to elegantly configure a Logger with a configuration file while supporting log rotation
23457|Pandas Reading Websocket Data - Fyers
23458|Java 8 to openJdk 11 com.sun.org.apache.xml.internal.* types not accessible
23459|OData V4 implementation to comsume Northwind-Service-Data in SAPUI5
23460|It is Azure Traffic Manager or Azure front Door in-front for multi region system architecture?
23461|Trouble with the nmds_phyloseq function of the phylosmith package: Error in `stat_ellipse()
23462|how do I turn off logging in java c3p0 connection pooling lib?
23463|Save widget to Image without freeze the UI in flutter
23464|jQuery, how to don&#39;t restart the UL scroll animation
23465|[Environment]::SetEnvironmentVariable doesn&#39;t set permanetly
23466|how do make vue-canvas-gauges colorMajorTicks and colorMinorTicks progress height auto changes to value?
23467|FluentBit Date parsing issue, opensearch taking as string
23468|Socket disconnection after few minutes in .NET Core
23469|UIGraphicsImageRenderer: iosurface is too large for GPU
23470|spark s3 shuffle service failing to fetch blocks
23471|How to get status bar height in overlay window context for Android?
23472|App Site Association (AASA) not recognised for App Clip
23473|Application is not visible in Azure
23474|Cannot find module ...node_modules/puppeteer-core/lib/cjs/puppeteer/common/Browser&#39;
23475|HTML input type=“file” in Google Chrome not showing popup window
23476|Keycloak: Pass custom user attributes on Social Identity Provider Login
23477|body causing large layout shift
23478|Git merge error caused by visual studio after checking out to master branch
23479|IIS 10 - IP Address Restrictions not working as expected on company VPN
23480|Azure SAML SSO with spring boot using SAML2-core 2.0.0.M31 dependency
23481|How to find links children of any level
23482|How to end decimal number with .0 and .5 only using VB.NET?
23483|Getting Error while uploading the Custom App in Teams
23484|REST API did not process the context query parameter correctly- Wordpress
23485|@ModelAttribute and @RequestParam file get
23486|After installing iterm2 in the terminal, there was an error comment at the end
23487|Modules and Packages in Python
23488|Webdriver.io - Unable to load spec files quite likely because they rely on `browser` object
23489|Azure SignalR service is returning cors error for /negotiate call in React TypeScript Client App
23490|I want to switch the background after clicking using angular
23491|HTML tag not closing when injecting Lit
23492|Permutation algorithm to minimize series change
23493|How to add prompt to Langchain ConversationalRetrievalChain chat over docs with history?
23494|How do I configure git so I can just push a branch?
23495|The argument type &#39;RequestOptions&#39; can&#39;t be assigned to the parameter type &#39;Options&#39;
23496|Understanding the order of local variable(s) on the stack frame
23497|AWS Consolidated billing and Payment
23498|How to allow user to create a redirect from one URL to another URL
23499|transformIgnorePatterns not working correctly in jest config
23500|Django statics returns 404 error in cPanel Passenger
23501|Try-with-resources scope of resource
23502|Channel closed exception in pipeline
23503|SOAPUI Error : java.io.IOException: Attempted read from closed stream
23504|How to add Header values before Posting the HTTP request using LoadRunner
23505|How to stretch inline frame size in panel stretch layout in ADF?
23506|Batch FTP mget command not working with wildcard?
23507|How to implement this model using BiLSTM with attention?
23508|NextAuth session disappearing after page refresh
23509|Spring cloud gateway: rewriting the body of very large requests
23510|In nest.js, how to validate function parameters not form request call
23511|MassTransit How to implement a sniffer
23512|Undefined variable after upgrade to Vite version 4.3.0
23513|What visualization tool do I need to recreate this graph
23514|C++ type trait to check if a type is an instance of template class?
23515|Why is &lt;Link&gt; tag is not working properly when the content inside not-found.tsx file is being used in Next.js 13?
23516|How to create a class schedule that does not clash with retaking students using genetic algorithm?
23517|Invalid Data safety form With Policy Declaration - Data Safety Section: Contacts Data Type - Contacts
23518|Projecting number of bytes for double, triple etc encoding cp1252-&gt;UTF-8
23519|ElasticSearch: count the occurance of value in a field
23520|Invalid block tag on line 10: &#39;static&#39;/css/all.css&#39;&#39;. Did you forget to register or load this tag?
23521|Send the count of rows of each tables in kdb q and email the o/p without using qmail
23522|Generic Answer when Fine Tuning OpenAI Model
23523|How do I post contents of a Quill editor in a form?
23524|Copying To Clipboard Of a File PATH in Laravel 8 NOT WORKING
