11115|Nomad : Error getting job struct: Error parsing job file
11116|java double precision error when adding and subtracting the same number
11117|Invalid Argument Error After Moving Code Block to Function
11118|How to plot the sigmoid function from a logistic regression model?
11119|Where&#39;s the documentation on &#39;use&#39; and &#39;next&#39;?
11120|How can I trigger autocomplete when a text is pasted in the input field
11121|How to fix underline text hover going to far in responsive navbar
11122|Python logging, Loading config from ini file, KeyError with Formatters
11123|404 Static file not found - Django
11124|Why am I having error during installation of php on rhel 8
11125|SMTP emails keep getting blocked for spam
11126|How to break on Err creation
11127|Merge local folders with diff editor
11128|Parent Pom get version of Child Pom/dependency
11129|Why is a std::move of a value from a const std::optional possible?
11130|How can I create default/global launch configurations for VS Code?
11131|AWS Java Exception: Library source does not match the bytecode for class KmsMasterKeyProvider
11132|Flutter: Focus next TextFormField does not work in Modal
11133|Converting Class app into Hooks for React Next app
11134|Cannot find required version of java tm runtime environment when trying to install Glassfish
11135|Continue the loop once the item meets a condition using a python generator
11136|Create all combinations of parameters from multiple arrays in VBA
11137|How to stop placing elements in list
11138|JupyterLab: How to start a Notebook using Anaconda command prompt?
11139|Create a login application with local database in visual studio
11140|Oracle PL/SQL Cursor in Trigger
11141|How to pass a date parameter from report builder query designer to oracle database
11142|Is there a way to find the next perfect square?
11143|How to debug unexpected behaviour in useEffect in React?
11144|Is there a way of include multiple conditions in a Python next function?
11145|C# TransactionScope class is not rolling back the operation after an exception
11146|How to get the current value of a Python iterator - dereferencing an iterator without incrementing
11147|Decrypt md5 using pass_salt
11148|Fetching users from Supabase results in /undefined user page
11149|How do you do AppBar docking (to screen edge, like WinAmp) in WPF?
11150|VS2022 - Can&#39;t view values of variables when exception thrown - Local variables and arguments are not available in &#39;[Exception]&#39; call stack frames
11151|Nextjs 13 new fetching method not working
11152|R function write.table produces new lines
11153|Next with testing library and Jest : error TypeError: Cannot read properties of undefined (reading &#39;firstName&#39;)
11154|boto3 - fastest way to get object counts in S3 bucket?
11155|React-js MUI Tooltip disappears on click
11156|I&#39;m having issue running 2 x worksheet_change(byval target as value)
11157|Disappearing side walls when merging extruded polygons in PyVista
11158|How to send email by vercel/nextjs (problem with server)?
11159|How do I recycle an IIS AppPool with Powershell?
11160|Limiting access to a Database to one Android/iOS application
11161|Project runs ok, but when project bin folder copied to other machine, getting FileNotFound on Microsoft.Data.SqlClient
11162|NodeJS Streams - End a read stream in pipeline but still process the chunks already readed
11163|VS code-server starting service issue
11164|MongoDB Query filter not working (NextJS)
11165|ngx-translate import translations after user has autheticated
11166|Logging Snakemake&#39;s own console output - how to change what file Snakemake logs to?
11167|Add custom stock status in WooCommerce treated as out of stock
11168|&quot;TypeError: method() takes 1 positional argument but 2 were given&quot; but I only passed one
11169|How do I move parts of multiple strings underneath each other?
11170|This pipeline code runs fine as Direct runner but gives error when running on Dataflow runner &#39;name &#39;read_inputpath_date&#39; is not defined&#39;
11171|How to change fontcolor in a pdf globally?
11172|Python: rank all values in a dataframe based on their similarity to an external value
11173|AdMob rewarded video ad shows impressions, but no earnings, what is it?
11174|ValueError: Layer &#39;lstm_cell_2&#39; expected 3 variables, but received 0 variables during loading
11175|How can i get Server in my connection string using SqlConnectionStringBuilder?
11176|Remove GPS coordinate outside a study area
11177|&#39;command not found: next&#39;
11178|RestTemplate--&gt; Exchange produces: 422 Unprocessable Entity
11179|visual studio unable to start program access is denied
11180|DJango not finding static files, despite STATIC_URL and STATIC_ROOT set
11181|Deserialize Json.net in VB.net for an array of an array
11182|Unable to start program, access is denied
11183|Visual Studio Code and Jinja templates
11184|Lower latency from webcam cv2.VideoCapture
11185|BeautifulSoup extract XPATH or CSS Path of node
11186|Pack and pass variadic template args to another template class
11187|Join and Having - get the accounts that appear more than once in the contract table
11188|Connection between Python &amp; Postgresql Docker Containers Issue
11189|i have install fs module but still i got the error that module is not foud
11190|Visual Studio debugger error: Unable to start program Specified file cannot be found
11191|Too many prisma connections in my NestJS code
11192|How do you dynamic change the content of a meta tag
11193|NEXTAUTH_URL not being recognized by NextAuth
11194|Update my database after a payment is made using paypal
11195|Power Automate export excel file automatically
11196|Listen for a scroll event in &lt;object&gt;
11197|Powermock Compatibility with JDK 17
11198|I&#39;m having trouble running a (AWS batch) that requires a parameter called ContainerOverrides
11199|Building an Expression tree for navigation property item in code
11200|How to create a DLL from a VS solution build by CMake
11301|How to import Gson with makefile
11302|&quot;cannot resolve symbol R&quot; in Android Studio
11303|db2 case/cast declaration issue
11304|Why the touchable area of a menu isn&#39;t correct in SwiftUI?
11305|Weapons are dissapearing when the player has a package on
11306|How to build expo app with Xcode, without metro
11307|How to embed Swagger UI into a Vue component?
11308|Multivariate Gaussian Distribution with Noise
11309|DAX expression to return filtered dates from an other column
11310|How to install these specific packages to `amazonlinux2`
11311|Rector how to avoid formatting source code?
11312|how to remove placeholder in divi contact form by using javascript
11313|Highest high and lowest low between a time frame and drawing a rectangle for visual for an X amount of days
11314|Airflow SFTPHook transport.py Authentication (password) failed using Private Key
