2451|Add a delay before block placement (Minecraft Forge API 1.19.2)
2452|What technologies should I use to create reusable services across multiple platforms?
2453|The request matched multiple endpoints,The error is reported when accessing the api is .net project
2454|How can i automatically add a configuration file when a repository is created on github?
2455|Intellij Smart Tomcat Plugin
2456|How to use Pretrained Hugging face all-MiniLM-L6-v2 mode using java Deep Java Library
2457|Audit DB in Nestjs and Typeorm
2458|POST request routes in the routes/backend folder are not working While upgrading my laravel project from 8 to 9
2459|why my twitter profile photo looks like this
2460|Get Enumerated type by Inc(type, Index) says Left Side cannot be assigned to?
2461|how to make element center in customized react-slick?
2462|How to have a notification similar to Twitter Toast/ notification in Android Studio?
2463|is there any way to read the shared preferences data without modifying the native android app code in flutter?
2464|Pytorch FCN SHAP plotting bug
2465|Swift: task {} before iOS 15?
2466|Lottie animation slow android
2467|Why vscode find bar doesn&#39;t work properly?
2468|C# .NET 6 : custom service is unable to being resolved while its controller is activated
2469|Training network to reproduce handwriting
2470|addDynalink with multiple fields
2471|Is it generally possible to cache an access token on a resource server (for a short time), even if it may expire?
2472|How to properly build an array of keys which match a type&#39;s keys in TypeScript?
2473|Copy activity - Excel ordinary mapping issue with Range
2474|How should I convert below code in snowflake?
2475|Ansible amazon.aws.s3_object download object with wildcard or pattern?
2476|Not getting output using flutter
2477|Webpack bundle served to Firebase hosting incomplete, no issue using Webpack server
2478|Three.js application automation using cypress
2479|Updatation regarding moment bower components
2480|useEffect wont change updates in reactjs
2481|When storing AWS load balancer logs in S3, how do I pass the S3 prefix to Loki when using lambda-promtail?
2482|Update ACF fields in Wordpress admin using Ajax
2483|How to route from one nx app to another nx app on a different localhost port with react router dom
2484|How to Dynamic import of global css in Nextjs?
2485|Running a pre trained ONNX model - image recognition
2486|Replace dot with comma of text which is not in DOM while loading
2487|How to make multiple color using apextchart and highchart?
2488|Angular form data binding not binding data
2489|Attempt to read property &quot;name&quot; on int - Laravel
2490|Perforce Importing folders from separate streams to same folder on workspace
2491|After Updating to Angular 13 , the coverage report getting generated is empty
2492|Azure Active Directory B2C Phone Sign Up/Sign In Filter to Certain Countries
2493|C# Windows Forms Using FFMPEG to change video format got no response
2494|.net core api change uploadReadAheadSize in webconfig ONLY or in code
2495|typename followed by three different variables
2496|REST API with Non-Blocking Embedded Resources
2497|VSCode. How to reload theme after editing its style
2498|vuejs checkbox within a v data table header sorting
2499|Receive messages from WhatsApp From WhatsApp API using Nodejs
2500|Spring Boot: NullPointerException while saving two entities at the same time
2501|What&#39;s the whole point of a JWT refresh token?
2502|Make .gitignore ignore everything except a few files
2503|Kafka connect mirror maker latency issue from cluster to cluster
2504|how to loop through data in vuejs
2505|Maatwebsite excel set watermark in laravel
2506|python code in bookdown Rmarkdown does not run
2507|Trigger multiple triggers at once
2508|What are current auth.net endpoints?
2509|Winforms async delegate - VSTHRD101 or VSTHRD110?
2510|Android camera application (where is on file system locates *.apk)
2511|Huggingface - Pipeline with a fine-tuned pre-trained model errors
2512|Can&#39;t pull json data from service into component to display
2513|Memory issues after migrating App Engine Standard app from Java 8 to Java 11 with bundled services
2514|I want the javascript code to attach in the form that could change the file extension of any images attach into .Webp before saving it in the database
2515|My Python Jupyter Notebook won&#39;t display the map I&#39;m trying to generate
2516|How do I get drop-downs with non-selectable sub-headings and empty rows ignored in Excel 2019?
2517|Adding tikz image to Quarto with cross-reference
2518|Throwing an error when try to get data from laravel passport multi auth implemented app
2519|Combining stdin prompt with the output from sub process
2520|Flutter: StreamBuilder uses old stream instead of new stream
2521|I want the textbox to input URL to webview
2522|Why do my grafana tempo ingester pods go into Backoff restarting state after max_block_duration?
2523|Is there an easier way to compute derivatives of vector-valued functions with respect to parameter matrices in Pytorch?
2524|Vulnerabilities found in npm@9.6.6 which is latest version in strip-ansi
2525|Convert 1d array of strings into anchor hyperlinks by applying the strings as the href and text of &lt;a&gt; tags
2526|How can I include the CSS rules from classes added to blocks in the Gutenberg editor using the REST API?
2527|Project Stats in ADO
2528|unable to create bean error with name &#39;entityManagerFactory&#39; bean
2529|The CNN model to segment lower jaw from panoramic dental x-ray based on UNet Architecture is not working even after several attempts
2530|Moviepy textclip with pango method not working
2531|sorting k block array in best time
2532|how can I show the date in a columns header every day with total?
2533|Multivariable function using two list
2534|Webpack - ReferenceError: global is not defined, in next13
2535|MySQL LOAD DATA ignore quotes
2536|To use &quot;Expression4J library&quot; in my gradle project using java
2537|Laravel: HTML in notification
2538|Oracle BI Publisher Scheduled Report to FTP File Name
2539|SQL Aggregation in oracle 11g or 19 version using duplicate columns
2540|How to know service status of Google reCAPTCHA v2 and v3
2541|Javascript Regex: get specific parts inside brackets without taking extra brackets
2542|Upload file to Amazon S3 without SDK
2543|WARNING: Unable to resolve crossref for figure in quarto html file
2544|Sqlldr to upload data doesn&#39;t work correctly and loads data into different columns
2545|Input field for PIN code
2546|Table visual with customized grid layout in Deneb (Vega-Lite)
2547|Ajax call does not work second time. controller action is not hitting second time
2548|ASP.NET Core Web API : multiple controllers
2549|Cypher read CSV, add label to dataset and create index
2550|How to run a gitlab-ci.yml job only on a tagged branch?
