13123|Looking for potential alternatives to &quot;auth.userDetailsService(this.userDetailsServiceImpl).passwordEncoder();&quot;
13124|Is &quot;hello&quot; a thunk or in normal form?
13125|How to find the extra rows in a new dataframe that are not present in the older dataframe?
13126|Catch Blazor error &quot;The following routes are ambiguous&quot; at compile time?
13127|Creating a child database in a new page in Notion API
13128|How can I mix between a ssr component and a client component in Nextjs 13?
13129|Generate all possible combinations for Columns(cross join or Cartesian product)
13130|MS Access 2016 TransferSpreadsheet Import Error 3274: Not in the expected format
13131|How to declare class in python
13132|web scraping of concurrent review pages
13133|how to add previous rows for all dates based on some ID if data does not exist in SQL
13134|How do i a coordinate transformation for all vertices of an object
13135|How do we get Exchange online to identify Sendgrid messages as TreatMessagesAsInternal?
13136|Fail playbook if hostname from variable does not resolve to an IP from ansible_facts
13137|How to import npm pacakge from clojurescript?
13138|My foregrund that publish a notification periodically doesn&#39;t work in Android 13, but it works in Android 8.1 (MAUI Android)
13139|Workflow progression in Argo Workflows
13140|How to allow user to paste image on web page?
13141|A container with three divs and a display of grid; but the third div gets pushed down although it has space above it
13142|What is the most performant way to rewrite a large IN clause?
13143|Pre-filled forms in PopUp Modal ASP.NET Core MVC
13144|Unassigned variable
13145|Is there any way to view/download the script/files that are hidden in SuiteBundle in Netsuite
13146|DOM not updating after async fetch in polymer.js
13147|Bytestream upload of content-type: application/pgp-signature differs after updating resteasy
13148|How to import the header file in dart via VsCode?
13149|Flutter - Checking if a data has changed in Firestore
13150|audio analysis in python librosa
13151|How can I configure Swashbuckle to hide curl command and responses table?
13152|Add custom props to GetServerSidePropsContext in NextJS
13153|Module was blocked because of a disallowed MIME type (&quot;text/html&quot;)
13154|Why use &#39;g++&#39; instead of &#39;gcc&#39; to compile *.cc files?
13155|How do I fix validation error in my nodejs + moongose api?
13156|Using Firebase Analytics with SwiftUI
13157|Check what symbol a given modifier and keycode combination would produce in a browser?
13158|How can I output only captured groups with sed?
13159|i am trying to make a pause function with space key but it seems i cant even get in the pause function
13160|How to parallellize an adaptive time stepper with Dask
13161|How to resolve when Selenium partially crops emails when it scrapes?
13162|Jenkins npm install didn&#39;t work, SSH: Transferred 0 file(s)
13163|Is there any overhead when using ASGI based FastAPI for AWS Lambda?
13164|How can the Math behaviour of Java 8 be achieved in Java 17?
13165|How to select the row that is the last row of a group in pandas?
13166|Firestore not reading from new Collections
13167|Detect pivot high with at least 2 green candles and at least 2 red candles respectively in the left and right side, vice versa for pivot low
13168|How do I programmatically add a keybinding in a VS Code Extension
13169|Why does the snake lose control when its length becomes more than 30?
13170|Which 2d barcode has the highest data capacity/density
13171|Reading and inserting spanner data using dataflow
13172|Changing the color of an axis
13173|Tkinter coloring specific words in buttons
13174|EJS syntax error, not able to compile the file?
13175|My request to fetch all findMeetingTimes is only limited to 5 times using the graph library
13176|How do I resolve Unknown PdfException when using itext7 in. net maui
13177|Space between each character in Teradata mLoad target table
13178|How to stop one or multiple for loop(s)
13179|How to restrict WooCommerce cart item quantity to one for specific item
13180|I&#39;m unable to push a new route when using ShellRoute
13181|Handle conflicts on both primary key and foreign key while inserting new rows in Postgres SQL table
13182|Listener always active
13183|Allow date only 18+ years in input field type=&quot;date&quot;
13184|Why is `colSums(A, ,2)` valid syntax? - looks like an empty argument
13185|Intellij - can&#39;t commit folder, yellow filename
13186|how to show the notification data in new activity using firebase and show the content in Activity
13187|Why are emoji characters like &#128105;‍&#128105;‍&#128103;‍&#128102; treated so strangely in Swift strings?
13188|How to find a release by the merge request in GitLab API?
13189|python events and joystick
13190|Make an object list out of object list in dart
13191|PHP regex to remove all HTML attributes in tag except specified ones
13192|How to insert data in mongodb using mongoose in typescript?
13193|Mac Catalyst Font issue on export
13194|"Can&#39;t create pipenv 3.10 environment | AttributeError: module &#39;collections&#39; has no attribute &#39;MutableMapping&#39;"
13195|How to to upload a Python code including an OpenAI API key to my GitHub Repository with out OpenAI recognizing it as a Security leak and disable API
13196|Search for specific values in a column and its corresponding data from rest of the columns
13197|Decoding troubles
13198|Print formatted answer Date and Profit Tuples
13199|Multiple borrows of self with while loops and tokio channels
13200|BigQuery Python API copy_table copies schema but not data
13201|Check for a private http call
13202|@Entity table isn&#39;t getting generate in mysql
13203|Postgres password and user change in Plausible Analytics with Postgres:14-alpine docker image
13204|Custom Menu for Mac Catalyst App in Objective-C
13205|Remove NAs from SpatialPixelsDataFrame
13206|How to use the react-query result inside the QueryOptions
13207|Apache Beam IO in Go: sql: unknown driver &quot;cloudsql-postgres&quot; (forgotten import?)
13208|Setting (and getting) a Symfony (Shopware 6) Subscriber class array from a function
13209|UserDefaults Error in Mac Catalyst App, Recommended solution doesn&#39;t work
13210|Can anyone could help me debug this Reversal Distance function
13211|Stacking data into one Column in Excel. Tried TOCOL and VSTACK but it cant ignore formulas or pasted cells. It still leaves gaps
13212|Error in creating generic DefaultKafkaProducerFactory in Spring Kafka
13213|UIDatePicker Not working In Mac Catalyst (Xcode 11 Beta 5)
13214|Redirect via Api Token doesent work within Flask App after setting reverse Proxy
13215|Would like a universal way to split different strings into multiple parts using PowerShell
13216|How to show matplotlib subplots in Dash?
13217|React-Native-SVG: Masked elements pixelated in android emulator
13218|Binding to command in control works only one time after triggering visualstudio hot reload feature
13219|VBA code in excel that changes color fill of duplicate values when the duplicate value changes
13220|VBA - Filter Friday to Sunday rnage when TODAY is MONDAY, else Filter by Yesterday
13221|takeUntilDestroyed() can only be used within an injection context
13222|Open PDF manual after MSI installation
