14923|Unity URP shaders invisible
14924|Kendo UI Validation Error message being placed on wrong field
14925|Ext.Ajax.extraParams: Add a new parameter sent by default
14926|How to train the model to test the web application across the multiple page?
14927|Spring data elasticsearch - in on string list returns no result, integer works fine
14928|How to add default value to array using foreach
14929|Using Curl in a multithreaded environment on Linux
14930|How to view the comment from specflow test case in visual studio test explorer&#39;s test log?
14931|copy error in jenkins pipeline in a remote server
14932|Create responsive tile layout with CSS Grid
14933|Deploying Django App to Azure Storage Error
14934|Angular can&#39;t use HttpClient in external library
14935|System.IO.FileNotFoundException while serializing a class to XML
14936|Canvas is already in use. Chart with ID &#39;0&#39; must be destroyed before the canvas with ID &#39;idpService&#39; can be reused
14937|How to restrict particular namespace docs to load in MarkLogic?
14938|How do I get the lookup objects field history tracking to show up in the related list of the child object?
14939|How to disable Audit Removable Storage on partition D:\
14940|HTML canvas upscaling/downscaling algorithm with CSS (image processing)
14941|How to convert Epoch datetime into standard timestamp with milliseconds in Python?
14942|Apply a Shader on RealityKit Scene
14943|How to make a list with counts and percentages of different categorical variables in R
14944|Vue 3 router not going to fallback page cannot GET error
14945|How do I see/debug the full source in .vue files?
14946|How to create a huge table (about 1000000 rows) without running out of memory on the machine
14947|Input of type = &quot;file&quot; doesn&#39;t respond. Pop-up window for choosing a file doesn&#39;t appear
14948|How to fix error: count(): Parameter must be an array or an object that implements Countable
14949|PowerShell programmatically set input field by name in IE
14950|Terminate called after throwing an instance of &#39;char const*&#39;
14951|Warning: move_uploaded_file
14952|clang-format: designated initializer: One member per line
14953|Problems with micro mutable resolver
14954|Replace key in find_or_create_by by a variable
14955|Watson Discovery v2, count documents into a collection
14956|send from the UI a nested object file
14957|Laravel mail&#39;s attachment missing from production but works in localhost
14958|Three.js: Huge Chrome Performance Issue on Intel Macs
14959|Creating a column with sum of multiple columns grouped by name in panda
14960|Finding (and highlighting) URL text fragments in a web page
14961|I tried to use the chat gpt 4 in google sheets, but the api is not working. how do i fix this?
14962|The error was: &#39;list object&#39; has no attribute
14963|Please can u help out with this code error (I&#39;m using google collaboratory) and also check the program as a whole
14964|How to reply in thread from slack bot using JBot
14965|NTP synchro issue
14966|Remove namespace prefix from node-soap server response
14967|div.remove, sibling div input becomes unclickable, becomes clickable on toggle developer tools
14968|Turning html into text with proper indentation in Python
14969|How to use AutoMapper and DTO&#39;s with two connected tables in ASP.NET 6?
14970|Using Python and Google Places API, how can I get the Place_id of a specific place at a given address?
14971|how to match and add column in the multi-dimensional array in PHP
14972|Graph api Update event not working properly
14973|Node.js Method Not Allowed
14974|How to use Swift in React Native Turbo Modules
14975|401 Unauthorized error when retrieving dependencies from Sonatype Nexus in Docker
14976|Scalling Grafana alerts dynamically
14977|OLE DB error has occurred. Error code: 0x80004005. The INSERT statement conflicted with the FOREIGN KEY constraint
14978|Disable Swiping to Specific Tab
14979|Unable to Use Google Sign In Button with COEP &amp; Helmet - NodeJS &amp; ExpressJS
14980|Cumulative Sum for Date Difference
14981|Creating multiple resources in different regions of the same AWS account
14982|Is it possible to use react-datepicker with react hooks forms?
14983|How are the bytecodes for MIPS nop and sll differentiated?
14984|&#39;add-apt-repository&#39; command gives Traceback error
14985|Autohotkey Hotstring English Contractions
14986|languages parsed with recursive descent
14987|Python Hybrid Inheritance
14988|System can&#180;t find the file
14989|SQL query with R dbGetQuery()
14990|How to add row into table with only autofilled fields on db site?
14991|SPF failing when seding messages from SES to mail group
14992|JSONException: Unparsable JSON string in TipoControllerTest.updateTipoTest
14993|Unable to use transactions in a local standalone Gemfire Client-cache
14994|cant convert data from api to excel with python
14995|Problem with Publish app for the webOS from Avalonia
14996|Expand rows by date range using start and end date
14997|Testing for undefined variables in Ruby a la JavaScript?
14998|How to change position of chevron on &lt;select&gt; with Tailwind?
14999|Get information from another macro / annotated struct
15000|unsupported operand type(s) for -: &#39;datetime.datetime&#39; and &#39;NoneType&#39;
15010|Thingsboard, Posting Data to Two Seperate Devices From One Physical Node(ESP8266/32)
15011|Add a specific directory off a submodule git
15012|Firebase Storage Can&#39;t Connect, Retry again
15013|Pandas merge inner join returning empty dataframe
15014|Reversed geom_text() in stacked bar chart (ggplot2)
15015|asio and &quot;streaming server&quot;
15016|flex display for label tag taking space at the bottom for bigger text
15017|terraform variable type error : Attribute must be a whole number
15018|Assert a string contains a substring X times - XUnit (C#)
15019|How to directly get Node instead of NodePath in export variable?
15020|List of supported dbms values
15021|In NiFi how do I remove something put into the distributedmapcache?
15022|java.net.ConnectException: Connection refused: connect in eclipse
15023|Get columns of a two-dimensional array and place them in a one-dimensional?
15024|In my struct array, I have a pointer in the struct. If I assign a value to the pointer, the program hangs indefinitely. Why?
15025|How to make routing work with react, express and ionic?
15026|How to make Plesk Real-Time Replication form one plesk to another
15027|Zero initialization using the best and easy solution
15028|The program must be compiled several times to produce the correct result
15029|How to pass an arraylist to a fragment from adapter?
15030|JavaFx Mediaplayer Import for jdk 19 doesnt work
15031|Unable to access mounted GCS bucket from within Vertex AI Jupyter Notebook
