2141|I want to call a Java method using a 2D array of values. How do I set up my for loop to call the method correctly?
2142|how does the red color box mark line add?
2143|MapBox, can it use the z-coordinate in a GeoJSON file to make lines &quot;hover&quot; over the ground?
2144|Bulk insert in elasticsearch datastream using elasticsearch-java 8.6.2
2145|Question about changes of UserType in Hibernate 6.X
2146|How to limit the number of loop of one agent in a block in anylogic?
2147|How can I add duplicate parameter in POST request in PHP
2148|index out of bounds of array after inputting names
2149|SQLPro Server Objects
2150|Yii2 problem with custom URL with opional param
2151|Using Socket.io with Next.js
2152|SQL/PHP, if statement does not return query as empty if the row is empty
2153|Unable to explain why my Python based Azure Function is not appearing when using GitHub actions to deploy
2154|Calling Rekognition using AWS CLI
2155|Why does iterating over a BufReader.lines() in a Server and Client doesn&#39;t end until I explicitly break the loop in the server
2156|Oracle SQL select from multiple condition but with has same id&#39;s
2157|why is undefined useSession data after excuting signIn callbacks and redirecting create user page
2158|Omnibus GitLab on IP without a domain-name and with custom relative_url_root
2159|oracle apex interactive grid fetch records from another table
2160|Spring Boot OAuth 2 Authorization Server JWK value is different when there are multiple instances and JWT validation at the resource server fails
2161|I am trying to write VBA Script for running SAP T-code ZN_BSEG
2162|How to get the value from a color range scale when the value changes? (fusioncharts)
2163|We have redirected moodle application to nginx. It&#39;s not working properly in Ubuntu Server
2164|How to pass id (a variable) from one html page to another html?
2165|C# WinForms Large offset when adding rows to TableLayoutPanel
2166|How do you add a newline to the end of a string in C?
2167|is there any firebase storage rule from console that prevent download and print pdf document?
2168|How to detect if today or tomorrow is the 2nd or last Wed of the month in Java?
2169|How to make QWebEngineView go fullscreen [Qt 5.8]
2170|Python - datetime library
2171|EXEC : error GQL: An item with the same key has already been added. Key: JSON
2172|Stripe isn&#39;t retrieving invoices with test clocks
2173|Is it possible to distribute the documentation along with XCFramework?
2174|Jetpack compose how to make buttons after LazyColumn
2175|Why does this code can&#39;t use on Teachable?
2176|Why is Omnisharp showing a nuget package downgrade for Entity Framework Core after upgrading to .NET 7.0?
2177|issue in filerobot-image-editor.min.js in manifeast file of my plugin says Refused to execute inline script because it violates the Content Security
2178|What is the benefit of upgrading the Hangfire database schema?
2179|Create an affinity to mouse and center of the screen with mouse move
2180|Jupyter Kernel taking too long to start and sometimes gets stuck
2181|Flutter e-commerce app auto debit in wallet after purchase
2182|The `(not set)` data of `sessionGoogleAdsCampaignName` in Google Analytics 4 Data API disappeared
2183|Efficient implementations of CUDA architecture
2184|Hel please i got stuck, Uncaught ReferenceError: login is not defined
2185|Creating a chessboard in PIL
2186|Checkstyle SuppressionFilter Module Initialization Error
2187|TableViewCell Xib width not matching the TableView width
2188|How to dynamically choose what concrete class to use in dependency injection
2189|poetry Virtual environment already activated
2190|Invariant Violation: expected hoisted manifest for ngx-build-plus in yarn install
2191|Embedding Facebook Ad Preview iframe to Google Slides Dialog Box using Google Apps Script?
2192|Jest configuration in Angular 13: transform not working
2193|how to detect onchange event on particular cell in editable mode in AgGrid React
2194|Trouble rendering custom fonts in TWebBrowser
2195|Can&#39;t register a new user react/django/redux
2196|Passing variable to an exception
2197|Unable to locate file in Vite manifest: resources/sass/app.scss
2198|Error: unable to insert an object of type list cell in the selected location
2199|How to check if a username exists in my Golang chain code for Hyperledger Fabric?
2200|iOS taptic selectionChanged not firing for UISegmentedControl
2201|How safe is sqlx compile time checks?
2202|how to call Soup webservice according the WSDL file use axis when there is header info
2203|How to read multiple multivariate csv files to train Transformer
2204|Testing for collision between circle and rectangle in Pygame
2205|Ruby .concat error: Nomethod error occurs at end of loop
2206|Vncserver not connect /.vnc/xstartup: 13: gnome-settings-daemon: not found in EC2
2207|Flutter installation failure
2208|Writing elements to an array from a txt file overwrites all elements rather than specified index
2209|How can I do Unstack of two columns like the one in Minitab
2210|Which kind of Relationship should i give between the Tables in Sequelize when i do multiple inner join which depends on 3 tables
2211|lambda expressions are not supported in -source 7
2212|populate array of ids from same same collection
2213|gosu error: failed switching to &quot;root&quot;: operation not permitted
2214|InfluxDB - Unauthorized Access Issue
2215|How to return one field from a query (Spring Data Elasticsearch)
2216|Why I got error of some methods that are not defined for dynamic links?
2217|VBA - Can&#39;t save workbook due to a naming error. (Error 1004) Not sure how to fix the program
2218|In React Native when trying to render an images from fetch, the same images are output. How to fix ot?
2219|How SOAP header should be added in Dynamically invoked web service using c#?
2220|Android Studio Calculation Result not response
2221|Unhandled Exception: Bad state: No serializer for &#39;SignIn&#39;
2222|How to resolve spring-boot-starter-mail:3.0.6 dependency vulnerabilities?
2223|How to overlay xy coordinates onto an image
2224|julia replace singlequote Dataframe replaces with \&quot;
2225|If package package-lock.json is present facing authentication issue
2226|Call JavaScript window method in WebView React Native
2227|JasonWebToken Expired and Malformed on different machines causing Infinite Loop
2228|Duration column type is returned as custom type
2229|Loop through several FITS files in a Desktop folder
2230|Moment.js Filter out a object whose date property is not after current date
2231|Optimize the Gremlin Query running on Cosmos DB
2232|Using $function to execute javascript code in aggregation pipeline to quickly access property of a field that holds an object
2233|How to change Docker&#39;s default Image storage location in WSL2?
2234|Padding around ansible&#39;s blockinfile
2235|Need to use $timeout and $apply with requestAnimationFrame
2236|Org auto numbering of list with &lt;RET&gt;
2237|Is it possible to translate TypeScript declaration doc comments as they appear in hover info and suggestion descriptions in VS Code?
2238|What are some good examples of excel functions to start learning?
2239|Binary Executables in node_modules are not found in Github Actions Ubuntu Node image
2240|Exception: org.springframework.web.bind.MissingServletRequestParameterException: Required String parameter &#39;params&#39; is not present
