22525|How to ensure the same version of a nuget package is used accross the whole Visual Studio solution
22526|Elasticsearch Sink Connector Bulk request failed: Action/metadata line [1] contains an unknown parameter [_type]
22527|Error while building worker image from example voting app
22528|In Kubernetes Python pod, how to notify by email only one time everytime new file arrive in PVC?
22529|Express Sequelize, Does not Throw error when specifying wrong column name in create
22530|Show popup when user is not authenticated Django
22531|Verifying Stripe webhook in SvelteKit endpoint: how to get the raw body of a RequestEvent?
22532|How to label a line in matplotlib?
22533|How to get same color when plotting numpy image array for same pixel value multiple times
22534|Heroku Deployment Issue: App Deploys Empty, No Content Rendered
22535|Pyserial stopped communicating with Arduino Leonardo
22536|Creating a Woocommerce product item when publishing a post
22537|vb.net winforms, what is the e.handled = true equivalent for anything to do with column headers in a dgv?
22538|Content duplication issue in editor implemented in Vue JS, real time collab with Y.js
22539|Inconsistent feature names on ML model
22540|YouTube Live Streaming Overlay
22541|How to convert uint8 Array to base64 Encoded String?
22542|How to find the maximum saving in bits that could be made by using Run-Length encoding to an image of a particular resolution?
22543|Cant decode JSON string from GZIP back to plain
22544|Merging 2 maps variables in Terraform
22545|Send PDF to given Email using javascript/vue on click of button
22546|Reorder column by index number
22547|How to freeze the first position of the recyclerview and other position to be scrollable
22548|Publish WebAPI and MVC projects to same Azure Web Site?
22549|&quot;Failed building wheel for psycopg2&quot; - MacOSX using virtualenv and pip
22550|Finding echo&#39;s content
22551|How to get index number forEach iterable value in Dart (Flutter)
22552|vmagent lose only one metric&#39;s data point，what is the possible reason?
22553|get permutations of each line in file
22554|How to show temperature value that already indicated coordinates in URL. But empty screen seemed
22555|React JS: How to animate conditionally rendered components?
22556|How to load variable file dynamically in github actions workflow
22557|The k8s pod network eth0 has many RX dropped and TX dropped
22558|Jenkins Ext email showing address not configured yet - even after setting up the System admins email
22559|Dynamic getters in pinia - Vue 3
22560|Storing terabytes of records with minimum overhead
22561|How do I fix Error: could not create the Java VM?
22562|ASP NET CORE - net::ERR_HTTP2_PROTOCOL_ERROR 206
22563|Accessing a property of Range from a scripting.Dictionary item (VBA)
22564|Polling a web site while app is in background
22565|Load a Pandas Dataframe from excel in SharePoint
22566|No naming context bound to this class loader
22567|Postgresql: query date field with empty value
22568|Wagtail - Revisions for Non-Page Objects
22569|how to use qemu to emulate spi(a kind of Synchronous Serial Interface) flash device?
22570|What is the easiest way to download a file out of an ECS container to local machine?
22571|Is it possible to round the edges of a row in jetpack?
22572|Cleartext traffic is permitted by default in Flutter application
22573|Using LD_PRELOAD in jupyter notebook
22574|collecting information with NumPy
22575|Predictum indicator code anyone have full code tradingview
22576|PostAsJsonAsync C# - How to set headers correctly for POST request - BAD REQUEST 400
22577|Adding a column to count consecutive weeks an specific condition happens
22578|To change volume of the audio
22579|InfluxDB CLI 401 Unauthorized
22580|Public Pinning is iOS Not working with Almofire
22581|How we can connect the signals and slot with different arguments?
22582|Coverage-adjusted entropy estimation in Python
22583|ACF group data as care guide of woocomerce product to another page
22584|&quot;Indicate whether to send a cookie in a cross-site request by specifying its SameSite attribute&quot;
22585|A question about golang text/template print json
22586|Stata histogram with only one variable&#39;s value
22587|Any idea how to plot something like this &quot;Oncomap&quot;?
22588|No serializer found for class sun.nio.ch.ChannelInputStream and no properties discovered to create BeanSerializer
22589|Can&#39;t get Spatie Browsershot to work on Windows with XAMPP, few different errors
22590|How to get Active/Focus element in case of Shadow DOM?
22591|Dynamically change font size in react and tailwind css
22592|Laravel Spatie Multi tenancy can not access authorised routes
22593|Vue 3, call $emit on variable change
22594|How to remove bullet icons when using UnorderedList component from ChakraUI
22595|Error: &quot;Access to fetch at from origin &#39;http://localhost:3000&#39; has been blocked by CORS policy&quot;
22596|Mark code for stripping automatically based on attribute arguments
22597|can&#39;t fetch one part of data from API (d3)
22598|Android: Updating database from viewmodel and unit testing it
22599|ARIMA prediction failing due to &#39;When an ARIMA is fit with an X array, it must also be provided one for predicting or updating observations.&#39;
22600|css grid with tailwind css
22601|How to check whether an object is a date?
22602|BlobContainerClient from Azure SAS URI
22603|Should i use a global guard or different guards, the point is that i have a global guard and i need to exclude it for some request
22604|RS232 Mapping to docker container using Apple M2 Silicon
22605|Set ordering of Apps and models in Django admin dashboard
22606|Proc macro execution order
22607|Next.js Error Serializing `results` returned from `getServerSideProps`
22608|Passing a Distance Matrix to sklearn&#39;s K-Means Clustering
22609|-webkit-mask-box-image showing the masking image in sets of 4
22610|SQL and Oauth saving user into the database
22611|How to change content direction of Popover
22612|Pass str as an int array to a Python C extended function (extended using SWIG)
22613|How to fix the chrome extension installation warning &quot;This extension is not trusted by Enhanced Safe Browsing&quot;
22614|react-skeleton-loader-pulse dependent on prismjs which is vulnerable
22615|Running standalone app using QWebEngineView created with PyInstaller on MacOS gives Couldn&#39;t mmap icu data file
22616|Message &quot;error: resource android:attr/lStar not found&quot;
22617|How to show data of a web page in a custom layout?
22618|what does sha256 actually do?
22619|Passing each element of a List through a function and then into another List
22620|How to compile liblzf on windows
22621|iOS 7, corrupt UINavigationBar when swiping back fast using the default interactivePopGestureRecognizer
22622|Java System Level deployment Malformed deployment.config file
22623|Building a .net core restful api and I need to return a byte array of an image in the response. The image first needs to be converted from html
22624|Error occurred while connecting MySQL database with React project
