3761|Save a file from PDF Writer
3762|How can I group by a column but return rows with null too?
3763|Rabbitmq and SMTP do not send a email
3764|How to replace NaN values with the correspondent month and hour mean value
3765|sklearn.preprocessing.PowerTransformer returns the same values for different inputs. How can I deal with it?
3766|A directory corresponding to fileSystemPath &quot;assets&quot; could not be found
3767|Crystal Report Date of Maximum Value
3768|plt.imshow() of a single color image showing as black
3769|How can I make different backgrounds for multiple selectors in CSS?
3770|Please how do i solve this problem: Cast to Number failed for value &quot;{ &#39;&amp;gt&#39;: 40 }&quot; (type Object) at path &quot;price&quot; for model &quot;product
3771|SQL Vlookup Value in Same Table to Get Value From Another Table
3772|How to count grapheme clusters or &quot;perceived&quot; emoji characters in Java
3773|Fade out text on horizontal scroll
3774|How do I make a functioning clock in C that first prompts the user for the start time of the clock and then increments in seconds from that starting T
3775|Draw a closed surface using mesh3d
3776|IPython notebook: How to connect to existing kernel?
3777|How to use s3 accesskeyId and secretAccessKey for assuming a role with HTTP api
3778|How to disable Android emulator console log debug message in Flutter?
3779|How To Rate-Limit Google Cloud Pub/Sub Queue
3780|Can I pass a custom text argument to the command palette in vscode?
3781|VSCode Extension Authoring - Storage for app secrets?
3782|Having AttribueError
3783|Cannot update a component while rendering a different component warning
3784|User agent stylesheet overriding module.css in create-react-app
3785|Blazor server app, .Net Core Data Api, SQL Server and Windows Authentication impersonate / pass credentials question
3786|How can I create an entrypoint.sh for my AWS ECS Task Definition to use for a temporary development shell console for shell_plus?
3787|How can I display a table&#39;s results using a Go button rather than an automatic search?
3788|Computing the complexity of a function that contains two consecutive functions
3789|testcafe api testing using roles for authentication
3790|Custom validator with multiple conditions and data in Kotlin?
3791|Make the + button tab not able to be selected
3792|Obtain the rotation vector/axis of canvas in vpython
3793|Form Data Not Sending on Safari/Firefox iOS
3794|ThreadSanitizer (TSan) instrumentation using LLVM opt and TSan passes
3795|How to detect digits from image by using Tesseract 5?
3796|How to considered only modified folder into github actions
3797|How to combine lists of object within single Mono?
3798|[Power Automate - Http Response Task]Outlook Adaptive Card &quot;CARD-UPDATE-IN-BODY&quot; doesn&#39;t update if task is configured to Asynchronous
3799|My site is not displayed on the local host, but only html Welcome ginx. What am I writing wrong here?
3800|How to dockerize and deploy an Express backend and a React frontend app talking to each other using Websockets without CORS
3811|Data grid, Maximum call stack size exceeded ERROR
3812|The line of code is not appearing in my email on Outlook desktop
3813|Unity Intersection of two game objects without changing the position
3814|Print Log4j2 output into JTextArea
3815|Copy Chrome Desktop Settings from One Computer to Another
3816|Is MimeKit / MailKit able to create Outlook .msg files that can be saved to disk?
3817|The keychain access group is not enabled
3818|Decoding Uint8Array to readable string
3819|Confused about the TinyMCE image plugin documentation as far as drag-and-drop, etc
3820|Getting aws cognito token in aws-amplify ui-react
3821|SELECT CASE expression, COUNT(*) aggregate to include 0 when no rows match a case
3822|Creating a link to a named range that is found using a formula and is specific to that sheet
3823|Nuxt3 / Netlify - Form not sending data (no errors)
3824|PostgreSQL find missing attributes for each entity
3825|How to get this checkbox filter code to work?
3826|Angular 8 @HostListener(&#39;window:scroll&#39;, []) not working
3827|debugging node.js with node-inspector
3828|Deploy kube-prometheus-stack with Kustomize don&#39;t work
3829|Child element grow to height of overflow
3830|&quot;Shared Folder&quot; disappeared in Excel after an Office 365 update
3831|What is the most appropriate way of defining the dependencies of a Python project (requirements.txt vs pyproject.toml)?
3832|Speech is not recognized via microphone in python speechRecognition module
3833|LINQ Query for searching with Input Array to a database column where it has multiple item with comma seperate value
3834|Error eager loading roles with users laravel permissions
3835|Using async await with setImmediate
3836|HttpClient Api form data upload file
3837|setImmediate vs. nextTick
3838|Flink Operator High Availability - Service is temporarily unavailable due to ongoing leader election
3839|Is it possible to style shinyWidgets radio buttons with CSS while using bs_theme?
3840|How to send a TCP FIN through python socket and still write to it later
3841|Add logic to a gitlab pipeline to deploy AWS or Azure resources using terraform
3842|Github not loading css file when deployed by github pages
3843|Azure redis deployment failure terminal provisioning
3844|Save NetworkX tree in newick format
3845|Merge tabs in a tab
3846|hosted zone with subdomain
3847|Can we create a custom policy in azure to prevent the deletion of the resources in a subscription?
3848|Go update all modules
3849|uploading an image to AWS using react-native-aws-signature
3850|Calling Bigquery Stored Procedure from Google Data studio
3851|Use of the @ symbol in C programming
3852|Configuration of Django Channel with Redis secured with SSL
3853|Unclear about the purpose of using H2O.ai
3854|how to convert whole html file with multiple pages into pdf using python( already use pdfkit module)?
3855|Why isn&#39;t it possible to add a function call that should result in a list to a other list in python
3856|How can I get a value out of inquirer.js?
3857|Include a Folder in ClickOnce Application
3858|Why Promise.reject().catch(() =&gt; 5) valid for Typescript
3859|How can I change the query used to export price lists?
3860|An easy way to check and request Maui permissions, including Bluetooth?
3861|Angular DomSanitizer replacing new line characters on textarea fields
3862|Use Google Sheets API in PyScript
3863|C read strings from a file with complext format
3864|Ordering Docs Snapshot By Time Firebase V9
3865|How to trigger a popup in nextjs with other components?
3866|Quick Excel Formula - Reorder Array
3867|Laravel 9 Storage images error 403 Forbidden
3868|How to call javascript function in ZK
3869|Passing data to a React component
3870|Get bibliography references in text order when using `rticles::elsevier`
