7291|Configuring dockerized fluentd to receive log lines from remote source
7292|Namespace &quot;Microsoft.Web/sites/hybridConnectionNamespaces&quot; missing?
7293|./containerlaunch.sh: line 6: update-ca-certificates: command not found
7294|Jupyter notebook can&#39;t find environment
7295|Unresolved reference: AlertDetails
7296|Compile error after migrating from node-sass to dart-sass
7297|How does unbounded preceding and current row work exactly?
7298|kubelet error: Failed to start ContainerManager failed to initialise top level QOS containers: root container /kubepods doesn&#39;t exist
7299|Mysql 8 (aurora) not using index
7300|Automatically open Jira ticket for issues in Snyk
7301|How to solve this error &quot;failed to create default projectstack: SequelizeUniqueConstraintError: Validation error&quot;?
7302|Mailchimp - success message to clear the success message after the user has submitted the form in React
7303|How do I use row or .fields as an alternative to asterisk() in jOOQ?
7304|How to Resolve Axis Aligned Rectangle to Rectangle Bounding Box Collision in Javascript?
7305|Unable to disable javax.persistence.validation in SpringBoot 2.7.9
7306|Matlab connection string to a local Postgres Db
7307|Android notification icon is blank on some devices
7308|Problem in setting metadata and thumbnail per page without server side rendering
7309|REST API that allows CRUD based operations on its objects
7310|FastAI appends `models/` prefix and `.pth` suffix to weights file path
7311|.net6 linq: query entries from Database with same set of variables
7312|Does the nuget package Microsoft.Data.SqlClient work with Entity Framework?
7313|What&#39;s a video for a CNN?
7314|Can&#39;t get Spring @CacheEvict to work
7315|How to use Material Icons in Google App Script&#39;s Addon Card widgets (DecoratedText, ImageButton)?
7316|Send and receive data to ZeroMQ socket from outside cluster using load balancer kubernetes
7317|How to convert string to Keys
7318|Keras sequential needs nearly all gpu memory
7319|creating a dashboard for monitoring Kubernetes clusters in Azure
7320|How to execute custom script while merge two GitHub branches on the code of child branch
7321|My Javascript Unit Coverter will not display the converted units
7322|how can i change the color of my svg when hovered?
7323|How to speed up Mongodb text search, while searching for words that start with a sequence
7324|dotnet build error on linux: sh : warning : setlocale: LC_ALL: cannot change locale (en_US.UTF-8) [/home/j/code/tictacgo/UI/UI.csproj]
7325|How to get a value from another HTML page?
7326|Shopware 6.5: Get a SalesChannelProductEntity from Order Line Items?
7327|Combine `if` condition with `id` in github actions
7328|An error was detected while performing the engine operation and the changes are being rolled back. See the log for details
7329|In C#, Can I make my Azure Function App more DRY?
7330|When pulls the &#39;one&#39; side of a relationship, the list(many side) doesn&#39;t come up on oneToMany relationship in Spring Boot
7331|I am developing an AI assistant but it is always throowing file not found error i am exactly copying the path and adding the word &quot;discord.exe&quot; atlast
7332|IntelliJ Idea mapstruct java: Internal error in the mapping processor: java.lang.NullPointerException
7333|Decode HTTP/3 Frame payload in wireshark
7334|Short Circuit Evaluation of Logicals in Impala?
7335|How to use AWS Glue Job Bookmarking with concurrent runs for s3 source
7336|How can I export this very large image in Google Earth Engine?
7337|No bouquets in this xui.one api http://localhost/accesscode/?api_key=****&amp;action=create_line&amp;is_trial=1&amp;exp_date=2hour&amp;bouquet=1&amp;allowed_outputs?
7338|Blog with next.js and Notion - caching with embedded media
7339|How to avoid duplicate with routes.MapRoute?
7340|SMS API how to solve this i want to change SMS API provider
7341|Blazor WSAM AADB2C90077 User does not have an existing session and request prompt parameter has a value of None
7342|How to use qt stylesheet to customize only partial qwidget border?
7343|Execution Log with time filter is not working
7344|Alamofire stream requests consistently fail if invoked after 1-3 minutes
7345|Failure to load Dry::Schema::MessageCompiler inside a module
7346|ANSI sql for comparison with string and non-string
7347|Multiple use of Vaadin LitTemplate
7348|npm syscall symlink error -95 when installing node-sass on Docker for Windows
7349|setter method of the computed property does not get called
7350|SQL Sort shortest and longest first name by last name
7351|Error message &quot;DevTools failed to load SourceMap: Could not load content for chrome-extension://...&quot;
7352|Create Dynamic E-Mail Distrubutor with Azure AD and OnPrem AD
7353|Kivy ScreenManager not showing first screen
7354|import openai fails (python): cannot import name &#39;COMMON_SAFE_ASCII_CHARACTERS&#39;
7355|android studio build project without any internet connection gives error
7356|I&#39;m getting the error &quot;_genMapping.maybeAddMapping is not a function&quot; when I try to collect coverage from jest tests
7357|new_version package in flutter returns RangeError (index): Invalid value: Valid value range is empty: 1
7358|How to use nan and inf in C?
7359|Azure Logic Apps - Failed with error: &#39;The browser is closed.&#39;. Please sign in again
7360|Update new version is not working in flutter
7361|trying to put days into weeks across different years
7362|Ordering neighbors in terms of &#39;weight&#39; when finding similar nodes using embeddings
7363|WCF service is not available access under HTTP (ERR_CONNECTION_RESET)
7364|error importing Design Token library in ts
7365|GitHub reademe Error: Please add an env variable called PAT_1 with your github token in vercel
7366|getting error while configuring a new Authentication Filter of keycloak on geoserver (trying to integrate keycloak SSO with geoserver)
7367|R ggplot: colour and fill arguments
7368|Lexical Editor: How to replace selected line of text
7369|How to fix &quot;Captured variable is disposed in the outer scope&quot;
7370|I want to update the app version in playstore to show a message dialog to user
7371|Building a full stack web app with SvelteKit, MongoDB, and Auth0 while ensuring secure user-specific document access
7372|How to get package name and version number from play store?
7373|Convert the given time to site specific time in Perl
7374|how to delete all dependencies from package.json?
7375|Flutter - How to check is the app has a new version?
7376|What&#39;s the correct way to parse `None` from json
7377|VS Code cannot open UNC path files because of Allowed UNCHosts case sensitivity
7378|Authentication/Authorization process in a website built with ASP.NET Core and SQL Server
7379|How can I use docker image from its cache?
7380|Every time im using apt-get or dpkg for installing packages on ubuntu 18 i got those errors from python packages
7381|Call php function from bash script with array as an argument
7382|Spring Boot 2.3.0 Upgrade with Hazelcast 4.0.1 Causing Service to Stop Unexpectedly
7383|Firebase Assistant Fails to Launch (Flutter)
7384|How to create a type alias for a nested static method in TypeScript?
7385|Translating the whole dataframe with googletrans is taking too long
7386|unable to make connection with mongodb from nestjs after new installation version are nestjs v 9.1.1 and moongose 7.1.1
7387|Inheritance and function selection
7388|Displaying derivative and result in one line
7389|Check if two arrays contain identical ids
7390|How run clang from command line on Windows?
