9807|Building JanusGraph Indexes On Cassandra In Java
9808|How to run a Chrome Browser with Selenium in aws lambda (java)
9809|Cannot install angular fancy grid via npm
9810|How to POST a pdf-lib modified PDF to PocketBase on the server side of a SvelteKit app?
9811|how to get dynamic data in canvas using onload function
9812|Performance issue while using the Delta table change data feed
9813|React-Native IOS real device does not connect second time to metro server
9814|Need help in importing a CSV file data from Gmail attachment to an existing Google sheet
9815|How to fix input actions issue?
9816|Order Kontent.ai items by linkedItem element field
9817|Stored procedure with datetime condition
9818|how to convert from a datetime picker in DevExpress in C# to DateTime only date without time
9819|In MAUI project does MAUI use interpreter internally?
9820|Expand env variable with space in alias
9821|Github Actions Go lambda project different sha256sums
9822|google_maps_flutter: ^2.2.6 is not picking current location and it’s not changing the map type also
9823|Visual Studio blocks on deploying a Standalone Angular project
9824|C# equivalent to Java&#39;s continue &lt;label&gt;?
9825|How to append a date in batch files
9826|&quot;Build input file cannot be found&quot;
9827|Spring-Data-Elasticsearch custom analyzer not getting imported
9828|Docker - Windows 10 - An unexpected error was encountered while executing a WSL command
9829|React Fetch post api return response [object Object]?
9830|Batch convert .pcm files to .wav files in PowerShell using ffmpeg
9831|When I select App Scripts from the Google Sheets Extensions menu, I get a generic error
9832|How to get current route path in Flutter?
9833|MSIntue SDK iOS app not redirecting after login and enrollment
9834|Android room db migration delete from table all embedded columns
9835|showing animation Non-stop in java fxml
9836|Force VS Code devcontainer settings to override user settings
9837|GraphQL Interface calling error in rails 7
9838|Reservoir sampling
9839|React Native - Remote image overflowing when setting borderRadius
9840|Check if a users roles got changes in GuildMemberUpdated C# discord.net
9841|How to get tfidf with pandas dataframe?
9842|Heap and stack in Python variable
9843|How to pass WebResourceResponse with &quot;redirect&quot; code to Android WebView in WebViewClient.shouldInterceptRequest?
9844|App theme changing to Default System theme when coming back from System Settings
9845|PySpark filter using startswith from list
9846|Detect web browser closed - possible solution
9847|Import data into Power BI from rest Api with date range
9848|Vibration pattern does not play correctly
9849|how to fix Nextjs13 could not find the module app-router.js#
9850|Printing the structure using a single line in C?
9851|Sound not working in iPhone Simulator?
9852|Flutter DropDown Widget issue
9853|Conda 23.3.1: what shall be the content of build.sh?
9854|My scroll to top button not showing when scrolling
9855|Joining 2 different node if they have same class Id firebase
9856|Blending Schedulin of Gasoline Production
9857|Is there a way to add a personal icon on Select ( Mantine)- not an image from Tabler Icons
9858|Automate a bluetooth connection on Windows
9859|Mongoose instance .save() not working
9860|Importing playwright fails with &quot;DLL load failed while importing _greenlet&quot;
9861|What should i do to sent and store data from 8051 microcontroller to a pc?
9862|&#39;CV_LOAD_IMAGE_GRAYSCALE&#39; is not defined{PY}
9863|matplotlib switch between figures
9864|How to write a regex for searching multiple words in intellij
9865|Blazor WebAssembly Authentication with Open Id failing due to no &#39;Access-Control-Allow-Origin&#39; header
9866|How to create a portal/modal in Next 13.4
9867|Logstash Mapping - Duplicate values in nested properties
9868|How can see any error if I can&#39;t install app from google play
9869|How To Reboot a PC inside snap app (created with Flutter) on Ubuntu 22.04?
9870|GeoServer - Creation of featureType using Rest API fails with error &quot;java.lang.NullPointerException&quot;
9871|Facebook Graph API sharedposts not working as expected
9872|get point count after appling filter on layer
9873|Flutter Stripe Payment Error Publishable Key is required / missing
9874|I am trying to fetch data with the Django ORM with filter and exclude both at the same time, but it returns the same data with and without exclude
9875|How to trigger documentation popup in VS Code?
9876|Kubernetes: deploy a web app using tomcat and mysql
9877|Pip could not find a version that satisfies the requirement
9878|Module not found: Can&#39;t resolve &#39;next-translate/appWithI18n&#39;
9879|Javascript event listener - run code after event finish bubbling
9880|Why when AHB uses write multiple transfers, the bit position of writing is different?
9881|How to read avro bytes field
9882|This localhost:5173 page can’t be found
9883|In Google Play Can I Update Production Version When I have Higher Version On Beta Channel
9884|How to write ~/.ssh/config when there is @(at symbol) in hostname?
9885|postgresql count the number of children
9886|How to use CTE expression WITH clause in Spring Data JPA
9887|How to add specific facts to the content returned by Ansible ad-hoc?
9888|why we use () after objects in turtle method?
9889|Express authentication works fine with cookies but browser just does not set them
9890|Looking for most simple video codec
9891|NextJS beta App router. GET request fails with fetch but works with browser
9892|What is ExchangeStrategies in Spring Framework API?
9893|Migration is required due to the following errors in Realm Local Database
9894|how do you use bit swift in python
9895|Saving Dictionary into My.Settings doesn&#39;t work
9896|add gradient on border with border radius on it and also has transparent background
9897|kubernetes cron runs when node pools are scaled
9898|How to enable RMI class loading in a Spring application?
9899|Is there a way to undo &quot;git restore&quot; command
9900|displaying data Horizontally- not a pivot table
9901|In Bicep what is replacement for copyIndex() in json : json to bicep converter not working properly
9902|&quot;msal&quot; IdentityContextData for Django
9903|spark mlib: requirement failed: Index 0 follows 0 and is not strictly increasing
9904|how to enable gzip compression in angular cli for production build
9905|CMake cannot find packages within Qt6 installation
9906|How to apply multiple css radial gradients to a single element
