301|How do I add zlib via CMake?
302|How to send/set basic authorization i.e user and password to every request in openFeign client in spring boot with help of interceptor
303|How to get selector string with jQuery?
304|Airflow - execute X dynamic tasks with max 4 tasks in parallel
305|How to restrict traffic to AWS loadbalancer only from browsers
306|How to turn this into a Directed Graph that show ARROWS from source vertex to destination Vertex, Adjacency matrix too
307|Custom Exception Messages: Best practices
308|show barcode and title in one paper with barryvdh/laravel-dompdf
309|Valid boolean type in apache age
310|Fullcalendar can make 2 views and 1 tool control?
311|How to run .jar file by double click on Windows 7 64-bit?
312|How can I move a ModelEntity along the Y-axis using gesture?
313|Stop React from re-rendering my component after change in Context values
314|Can&#39;t run JavaFX Application on Netbeans 16
315|Fetch MQTT Sensor Value using Node-Red transfer to MySQL
316|How to remove transparent background completely from Network Image in Flutter
317|How do I include image files in Django templates?
318|Nest.js cache in k8s with several replicas
319|Omnisharp not loading properly - Visual Studio Code and Unity
320|Android Snapshot test GithUb Action
321|How do I configure fixed length columns in EF Core?
322|CSS Background Gradient Not Covering the Whole Page Including Scrollable Content
323|guid/uuid in Typescript Node.js app
324|How can I count the number of tokens generated by a for /f loop?
325|Cumulativ values using Power BI DAX with SSAS live connection
326|Is it possible to dynamically change proxy while scraping in Python?
327|How to use i18n translation in Vue 3 model file
328|Double waiting condition in selenium
329|React Native Change Default iOS Simulator Device
330|Checking if pinned package in requirements.txt is latest or not
331|Frappe - Patches do not get executed when installing app
332|Visual Studio detects dependency cycle which does not exist
333|My program crashes after writing in pipes
334|How to set dynamic attribute like (click),(change) from Angular component
335|How to correct `git` reporting `detected dubious ownership in repository` without adding `safe.directory` when using WSL?
336|Is there a way to plot multiple plotly express graphs onto the same html page, without using subplots? Plotly Python 3
337|How to disable sorting while dragging and sort only after drop using the vue.draggable library?
338|Spring migration 2.7 to 3.0.6: problems in Specifications (queryBuilder)
339|How can I set a value with dynamic key with typescript?
340|How to set data fetch from API into a new activity
341|Next-auth getToken dont working on serverside
342|Apptainer installation with use Windows Subsystem for Linux (WSL)
343|Copying and pasting a percentage value from a cell to another
344|How to fix &#39;ReferenceError: requestAnimationFrame is not defined&#39; in Vuetify unit test
345|Large lag between client and broker (possible flow control &amp; credit behaviour)
346|Why did Apache IoTDB Version 1.1.0 reported &quot;too many requests&quot; error when writing data?
347|Chrome browser quit after loading from selenium
348|How to get an overview of all branches ahead of remote branch in TortoiseGit?
349|Unable to get a clean &#39;npm audit fix&#39; on the SimpleAngularApp from course content. (Udemy Course Angular 10)
350|Location.getCurrentPositionAsync() not compatible with a promise race?
351|How to unlock PGP Self Decrypting Archive .exe files (PGP SDAs) in python with a known passphrase?
352|How to give a process exclusive cpu access for a certain amount of time?
353|Connection timeouts are not as expected
354|Wix Bootstrapper RegistrySearch NOT finding value
355|How to mount the .img file with read write permissions
356|Delay loading of file constants based on script loading
357|How to limit ASoC configuration parameters?
358|Share button is not visible in Dynamics CRM 365 views even for a system admin role
359|how to correct error in the dart mixin override member
360|Replace line breaks using Regex
361|Unity Advertising id for mobile
362|Sorting a List of Lists to Group Characters and Minimize Adjacency Changes
363|How do I find search targets using Windows Explorer Search when I have python source code
364|Why does it not work ? Can Someone please explain Memory Allocation, static/non static, global/local variables/ deepcopy used in stack
365|How to know userFeePercentage (consume_user_resource_percent) when calling smart-contract?
366|Please Help, how can I Deploy rust project on Heroku
367|WebDriverException: unknown error: Runtime.callFunctionOn threw exception: TypeError: JSON.stringify is not a function
368|SQL Query to return results from related 3 tables with the correct groupings and joins
369|Gridbag Layout not working properly (Java Swing)
370|List of cards doesnt change after deletion of any card without refreshing the page
371|docker how to run a dangling image
372|aligning omnet++ clock with the system clock
373|File duplication error in branch computers
374|Convert Datatable text column to barcode column in another datatable using vb,net
375|Error: Type Mismatch during loading class in Access VBA
376|How is it possible to achive O(log n) power function a^n by only using recursion?
377|Why is the Pandas library using so much more memory on Ubuntu than MAC OS?
378|Flutter: image not saving locally on device after taking picture
379|I&#39;ve got (errno: 150 &quot;Foreign key constraint is incorrectly formed&quot;) in this case
380|Get download media from a CDN server like CloudFront using a Java Spring Boot application
381|vitest global variables in setupfiles
382|Jackson @JsonProperty(&quot;SoMeVaLuE&quot;) to ignore case
383|In MAUI, how to restore an app to be the visually on top of all other apps?
384|How Do I Solve SDK compatibility and StyleSheet Error
385|Implementing a non continuous loss function
386|Facing trouble locating unknown curl scripts/command responsible for calling API calls every few seconds on the EC2 Server
387|Shell restarts when importing Pandas module in Python code
388|Windows Sandbox: enable optional features within sandbox
389|Why doesn&#39;t my VS Code 1.77 installation on Windows with the user setup have &quot;Check for Updates&quot; commands / buttons?
390|How to create a carousal link this
391|Make two java JDBC DataSources use single backing DataSource as it&#39;s source
392|Nestjs typeorm column in child that have the value of a parent column
393|gaierror: [Errno 8] nodename nor servname provided, or not known (with macOS Sierra)
394|Getting error while installing Firebase in Angular
395|Display image in firebase cloud storage as network image in Flutter
396|Vuetify 3 collapses `v-list-item when` `to` attribute is used
397|Why the app in my desighn is diffrent from what i see in the emulator?
398|Authorize.net - company field?
399|Fastest way to find the last date in which the running total became negative
400|xaml set value of ResourceDictionary entry to the value of another entry in the resource in the dictionary
