13623|How to substitute the extension for a cmake list of filenames
13624|Adding a system call to Linux kernel 6
13625|Input: your_python_staff = &#39;your python code&#39; print(your_python_staff) print(your_python_staff + 5)
13626|How to skip rows with same column values in SQL Server?
13627|How to make linter or prettier stop breaking line
13628|How to use variable data inside refcursor in postgresql?
13629|Match the string data inside a group - Pandas
13630|Resolve System.TypeLoadException in .NET Core 3.1?
13631|Decompiled not finish Bscscan smart contract
13632|Swift - How to make a Label an AccessibilityElement with VoiceOver Turned Off?
13633|How do I create an email thread when using AWS-SES?
13634|How to print text from TextField when the custom button is clicked, but textInputProxy is nil? (using KeyboardKit)
13635|Mac Catalyst app crashing when emailing a second time
13636|Y-Axis ticks on Right Side of Plot
13637|Load images taken from preloaded JSON in p5.js
13638|NodeJS - Running tests with Jest: getting an error with TypeScript config file
13639|How can set header once for all request that will be made in tauri
13640|Problem in loading .owl file into Neo4j Desktop
13641|Date Range Not Updating In Pivot Table
13642|Twitter Bot with Tweepy
13643|How can I obtain a Google Access Token using OAuth 2.0 in PHP or cURL, using fixed email, password, client_secret, client_id, and project_id?
13644|local search engine for different file types in windows directories
13645|getting syntax error as output after compiling lex and yaac program
13646|org.hibernate.PropertyValueException: not-null property references a null or transient value while using Spring Boot
13647|Android not trusting my Webserver which has a valid CA-Cert
13648|how to check if a particular xml tag is present or not in ftl file
13649|Laravel excel Class &#39;ZipArchive&#39; not found
13650|I need help deobfucate gLua code but cannot find any solutions
13651|how to get filename from an XLSX in Julia
13652|wsl --import and --import-in-place appear to operate, but the result is a fresh OS
13653|Moving dots in Text view (loading animation) Swiftui
13654|How do I solve this error in .g file generated with json_annotation package
13655|How can I fix errors like pictures in Git?
13656|Combine 2 Vectors
13657|Backtrader library not properly calculating trades
13658|Is there a way to complement missing numbers in a data frame?
13659|Why am I unable to use using SixLabors ImageSharp?
13660|htmx, push url with form value
13661|Create a Segmented Control Widget with slider button - Flutter
13662|Request.Url.GetLeftPart(UriPartial.Authority) returns http on https site
13663|What values have pointer semantics?
13664|How can I filter certain words in senders&#39;s address with gmail?
13665|sql query in php does not return the value in stored in the table but does correctly in phpmyadmin
13666|Is it safe and defined behavior to transmute between a T and an UnsafeCell&lt;T&gt;?
13667|Visual Studio 16.8 just disabled having a console in a WPF Core 3.1 app?
13668|Safari download Japanese filename showing encoded string
13669|Primefaces 6.2: p:downloadFile inside commandButton with ajax=true
13670|some props of state disappear after re render page
13671|Not quite a transpose
13672|Nested loops: Print seats in java
13673|Eclipse hanging, how to kill it properly?
13674|Connecting to local Linux server from iOS through USB only
13675|Is there a possibility to exclude certain service calls for http logging?
13676|ParamSpec types PEP 612
13677|Compatibility of P-frames and multithreading in FFmpeg library in C
13678|Tensorflow summary and plot_model with multiple inputs/outputs
13679|SAP BODS : XML export and alias names
13680|Will the time spent for context switch be counted into some process&#39;s system-cpu-time?
13681|Exception while loading Zookeeper JAAS login context and Could not find a &#39;KafkaServer&#39; or &#39;sasl_plaintext.KafkaServer&#39; entry in the JAAS
13682|Is it possible for hpc cluster node to directly read and write to openio sds(or distributed file system) and still achieve the max performance
13683|Webi Rich Client refresh is very slow contrary to Webi and SQL
13684|How can I access the ID of the parent object inside a object entension
13685|Pass string[] as parameter on command line for Powershell script
13686|Binding not working inside a &lt;ItemsControl.ItemTemplate&gt;
13687|VB.Net inverse of a function to convert SAP Datetime to DateTime
13688|target=&quot;_blank&quot; in p:menuitem doesn&#39;t open new tab
13689|flutter PaginatedDataTable row color
13690|Live reload is not possible without a body or a head tag
13691|SAP BO - Report from stored proc
13692|Error when using multiprocessing with Pandas: &#39;Can&#39;t pickle &lt;class &#39;pandas.core.frame.Pandas&#39;&gt;: attribute lookup Pandas on pandas.core.frame failed
13693|Invalid `Podfile` file: undefined method `exists?&#39; for File:Class
13694|Express server reads JSON body incorrectly
13695|My Python code is running in an unintended fashion
13696|problem with Nestjs unit test of provider
13697|DBeaver&#39;s &quot;Script title pattern&quot; option lacks &quot;Project&quot; entry
13698|Flutter: Redirect to home screen on error is buggy using `go_router`
13699|Filter a measure - SAP Analysis for Office
13700|Next.js 13 imports
13701|Translating string formula to cell formula in regional language changes relative reference
13702|driver is null when I use @before and @after in a seperate class called Hooks
13703|console.log(element.children) returns undefined in the console
13704|Cannot access my Local mysql server from Minikube Cluster
13705|logstash opensearch ECS disabled Failed to load default template for OpenSearch v2 with ECS disabled
13706|Node JS Connect file server not serving as expected
13707|PDF signing using Golang
13708|Saving csv files from databricks to Azure blob storage
13709|Angular RxJS, push newly added item to the existing Observable Array
13710|Collect method is taking longer in spark when deployed in kubernetes
13711|NoClassDefFoundError: requests/package$
13712|Embed H5P from Wordpress to R Bookdown
13713|github pages site can&#39;t find content
13714|Selenium error in R. Cannot read property &#39;length&#39; of undefined
13715|how to populate with mongdb package using typescript with model interface in node.js
13716|How do I mock objects without inheritance (in C)?
13717|WebGPU sample displays white canvas on Chrome v113
13718|Subversion PHP-FPM interpreter conflict stops .php commits
13719|Sent Org CloudTrail logs to CloudWatch to Non-Managment Account
13720|Tomcat, NGINX, Vaadin, Spring Boot and LONG POLLING Push
13721|NestJs how to test response controller
13722|Sections don&#39;t take the full width of the window in Angular
