19096|From in-memory vector to line of code that produces the vector in R
19097|Just started with Python to split after 40 crachters not splitting in the middle of a word,
19098|Pivot columns based on aggregated values
19099|Wrong response from Wordpress Rest API
19100|Python: NameError: name &#39;df&#39; is not defined
19101|Is there a way to get device serial number on android 11 and above?
19102|Make 1 column remain fixed &amp; scrollablable under my sticky top navbar but above my footer, when I&#39;m done scrolling 2nd column, footer should span both
19103|Getting incorrect output when trying to use generics in python3.10
19104|Why are my qrcodes coming up green and why are the import functions not working?
19105|Octopus - Export projects excluding disabled
19106|Trying to install python-gi! &quot;E: Package &#39;python-gi&#39; has no installation candidate&quot; appears?
19107|Force child span to use parent&#39;s font size in CSS when you can&#39;t control the child&#39;s CSS?
19108|How do I determine if multiple objects in separate segmentation masks are the same class, without training?
19109|How to upload a Unity game into a javascript website
19110|Angular 13 app, wrapped in web component DI {providedIn: &#39;root&#39;} issue
19111|Typescript compile error: Property &#39;classList&#39; does not exist on type &#39;Node&#39;
19112|How to make a simple stack based buffer overflow on gets
19113|Getting ImportError: dlopen , Symbol not found: when calling &quot; import tensorflow_text as tf_text &quot;
19114|Interpretation of Lasso regression results
19115|google maps limit distance in search
19116|How Do I Schedule Events in Tkinter Python
19117|Does anyone know how to center the last value in a table in power BI?
19118|How to create a transparent triangle with border using CSS?
19119|Selenium, python, chrome driver, outlook automation: outlook.office365.com wants to Open email links
19120|CrmServiceClient: how can I specify a custom oauth2 Authorization Endpoint
19121|Sum by condition in two columns data frame R
19122|Counter Up JQuery counting to random numbers
19123|How to give a custom CSS style for the &quot;disabled&quot; state when customizing a webkit scrollbar button
19124|volume node affinity error for kubernetes single node
19125|org.hibernate.HibernateException: Found shared references to a collection when updating/deleting
19126|Solr boost and the sort
19127|SCP Policy to Deny public access to S3 buckets with condition to allow whitelisted buckets
19128|React Native pull down does not refresh data
19129|Generate random numbers in Rust
19130|Xamarin android save text file
19131|How to create like an option group on a subform in MS Access so that only one subrecord can be selected at a time?
19132|Do I understand train/val/test split correct?
19133|Entity Framework Core 7 create database SQL script generation
19134|Benefits of Encapsulation in Object-Oriented Programming using C++
19135|Base58 Encoder function in PostgreSQL
19136|Downloading a file via selenium through Jenkins and download is cancelled?
19137|I need to receive the GPS coordinates on Delphi 11.3 - Android 11 every 5 minutes, even when the app is in background
19138|Is there a way to get Material-UI&#39;s textfield to return a number instead of a string when used with type=&quot;number&quot;?
19139|Is it possible to update a text with an input&#39;s value in MS adaptive cards?
19140|ModuleNotFoundError: No module named &#39;docxtpl&#39;
19141|Error running agent: starting input inputs.websocket: failed to WebSocket dial: failed to send handshake request: Get context deadline exceeded
19142|Why does the act of introducing a destructor result in worse codegen? (Passed by reference instead of by value in a register)
19143|CMake does not find Visual C++ compiler
19144|TypeError: Cannot read properties of undefined (reading &#39;includes&#39;) [Node.js and socket.io]
19145|Litespeed cache coverts images to webp bit Facebook don&#39;t show webp images in urls
19146|Google Place Autocomplete not showing in Bootstrap modal
19147|Best practive firestore listener: multple per path, or one doing multple jobs?
19148|How to make bootable Windows to go USB on Ubuntu Linux?
19149|Retrieving a stored procedure query in Bigquery
19150|how to set value to zero of key-value pair object which i got in firebase cloud function(snapshot)
19151|Trying to make the inputs into a row, but have the labels above the inputs
19152|Where Does Windows Subsystem For Android Keeps It&#39;s Apps/Downloaded Files?
19153|Firebase - cloud function returns undefined
19154|Cannot use env variables in xargs
19155|how to increase the security of my callable cloud function?
19156|Adding Entity Framework to Azure Function: Unable to resolve service for type &#39;DBContext&#39; while attempting to activate &#39;Function1&#39;
19157|How to give WHERE condition in pg_dump?
19158|Mapping sealed class using Gson
19159|How extract parameters type array from the array of functions
19160|Ipfs module not working with firebase functions
19161|Firebase schedule a function with multiple crontabs
19162|How to send unacked messages to DLX after TTL?
19163|Remove the spaces before ; and after ; without removing the new line
19164|Error in retrieving response from firebase cloud function
19165|Pass a variable from views.py to .html
19166|Android - open external app by user clicking url on any place in app
19167|Sort multidimensional NumPy array by norm over a dimension
19168|Firebase Cloud Storage rules based on Firestore Data work around
19169|Migrate to hoisted imports
19170|Is there a Google Sheets QUERY or Apps Script for assigning text to a number within a number range?
19171|How do you apply a custom font family for placeholder, textbox &amp; button?
19172|Mixcase in Power BI
19173|React Quill + NextJs : Add custom text on button click
19174|How to convert −0 to string with sign preserved?
19175|How to change color of brackets, parentheses and braces in ZeroBrane IDE apart of operators?
19176|Permission denied (publickey) error when SSHing to Ansible server from Jenkins pipeline
19177|How to write parquet file from pandas dataframe in S3 in python
19178|Laravel 8: Session put works but session flash does not work
19179|What is the compatible version of Spring Security with Spring 4.3.0?
19180|Trying to create a webhook using Google Cloud Platform and receiving &quot;Service Unavailable&quot; when testing
19181|ScrollPane become to slow with small amount of buttons in JavaFX
19182|Need help on JOLT to enrich array with another node
19183|mremap failing with error number 2 after rebuilding old library on Ubuntu 20
19184|How to trace the cause of an error result?
19185|Error in testing: &quot; KeyError: &#39;access_token&#39; &quot;
19186|Rendering simple 3D data in java
19187|Repeating an alias
19188|c# deserialize nested polymorphic object / derived classes
19189|How to use Mapbox Directions Refresh API to refresh annotation
19190|Maximum sum of two elements
19191|JTree Issues Updating Nodes and with Key Handlers
19192|I&#39;m trying to install my mongodb and it keeps showing error: unmet dependencies
19193|Tosca - Not able to select option suggested from auto-search field
19194|Keeping same manifest and app yaml configs across different branches/environments
19195|How to display a QColor from QColorDialog in a widget?
