7791|Opening menu via click is not working properly
7792|Istio Send Request to wrong subset pod
7793|Android default back button doesnt work as intended with multiple fragments
7794|How do i make the right side of web page scrollable, while the left side fixed
7795|Retrieve Azure Cloud Services information via api
7796|Convert data type from character to date
7797|Twitter API V2 403: Forbidden using tweepy
7798|Deletes all but the last element from a given list in java collections
7799|How to retrieve two or more fields by using TUniQuery in Delphi/MongoDB?
7800|Mypy errors when using ArrayLike
7801|Why does N! stop overflowing the 32 bits output variable when N&gt;=34?
7802|Use .env variables to set up appcenter on a react-native app
7803|When MQTT-SN should be used? How is it different from MQTT?
7804|How to add a tooltip to an svg graphic?
7805|PHP function to output an array with enum from values
7806|Contact Form 7 cause HTTP 500 error
7807|How to enable uvicorn to run asynchronously constructed app?
7808|maven skip tests with compilation errors
7809|Correct way to return stream from azure openai sdk api
7810|What is the correct way of adding elements into injected HTML?
7811|How to embed mjpg streams with &lt;img&gt; tag without browser getting out of memory
7812|How to simple first person 3D camera in javascript?
7813|java agent fails to start with jib created image for a springboot app. [agent library failed to init: instrument]
7814|How to pass null value to cursor through python
7815|Oracle jdbc execute throw &quot;AarrayIndexoutofBoundsException at oracle.jdbc.driver.T4CITIrxdsBitset.set&quot;
7816|NextJs 13, Link component incorrectly works in production
7817|reactjs: socket.io try to connect to itself url
7818|Formation of 20 Character string concatenating by five fields
7819|SendGrid Single Sender Verification works with messages@domain.com email but not with messages+xxxxxxx@domain.com email
7820|How can I get data from nested rest api and fill thim in angular material table
7821|Nginx-Clojure jvm may be mad for wrong options
7822|PHP, uploading image with file_put_contents make 0 byte file
7823|Excel VBA special characters in literal strings being changed
7824|How to place image inside of several nested border line randomly
7825|Know about Mapping or Routing against Sales Order page when we put item code automates item tax template and taxes and charges
7826|Swagger 2.0 not validating for empty string
7827|Python packages hash not matching whilst installing using pip
7828|gnucobol &quot;unexpected Identifier, expecting DIVISION&quot;
7829|How to fetch non-entity data using DTO from stored procedure
7830|Matplotlib plot contourf on 3d surface
7831|how to add jvm options in quarkusDev
7832|Multiple Python versions installed : how to set the default version for py.exe (Python Launcher for Windows) for CMD and for &quot;Open with&quot;
7833|How can you convert from an Attachment to a byte[]?
7834|cy.task(&#39;unzipp&#39;) failed with the following error: &gt; Invalid CEN header (bad signature) in cypress
7835|TinyMCE - Problem with Initialisation in React?
7836|Android app icon is too small on some phone
7837|How to set maximum cropbox size in cropperjs?
7838|How can I make my Python CRUD TKinter Multi-Window GUI Application to receive Image file directories and store them into Json file?
7839|How to crop imageProxy
7840|How to detect mouse moving while left button down?
7841|pyodbc to access.accdb : can&#39;t open access driver
7842|Flatten Multi Array JSON using PySpark/python
7843|Android Jetpack Compose NumberPicker Widget Equivalent
7844|How to securely store and retrieve sensitive data in PHP on a shared hosting environment?
7845|How do I filter bad words when I&#39;m adding Google Translate to my app
7846|MongooseError [MongooseServerSelectionError]: connection &lt;monitor&gt; to 52.6.250.237:27017 closed
7847|MAUI - Credit/Debit Card Scanner
7848|How does PHP works and what is its architecture ?
7849|How to stay on top of OWASP dependencycheck reports
7850|How could i open big database files
7851|How to add a UTF-8 BOM in Java?
7852|How to correct my misundertandings in Python Matplotlib subplots
7853|How Set&lt;List&lt;Integer&gt;&gt; is working conceptually
7854|How does Android monitor whether there are sensitive words in the text of the application on the screen?
7855|how do I enter a string into a field with a button?
7856|Save PLSQL table to Text file by Script
7857|How to create appointments for 60 min and 90 min auto adjust all slots
7858|net::ERR_INCOMPLETE_CHUNKED_ENCODING when viewing PayPal subscriptions
7859|Why is Tensorflow&#39;s Gradient Tape returning None when trying to find the gradient of loss wrt input?
7860|Infinite scroll with NextJS13 server components (app directory)
7861|How to update oracle apex collection using classic report
7862|fontWeight attribute not working in Jetpack Compose
7863|Unable to connect to Android SDK while running &quot;flutter doctor&quot; in EC2 Ubuntu Terminal
7864|Laravel Livewire Bad Performance on Simple Operation
7865|Gradle - Skip test in custom task
7866|Reference Security Group from other AWS Account
7867|plotly polarplot - moving position of radialaxis labels
7868|Add Filter for GeoJson group
7869|Elastic Agents not collecting kubernetes logs from other namespaces rather than &#39;elastic-system&#39;
7870|Error &quot;Google Cloud Platform project quota exceeded.&quot;
7871|curl: (6) Could not resolve host: application
7872|Why is my mail deleted when I drop the mail into a folder in SharePoint
7873|Equivalent of Python&#39;s Walrus operator (:=) in Julia
7874|Task Status Confusion - WaitingForActivation
7875|npm audit fix --force command not working
7876|Azure authentication not working in JMeter after apparently correct correlation
7877|lib/tools.jar, sonarque, and jdk 11
7878|How to programmatically show/hide only the background/image of an ImageView in Android?
7879|how can I choose a random number but with a normal probability distribution in PHP?
7880|WebRTC causes FreeSWITCH to not provide service
7881|JavaScript Function Not Defined Error (BUT IT IS DEFINED)
7882|Get data from google sheets and display it in an html table
7883|The connection test failed because of the following error: Error establishing socket to host and port, Reason: Connection refused
7884|How to revert the changes made by Selenium Nunit (C#) test from Database
7885|FastAPI - How to pass a dictionary/JSON data in HTTP multipart request?
7886|NY midnight opening price on pinescript v5
7887|How to parse/read log files generated from tpmtool.exe (Windows)
7888|Websocket connection through nginx returns 400 - Hixie76 protocol not supported
7889|Rails Gem Uglifier 4.2 does not support async/await, how to fix
7890|How to make a boxplot of a list of datatime.time
