16860|Is it possible to use custom chain in walletconnect v2?
16861|Running SSIS Project on two servers
16862|Jenkinsfile to deploy sonarqube custom rules plugin onto openshift sonarqube container
16863|Eclipse RCP Application: Problems View, add ellipsis to the text
16864|add additional text to variable after ternary operator
16865|Is it possible to write vertically in a textview in android?
16866|An internal error occurred while calling &#39;saveDocumentToCorporateMDP&#39; API. (Error: ERR_WIS_30270)
16867|Vaadin Push Websocket connection failed
16868|SAP Web Intelligence - Summary Column Based on Multiple Criteria
16869|Django get/filter method default exact lookup not working
16870|Cargo build hangs with &quot; Blocking waiting for file lock on the registry index&quot; after building parity from source
16871|How to create a JavaCompile task under a Custom Gradle Task?
16872|Exception when connect to MySQL using Pomelo Entity Framework Core
16873|&quot;You have exceeded the quota for AWS Amplify apps&quot; error while building app in AWS console even if the app limits not breached
16874|Error in service account authority certificate in Openshift
16875|akka-http elasticsearch {&quot;error&quot;:&quot;no handler found for uri [https://localhost:9200/myindex/_bulk] and method [POST]&quot;}
16876|Flutter Local Notifications Custom Sound
16877|Asp.net core with windows authentication. get CORS error only for post request
16878|Flutter - Flutter Version Management (fvm) package not working in windows
16879|MinIO server does not work on VirtualBox shared folder
16880|vitest loading absolute path working for some components but not all
16881|How to get a list of installed android applications and pick one to run
16882|Implementing Multi-location Stock Management for WooCommerce Without Using a Plugin
16883|RealityKit – Scale a model from its center
16884|Docker-compose:panic: runtime error: invalid memory address or nil pointer dereference
16885|how to identify messages sent together to the whatsapp cloud api number
16886|Job for mysqld.service failed See &quot;systemctl status mysqld.service&quot;
16887|Building an app to add matter device and control wit google nest hub 2. gen
16888|ElasticSearch QueryBuilder libaray for Java Spring Boot 3.0.5 is not support
16889|compatibility issues for Tensorflow federated in Google colab
16890|Prioritizing slotted styling over global styling
16891|mysqlclient install error - ld: library not found for -lzlib
16892|not able to transcribe audio using SpeechRecognition package
16893|How to parse google search result the numbers
16894|psycopg2.OperationalError: connection error
16895|How to resolve an issue with tab navigation?
16896|New content now showing up when added (angular)
16897|Is it possible to stream the response text from a LLM?
16898|How to check if sed has changed a file
16899|best approach to search from pivot table using laravel
16900|ApplicationContextException: Unable to start ServletWebServerApplicationContext due to missing ServletWebServerFactory bean
16910|Post request ajax with react using laravel in backend
16911|How to use own svg icon in semantic ui input?
16912|NextJS: TypeError: Cannot read properties of undefined (reading &#39;asset&#39;)
16913|How can I change the colour of whitespace indicators in VS Code?
16914|Error in Galaxybase execution of Cypher query: execution blocking time exceeds the limit
16915|Can I change my SQL output window Name In my select statement?
16916|osgEarth elevation applied to all layers
16917|create view fails because permission
16918|How to batch resize images in Ubuntu recursively within the terminal?
16919|Share files with capacitor share plugin
16920|Exit from a Jupyter notebook within another
16921|Presto on iceberg: query failed
16922|How to request a GCP endpoint with Postman and service account?
16923|How cnosdb can dump table data into s3 or partial table data to s3?
16924|aspnet cookies not formed on https://locahost/demo
16925|How to split a line of HTML code with multiple elements into multiple lines?
16926|void IFile.DisplayName() CS8701: Target runtime doesn&#39;t support default interface implementation
16927|How to assign a specific character depending on the class attribute
16928|SQL where clause with optional IDs
16929|Sequelize - Combination Operators
16930|VHDL throws &quot;Type of aggregate cannot be determined without context&quot; problem
16931|How close the blocks in angular SSR web-site?
16932|how can i pass two different files names for two copy activities in adf pipeline
16933|How can I run a component on server side?
16934|Can not pass dynamic value in PayPal button
16935|how to extract text from rolling credits video &amp; save output in text file?
16936|Distinct cumulative Count with date restriction in Pandas Dataframe
16937|Failed to read PNG signature: file does not start with PNG signature
16938|Is it a flaw that Optuna examples return the evaluation metric of the test set?
16939|Discord Music Bot Queue Feature (it skips the in-between tracks and jumped to the last track)
16940|Getting error as :- error: expected &#39;,&#39; or &#39;;&#39; before &#39;extern&#39; extern &quot;C&quot; { ^~~~~~
16941|After rsync assets ActionView::Template::Error (The asset &quot;application.css&quot; is not present in the asset pipeline.)
16942|How to get the Quote from an Intel SGX Enclave
16943|Why model getBulkProperties method is not working for some properties?
16944|Why are SQL fields not visible?
16945|CKEditor 5 links: Set default target for links or edit target
16946|Why do compiled .ko files differ in Yocto work directory
16947|Building a custom langchain agent
16948|Uncategorized (Xcode): Exited with status code 1
16949|If I want to play Low-Latency HLS streaming on safari native player, must #EXT-X-TARGETDURATION and #EXTINF be equal?
16950|SwiftUI: Infinite Scrolling Horizontal ScrollView
16951|Generate json schema and validate json against the schema
16952|OpenCart display contact page in menu
16953|Turn string into operator
16954|Could not find com.android.tools.build:gradle:7.3.3. error found in build.gradle file
16955|Netty Thread Blocking When Restart
16956|Extract URL parameters from URL? In DELPHI
16957|Cannot upgrade to Flutter 3.7.12 from 3.7.7
16958|FAST API Nginx Forbidden 403
16959|How does controller, controllerGrip, and hand communicate with XR device buttons in threejs?
16960|Streamlining Updates and Software Installation in a Lab Environment
16961|How to handle potentially missing configuration file with serde
16962|is there a way to change video resolution of any size to 720x1280 with fluent-ffmpeg without squeezing the video?
16963|can&#39;t disable ceres solver&#39;s output [miniglog]
16964|Despite my research, I can&#39;t understand the error given by the editor?
16965|Next Middleware doesnt work on local SSL server
16966|Facing issue com.stripe.exception.ApiConnectionException: IOException during API request to Stripe
16967|Importing Date-datatype using mongoimport
16968|An error was thrown inside one of your components. Getting this error while testing component onClick functionality of InfoOutlined Icon
