14523|How can I run the same test for X times in parallel execution?
14524|Can&#39;t get private key with openssl (no start line:pem_lib.c:703:Expecting: ANY PRIVATE KEY)
14525|Add multiple routes with info window in a single ol map
14526|How to list all files associated by the employee?
14527|SPI has turned on DMA but has been unable to get out of the loop
14528|PowerCLi: how get Health status from all hosts
14529|How to correctly create a pointer to a 2D array
14530|Whenever i write some code in Chianlink VRF fulfillRandomWords function it does not get updated
14531|Add a new record from subgrid without open a new page
14532|How do I recover a semaphore when the process that decremented it to zero crashes?
14533|Fetch data from Cosmos DB via JS
14534|How to set a git username when working with &#39;www-data&#39; user
14535|Iterating through variable list
14536|SSDT/SSRS - Report Previewer Won&#39;t Run
14537|how to config the webpack 5.x to remove the dist folder before build
14538|Spring Api Gateway custom filter not works
14539|Detecting C compiler ABI info failed to compile: gmake: /usr/bin/gmake: Operation not permitted [Makefile:127: cmTC_0d1bd/fast] Error 127
14540|Delete entire row
14541|My state value not getting updated inside the callback function
14542|keep N number of duplicate rows (based on column 1)
14543|Is there a way to reset CSS style overrides in Chrome / Edge&#39;s devtools?
14544|I can&#39;t seem to fix the dropdown codes in my html
14545|Is there a way to order the rows of a data frame droping in the same function the rownames?
14546|Python add to existing logging info message
14547|How to debug javascript on a website in iOS&amp;Safari from Windows 11?
14548|In wagtail, how to include a ForeignKey for a snippet with a panel that lets you add/create new items?
14549|Could not load file or assembly &#39;SixLabors.Fonts&#39; ClosedXML NugetPackage
14550|How to use Markdoc in React + TypeScript + Vite app
14551|Powershell command wont work in batch file, trying to automatically update all pip packages
14552|Error: Cannot find module &quot;ms-vscode.js-debug/src/bootloader.bundle.js&quot; Require stack: &quot;internal/preload&quot;
14553|How can I configure Jackson to write all fields of a Kotlin data class that implements a collections interface?
14554|How do I use transport-http instead of wagon in maven?
14555|RestorePurchases() hangs forever on iOS 16
14556|Excel - SUMIF a range using vertical and horizontal criteria
14557|Swift Combine: Could not extract a String from KeyPath Swift.KeyPath
14558|Terminal doesn&#39;t launch in vscode even after adding path to cwd
14559|How to configure husky when .git is in a different folder?
14560|How can I use get a value stored in a json column in mysql?
14561|How to specify a TimeZone when creating a DateTime object in Dart/Flutter?
14562|How can I alias `...` to `../..` in Bash?
14563|Generate commands based on JSON file using the following structure
14564|editing one EditText field edits the other also
14565|Can an Application token be used instead of a Personal Access Token for github/checkout?
14566|How to use springboot + kotlin + jackson to globally set a custom Long type serializer?
14567|Clipping AdornerLayer
14568|Where to find changes due to `git fetch`
14569|Specify sort value
14570|Is it possible in AWS CodeCommit to put restriction on child branches?
14571|ODBC driver generate 8,3 .DBF file
14572|Need help creating a Prettier plugin to remove indentation on JSX function elements
14573|After DB migration, getting CodecNotFoundException during insert operation with UDT Type field
14574|Where do I find MySQL commands history on Windows?
14575|How to transcode MOV file using AWS elastic transcoder
14576|Request header field is not allowed by Access-Control-Allow-Headers in preflight response
14577|Get files from sub directory using vb.net
14578|android ndk error &quot;no such file or directory&quot;?
14579|How to show confirm (richfaces) popup when use action Method in JSF Managed Bean?
14580|401 Unauthorized when use Content Management API of Episerver
14581|How to speed up `DataFrame.drop_duplicates()`?
14582|Why is using &quot;for...in&quot; for array iteration a bad idea?
14583|How I can add icon from svelte-icons by name?
14584|What would be the simplest way to gather all database queries run during a single HTTP request?
14585|How to render current angular route/page into a dialog on click of button
14586|MySQL week calculation between two dates
14587|replacing values in the table
14588|Problem when changing color manually on Spectrumjs
14589|How to update custom widgets in view when firing a command
14590|Missing class LiveDataReactiveStreams
14591|FileNotFoundError: scipy.libs
14592|Unable to Generate toJson Method Using Serverpod
14593|Does Swift support WebRTC?
14594|Cassandra is column-based or column-oriented?
14595|Showing Memory utilization in Grafana dashboard
14596|DropBox in Android Application
14597|VBA code to select cells in a row from an active cell till the last cell with data. There are empty cells in between active cell and last data cell
14598|C# Error trying to convert Task&lt;List&lt;myObj&gt;&gt; to List&lt;myObj&gt;
14599|How to add stylus code highlighting support in Visual Studio 2022
14600|selenium.common.exceptions.NoSuchElementException: Message: Unable to locate element
14601|Fatal error: Allowed memory size of 1610612736 bytes exhausted but already allocated 1.75G
14602|Messing with JAX-RS SSE : Could not find a suitable constructor in javax.ws.rs.sse.SseEventSink class
14603|Reassignment of let variable makes TypeScript not recognized dynamically added type
14604|Validation errors in AJAX mode
14605|Xcode - How to fix &#39;NSUnknownKeyException&#39;, reason: … this class is not key value coding-compliant for the key X&quot; error?
14606|&quot;done&quot; function isn&#39;t working after moving from callbacks to promises for mongoose query
14607|Flutter App closes immediately when i tap on join meeting button using jitsi_meet_wrapper
14608|How to customize ion-select popup width and height in ionic2
14609|Empty extras in AppWidgetProvider&#39;s onReceive if passing a serializable object
14610|Why doesn&#39;t the count() terminal operation print the intermediate steps?
14611|Need a sed command to replace double quotes within a string
14612|How to use useNavigate with React &amp; Redux
14613|Returning dynamic table from function in postgresql
14614|Rails HMAC - use application secret as encryption key
14615|Update wordpress users_meta table with information from another table
14616|EHCache import not working after upgrading spring boot
14617|How can I fill the Data Attribute of a XAML Path with a desired Icon
14618|Using Entity to syncronize scripts file with a database
14619|TypeError: Cannot read properties of undefined with next-auth and ldapjs
14620|I cant connect to MySQL database in Azure using Android Studio(Java)
14621|How to use AcrCloud webAPI in reactJs. I&#39;m making a project to recognise music from youtube links
14622|How to rotate legend symbols in ggplot2?
