1211|Error: Network Error at createError (createError.js:16) at XMLHttpRequest.handleError (xhr.js:84)
1212|Oracle 11g ORA-00205: error in identifying control file, check alert log for more info
1213|decompression of svn diff data failed
1214|FilterRegistrationBean in spring security 3.0.6 doesn&#39;t work when register with exact url
1215|python/briefcase problem on pyproject.toml
1216|Class Error in the resampling for imbalance datasets
1217|How can I invoke a AWS lambda asynchronously and get the result in an Airflow DAG?
1218|Creating column that is a combination of other columns
1219|How to read cell data from online version of Excel (sharepoint.com)
1220|Django Ninja api call from inside a django view
1221|Is there a way to set wrapping to make the same amount of objects on each line in CSS
1222|Dash Plotly Live-Updating Graph Not Refreshing in Browser
1223|Cannot send any emails with Mailjet API
1224|MySQL trigger inserting 0 after a view change used in the trigger
1225|How do I disable the &quot;Firefox is playing&quot; notification even if audio is playing?
1226|Application is running inside IIS process but is not configured to use IIS server .NET Core 3.0
1227|How to create display Date options in dropdown based on year selection Angular
1228|&quot;Find Call Hierarchy&quot; not working in Xcode (big project with cocoapods)
1229|Is there a way to use a Custom PermissionEvaluator to Authorize endpoints from an imported package?
1230|JPA Metamodel doesn&#39;t generate sources after moving to spring boot 3 and java 17
1231|How to clear the console output in dart language?
1232|Writing a unit test to test if a command CanExecute() which depends on whether a ViewModel is Dirty
1233|nextjs react state not update when function parse to child component
1234|IIS displays blank page
1235|Why is the java getPeer call deprecated?
1236|Running Pycharm as root from launcher
1237|Why Prisma introspection does not like my naming?
1238|Postman Request to take Token as an Authorised User from Azure Portal (Azure AD B2C) for Development Purposes
1239|Store a reference to a table in a variable
1240|Want Start Call by Clicking Bluetooth Button, But unable to get sound on web end IOS vonage (OpenTok)
1241|What is free():invalid ponter error and how to solve it
1242|LAMBDA function as Named Range using Office Script
1243|Build Gradle Error Could not get unknown property &#39;compile&#39;
1244|Unit tests for FastAPI - how to use breakpoints?
1245|ImportError: cannot import name &#39;BackNext&#39; from partially initialized module &#39;Forms_PersonalityAssesment.BackAndNext_example1&#39;
1246|Siri suggestions are buggy in iOS 16
1247|How to check which radio button is selected in group box radio button in excel using vba
1248|New deploy with django and zappa only returns the error &quot;NoneType object has no attribute read&quot;
1249|Android Stripe Saved card missing from payment sheet
1250|&quot;Cannot read properties of null (reading &#39;classList&#39;)&quot; in Storybook 7 MDX?
1251|Want Start Call by Clicking Bluetooth Button, But unable to get sound on web end Vonage Ios
1252|SendProcessControlEvent:toPid:encounetered an error: Error Domain=com.apple.dt.deviceproce
1253|How to restrict usage of specific Drawables in a custom design system?
1254|Multiply and divide of variable bit floating point numbers
1255|Get return value directly from Dialog (Confirm a Choice)
1256|How do I use the credit card date format mm/yy in FLUTTER
1257|How can I align my filtering horizontally?
1258|BigCommerce template - how can I get product search_keywords
1259|yield not returning result immediately to caller api - C#8, IAsyncEnumerable
1260|Discord Buttons &quot;Interaction Failed&quot;: TypeError: MyView.on_button_click() missing 1 required positional argument: &#39;button&#39; / &#39;interaction&#39;
1261|How to declare stimulus target in rails link_to
1262|Kanban-board (react - redux) . Need help saving data for different repo
1263|Unity hub won&#39;t download - Fixed
1264|Need help in XDP program failing to load with error &quot;R9 offset is outside of the packet&quot;
1265|Error &quot;Your push would publish a private email address&quot;
1266|Exit code error encountered when terminating &#39;yarn start&#39; command with Ctrl+C
1267|Sharing memory mapped numpy arrays across functions without segmentation faults
1268|Flutter Firebase messaging receiving Background notifications Twice
1269|C#: test runner skips a test for no clear reason
1270|How to add and subtract column in pandas
1271|Could not resolve type id &#39;org.redisson.codec.SmileJacksonCodec&#39; as a subtype of `org.redisson.client.codec.Codec`: no such class found
1272|Python requests working on Windows 11 but getting 404 on Ubuntu 22.04 inside VM
1273|Creating Amazon DynamoDB Table Items from a JSON File
1274|How can I connect Plesk&#39;s server database to windows server database using PHP
1275|Nextjs (app) behind nginx reversed proxy results in permanent redirect
1276|How to log an entire request (headers, body, etc) using rails semantic logger
1277|Pushing an image to ECR, getting &quot;Retrying in ... seconds&quot;
1278|Problem when installing a plugin manually on Jenkins
1279|Spring Oauth2 authorization server allow instropect without authentication
1280|Not able to set up Custom Config Source in Helidon Mp
1281|Replacing all text in a HTML with BeautifulSoup4, while keeping the original DOM structure
1282|Error loading conftest.py due to missing field &quot;lineno&quot; from alias
1283|How to solve Invalid keystore format while building beeware android app
1284|Consuming an IAsyncEnumerable that makes an async call to another service or API and the response returns in batches
1285|Gorm RaiseErrorOnNotFound not working as expected
1286|Can a closure be sent to a SendPort
1287|How to merge two PDF files?
1288|Swift http post has no post data
1289|openpyxl: get the xml source code of a worksheet WITHOUT zipfile
1290|SQL UPDATE SET one column to be equal to a value in a related table referenced by a different column?
1291|Django rest framework, can not logout
1292|Laravel 6.x: Adding blank row when importing in maatwebsite excel
1293|Windows - How to get Device Path of USB device via Vendor and Product ID
1294|Not able to click on the date picker button to change the date using appium and java
1295|How to parse a partially stringified JSON received from an external API in Node.js?
1296|getting &quot;out of bound&quot; on prometheus_remote_write after 1h
1297|Why calculating for unit test is incorrect?
1298|Disable Windows taskbar menu for a WPF window
1299|Make two variables reactive both ways
1300|copy and paste using if isempty not working as expected - VBA
1301|Android 13 can not load ebpf kporbe program
1302|Create a jar file containing the unit test
1303|Power BI custom visual - Retrieve filtered data after using applyJsonFilter() method
1304|How do I fix my numpy array that doesn&#39;t want to reshape properly
1305|Change file format from .xls to .csv in VBA
1306|C# datatable to Excel
1307|How to apply cross_val_score to cross valid our own model
1308|Javascript : Redirecting to another webpage through a popup
1309|Visual Studio Project Wizard fails
1310|LocalDateTime to ZonedDateTime
