20814|This is a program to uppercase the first letter of every word in a string. The code is compiling but throwing some errors while running
20815|How to copy a value to another cells using weeknumber in padas python dataframe?
20816|How can I access button from pug template?
20817|JsonApiDotNetCore and SignalR implementation
20818|how to show indicator for current playing queueitem in mediabrowserservice (android auto) android?
20819|Elastic stack on kubernetes basic setup
20820|How to find eloquent models based on the absense of matching dates in parent and child models
20821|Mikro ORM Virtual entity not being present in service
20822|Discord.js v13 TypeError: Cannot read properties of undefined (reading &#39;players&#39;)
20823|gray border around color picker tailwind
20824|Unhandled Exceptions in Ruby
20825|Xcode Build and Run success, but Archive fails
20826|How to create a dialog in Angular with multiple textboxes binded to an array?
20827|OpenVPN Access Server not working as expected
20828|Vue 2 how to return a watcher in a global function
20829|Cocoapods Installation error -- I have an error while installing Cocoapods with the gem on Monterey 12.3
20830|How to return Tags with ListGroupResources AWS
20831|Play music from a Bash script running from &#39;udev&#39;
20832|How launch of certain TestSuite using the parameter in jUnit?
20833|the link to css file does not work, a have check everything, still does not work, anybody answer me, what is wrong?
20834|Creating a dimension in SQL Server
20835|imblearn library BorderlineSMOTE module does not generate any synthetic data
20836|Save .mp4 from YouTube output stream
20837|HTTPError: HTTP Error 401: Unauthorized for sendgrid integration with python
20838|Pie chart options in ZingChart
20839|Day of Quarter in Redshift
20840|How can I insert an error bar with stat_summary() in ggplot?
20841|How do I resolve %1 is not a valid Win32 application.?
20842|How do I compute row percentages in pandas?
20843|How to set a dirname and file instead of filepath or filename in Django logging?
20844|Spring Authorization Server - Create Users
20845|Not able to delete custom field created through Custom Fields app in Fiori
20846|Maven multimodule project building resources
20847|How to consider single dapr pubsub.yaml file if we have multiple files in components directory
20848|Flutter Upload a file to a given Google Drive
20849|ERROR: jakarta.persistence.PersistenceException: No Persistence provider for EntityManager named
20850|CookiePolicyOptions in ASP.NET 7
20851|Preprocessor directives in Razor
20852|VSCode hot reload for flutter
20853|How to connect digital persona fingerprint device with an android
20854|Generate a dataframe sample
20855|Stop setInterval after 2 time
20856|Is it best practise to set a default state then overwrite with useEffect if default state is potentially unreachable
20857|Lambda function is not authorized to perform sts:AssumeRole
20858|Killing foreground service on Android
20859|Script throws NullReferenceException after tested [x] amount of times? In Unity
20860|Git pull - Please move or remove them before you can merge
20861|Laravel, Livewire, @vite, add specific JS on the layout
20862|How can I develop a custom Viewer Extension that extends from the viewer SDK&#39;s ModelStructurePanel?
20863|Encountered a problem when building my app with Appollo --&gt; gem update xcodeproj?
20864|Client aborts does not trigger &quot;close&quot; event on Node.js request in Node 16
20865|SOAP request works in SOAP UI but It is not working with python Requests library
20866|How to configure the proxy to bypass modification for error responses (e.g., responses with status codes other than 200) in NX package?
20867|C++ : Automatically run function when derived class is constructed
20868|How to auto login in react using @react-oauth/google
20869|Robocopy Windows 11 how to move target folder inside destination folder
20870|Flutter MQTT - Exception: SocketException: Connection reset by peer
20871|MultiColumn ComboBox in DataGridView C# with editable using controll in window Form C#
20872|error while loading shared libraries: libopenpose.so.1.7.0: cannot open shared object file: No such file or directory
20873|Android - create Spinner with Compose
20874|GPT 3.5 API: Why is my webpage output showing undefined?
20875|How do I call a PL/SQL procedure with associative arrays?
20876|MoltenVK failing to create instance on macOS despite setting portability bit
20877|Disable ClassDump to a running JVM process by using sa-jli
20878|The Remote Debugger was unable to locate a resource dll (vsdebugeng.impl.resources.dll) - VS 2017 CE 15.8.7
20879|Are Python type hints ignored at runtime? If so, why do I get a runtime error for a function return type?
20880|Stuck trying to return a list from a predicate to another predicate
20881|Connect button does nothing when adding MS SQL connection in Apache Superset
20882|Null check doesn&#39;t cause type promotion in Dart
20883|Track Redis dependency calls and send details to Application insights
20884|Sending different responses on angular component based on button pressed
20885|Parameter drop down menu
20886|Google Apps Script isn&#39;t updating a formula in a cell
20887|Azure blob storage &quot;Server failed to authenticate the request. Please refer to the information in the www-authenticate header.&quot;
20888|LINQ Aggregate algorithm explained
20889|Amchart5 zooming into wrong dates
20890|Javadoc not found - jakarta.servlet (Tomcat 10.0.23, Apache Netbeans 13, JDK 1.8.0_321)
20891|How to take predefined user input for unit tests in Java?
20892|How to harvest all files in release bin and add some additional info for some executable in a Wix setup?
20893|SQL loop in R with rjdbc, parameterized query errors
20894|How to access Xml child node value with by giveing child node name in condition In PHP using XMLREADER?
20895|Nestjs controller not getting called from angular service file
20896|Updating dictionary dynamically by groups
20897|Send JS variable to PHP script via ajax on click of button where the href attribute is set dynamically
20898|Firestore Rules: Multiple paths in a single match statement
20899|How do I limit the values allowed in a generic const parameter?
20900|SET application_name = &#39;PostgreSQL JDBC Driver
20901|Call Method from User Control in Parent with Unique Parameters
20902|Removing liquidity one-sided through migrating LP to Uniswap v3
20903|Creating this pattern using counters [ 0,0,2,2,4,4,6,6,8,8,10,10,12,12,14,14 and then repeat]
20904|Jenkins scriptler plugin keep running script on master
20905|How to access the embedded struct inside the Slice of Pointers field of a Struct
20906|unable to marshal type &lt;CLASSNAME&gt; as an element because it is missing an @XmlRootElement annotation
20907|Profiling fastAPI endpoint with pyinstrument
20908|C Win32 console ReadConsoleInput() mingw - Unexpected results from mousewheel input
20909|Is it actually possible to use Rollup within NX?
20910|Docker compose not letting access to services
20911|Access denied for s3 bucket for terraform backend
20912|Warning: Use the &#39;defaultValue&#39; or &#39;value&#39; props on &lt;select&gt; instead of setting &#39;selected&#39; on &lt;option&gt;
20913|Issue with SSR with React and Spring boot java
