21014|What happens if the meta tags are present in the document body?
21015|Unknown Statement of type &quot;ForOfStatement&quot; when trying to run an npm library
21016|When a file is missing from the source location, the lftp mv command takes a while. How may this unnecessary delay be avoided?
21017|How to take a field value and need to update that field value to rest of sub arrays using jolt transformation in nifi?
21018|IBM Watson Assistant Custom Extension Variable Assignments
21019|Union of 3D shapes created by a loop
21020|SAP Spartacus OccStoreFinderAdapter override
21021|Can OpenTelemetry (Java) be configured or otherwise convinced to tag spans with MDC values?
21022|is dartz Either Nesisty or just matter of taste?
21023|Check if a type is defined via static_assert?
21024|Keycloak add company logo to the reset password email
21025|libstdc++-6.dll not found
21026|How to manage exceptions thrown in filters in Spring?
21027|looking for a C++ function in the current buffer
21028|Apache Kafka kraft controller dynamic configuration update
21029|How do I include a path to libraries in g++
21030|How do I undo the most recent local commits in Git?
21031|Display the area in common between two surfaces
21032|Generate date of birth from South African ID number
21033|Need vLookup() for Adobe Acrobat Pro form
21034|The request was cancelled due to the configured Http Client.Timeout
21035|Check that button is disabled in react-testing-library
21036|Intersection ratio between 2 polygons in SymPy
21037|Which is the library for data visualization on Nim?
21038|React-pdf-viewer warnings
21039|How does FCHECK in zlib/RFC1950 work?
21040|How to Overcome &quot;Collection was modified; enumeration operation may not execute&quot; Problem Newtonsoft Jsonconvert.SerializeObject
21041|How to send map(key-value pair) as request parameter in a GET call
21042|Send no response if client closed connection
21043|How to get a list of loaded records
21044|Research work: How to identify a technology?
21045|What is the difference between &#39;out&#39; keyword and &#39;:&#39;?
21046|Flutter cast RenderObject to RenderBox
21047|YouTube Data API: Video list property &quot;publicStatsViewable&quot; seems to have no function?
21048|Regex match multiple date formats
21049|Hibernate is not creating tables with H2 in memory database
21050|Posting a file and JSON data to Spring rest service
21051|org.springframework.web.util.NestedServletException: Request processing failed; nested exception is java.lang.NumberFormatException: null
21052|How to check if an individual datatable row is empty or not?
21053|Remove keys with empty strings, null values from a dict
21054|Convert PS object to JSON with PowerShell while retaining string value containing JSON
21055|Pathfinding with Unity Jobs and Burst is slower than without
21056|Android Gradle KeyFactorySpi is defined multiple times
21057|MySQL JDBC DataSource for WebSphere 8.5.5
21058|How to play audio in Jupyter notebook with VSCode?
21059|How do I do &quot;Edit and Continue&quot; builds with cmake projects in Visual Studio 2019?
21060|AWS Aurora - load balance read operation between read replica and writer instance
21061|Tunnel any kind of TCP traffic through HTTP/s
21062|Raw use of parameterized class &#39;RedisTemplate&#39; warning
21063|I tried installing OpenCV on my Raspberry Pi but I encountered some Cmake errors
21064|TypeError: &#39;int&#39; object is not callable
21065|React Native bottom tab navigator element is not assignable
21066|Can we generate Locus report from locust environment class
21067|Should I pass variables into closure in golang in such a code segment?
21068|Repeatable fields across collections in Directus CMS
21069|MS Teams Bot - Error - Failed to acquire token for client credentials
21070|&#39;Multiple custom attributes of the same type found.&#39; with AllowMultiple set at true
21071|Using multiple SQL statements in EF migration - how to use GO to run in SSMS?
21072|(EXCEL) When using a Pivot Table to create a Line Chart, is there a way to restrict the amount of dates shown after Showing Items with No Data?
21073|How should I compile a c++ program that uses glfw3 and glad?
21074|Allow different behaviour for external diff tool if git command is piped
21075|OpenAi tokens consumed in generating response of a query from custom knowledge base
21076|Setting up pincone for autogpt
21077|Ping a VM in another host system from VM running in local system
21078|Google Cloud Spanner - One to one relationship clarification
21079|Fire onmouseover event when element is disabled
21080|Django Tailwind theme refresh - won&#39;t load
21081|Dummy node for TSP and finding shortest Hamiltonian Path
21082|Two Teensy Microprocessor Connected via wire for digitalRead digitalWrite input, output not working
21083|Friend member function compiles in GCC but not in Clang or MSVC
21084|Implement Role Based Security in MVC 4
21085|How to use client only plugins for Inertia SSR + Vue
21086|Error &quot;archive/tar: invalid tar header&quot; extracting from archive
21087|Renaming project in Eclipse and preserving Git files history
21088|Query in SQL Server giving error while running the same query with MySql working fine
21089|Can Nodejs use the async and await fucntionality on a single core processor?
21090|how to test a passed intent to MainActivity, invoking onActiviyResult() method
21091|Cannot pass variables to usemutation() in Apollo
21092|Navigation components : Deeplink using uri depending buildType
21093|Python Plot issues
21094|Hide all rows except for the two most recent dates
21095|set backgroundcolor as UIColor.systembackground in swiftui
21096|How can I make Ajax when data have done loaded?
21097|site builder preview is different from browser preview. What&#39;s the problem?
21098|Is It Possible to Drag and Drop and have the info stored into a mysql data base
21099|How can Spark work in cluster mode with local master?
21100|Styling SwiperJS to show partial slides on either side
21101|Checking Bash exit status of several commands efficiently
21102|Ruby2d doesn&#39;t start on windows 7
21103|Work around for Docker layer caching not working in Azure Pipeline
21104|How to solve Browser Error when verifying with ReCaptcha?
21105|Lifetime problem removing from HashMap&lt;UniCase&lt;Cow&lt;str&gt;&gt;, _&gt;
21106|How to enable tagging in the default autocomplete fields of the Django admin?
21107|Python AWS Library Boto3: kinesis.get_records(shard_iterator)
21108|Finding Centre or Symmetric Line of a Segmentation Image
21109|CosmosClient : ReadItemAsync succeeds, GetItemLinqQueryable fails
21110|Add Content HyperLink to Sheets
21111|Error inserting record into table using postGres function json_populate_recordset
21112|Why do some dependabot PRs not contain any information?
21113|local docker image using python packages - ModuleNotFoundError
