20614|Wordpress cost calculator that does not display the results on the page
20615|MobaXterm SSH-browser Permission denied
20616|Why isn&#39;t my json data formatted nicely in the browser?
20617|How can I create a custom tweening function to randomize mouse movements?
20618|Do sanity checks before or after calling a function?
20619|Issue signing JWT using generated keys and JKS
20620|Is there a way to conditionally set number of array dimensions?
20621|I am not able to start Sanity.io
20622|Convert Strings of a dictionary to int
20623|Accelerometer frequency stuck at 5 Hz
20624|Is SQLite/Android Room the right database for my app?
20625|Post data to MySQL DB using Axios-REACT API via spring boot
20626|How is pywraplp SAT different from CP-SAT?
20627|React Native Execution failed for AarResourcesComplierTransform: /Users/[USER_NAME]/.gradle/caches/transforms
20628|Getting return value of Solidity contract function from web3-1.0.0-beta.27
20629|How to: Programmatically determine the current Outlook item for new event handler
20630|Set pad between arrow and text in annotate function
20631|Default forces in multibody plant
20632|How to change file path for testing function in Pytest?
20633|mpatches.FancyArrowPatch is too short
20634|Merge two data frames based on common column (keep all rows of 1 and only rows in 2 that have matching cells in common column)
20635|Fancy arrow/Patch edge width
20636|How can I fetch data of authorized user from Linkedin API?
20637|Can you read and write with a single Named Pipe client?
20638|Exception al momento de gratificar con netbeans
20639|How to implement Pipe on combineLatest - angular15
20640|Apache Cassandra: Cannot import values of type `map&lt;smallint, blob&gt;` using CSV files
20641|Simple and two head arrows
20642|&quot;PyODBC [Error 10054] : TCP Provider: An existing connection was forcibly closed by the remote host&quot; with fast_executemany=True
20643|Group and count with condition
20644|VSCode chrome debugger for nested create-react-app directory
20645|web3 (then property) in ethereum node
20646|POSTGRESQL: How to find the user with most friends? (With duplicates)
20647|How to get distinct values for multiselect parameter in SSRS report - databricks
20648|Dotted line with FancyArrowPatch
20649|Laravel : Socialite steam redirected but not working
20650|1 cycle + 100 ps delay before block memory puts valid data on the wires causes problem
20651|Plot an arrow going through a chosen point with FancyArrowPatch
20652|filter an array of objects based on another array of objects
20653|Cannot resolve symbol &#39;app.image.tag&#39; error for spring boot maven project
20654|How to design a resilient and highly available service in python?
20655|reverse an SQL instead of &#39;select from TABLE if x=y&#39; &#39;delete from TABLE if y does NOT = x&#39;
20656|Call solidity function from JavaScript got [object promise]?
20657|How to use AutoMapper for Sub-Objects in C#?
20658|How to remove existing CIFilter from video in ios?
20659|Setting the task covariance matrix to the correlation matrix in GPyTorch
20660|How can reorder the factor by stat=summary result
20661|Don&#39;t know how to translate dynamic strings with WP plugin Translatepress
20662|Node Application in firebase cannot connect to web3 RPC
20663|What is the function of discport=0 and [::] in an enode address?
20664|Unable to load the PKCS11_MODULE *.dll library using pkcs11
20665|The width and height of a webp image are stored in which byte
20666|Updating iOS sdk from delphi 11.3 is very slow
20667|Is it possible to query with IN expression in Doctrine, with multiple InParameter as arguments?
20668|How to get the 360&#176; image from Google Street View
20669|error 302 ajax with laravel sanctum &amp; login with laravel fortify
20670|Micronaut&#39;s Page used as a controller method return type is serialized without Page properties
20671|Selenium ChromeDriver hide on server
20672|case EINPROGRESS on socket connect() call
20673|How to add/remove input fields dynamically by a button in shiny
20674|Get container image label without pulling the image from GCR
20675|Debugging create react app in vscode with attach configurations
20676|Why my element undefined in code but defined if I run the code in console js?
20677|How to validate json schema against metaschema in linux cli
20678|How to start a new, blank Elixir Phoenix LiveView project in a docker container when host cannot run Phoenix?
20679|Making a multi-tenant model in Flutter using Firebase but authentication seems to be open
20680|Blazor - Directly accessing page URL does not work, on click via NavMenu works
20681|I need to extend the Session Expiry Timeout/ Login Expiry Timeout in ASP.NET Core Blazor Server
20682|Filebeat configuration with Opensearch in Virtualbox
20683|how in Kotor redirect user and save token so that he can pass authentication?
20684|Contpy error in VS Code integrated terminal
20685|airflow error on db but task still is successful
20686|Npgsql and PostgreSQL timezones issue
20687|Azure SQL Edge Does not persist data to docker volumes
20688|Removing grid from an image
20689|Display encoded image data in angular
20690|Use React App as standalone app and as part of other React App
20691|How to add color to a multi-category bar plot in Plotly while maintaining the original order of data?
20692|React Django Google Sign In
20693|Decompiling Kubeflow pipeline
20694|Problem with accessing open databases in BigQuery
20695|Ionic Cordova Storage will result into a data-loss when building apk on a different machine
20696|How to add a button without a repetition when there is a mapped function top of it in react
20697|Scoped lifetime dependency injection in Go
20698|i have that error: image : [&#39;The image must be an image.&#39;], how can i fix it?
20699|How to compare dates in Vuejs?
20700|Fix for npm global install on Ubuntu
20701|Change value of a textbox, compared to another text box value with a ratio
20702|Unexpected EOF in prolog
20703|Exporting constants which depend on an async response - NodeJS
20704|Extract lines from file A containing values from file B and save extracted lines to file C using Powershell
20705|.webp images are not showing in rich notification (iOS)
20706|Google Sheets Auto HyperLink to Google Earth Web?
20707|It is possible to set the password to expire of an FTP account?
20708|Html datalist values from array in javascript
20709|host function call through global function in cuda c
20710|Is it possible to use Dagger components and modules from production code when writing Android UI Tests?
20711|&quot;if&quot; code bizarrely not following &quot;true&quot; evaluation
20712|Search and replace text of a certain font
20713|Error: Failed with exit code: 1 when try to &quot;npm run make&quot;
