1001|In a Heroku pipeline that&#39;s connected to Github, is it possible to configure automatic deployments from the API? what about manual deployments?
1002|react-native-image-crop-picker build issue for android
1003|Getting error Option &quot;service=grpc-web&quot; not recognized
1004|How do we update facts in clara rules? (clojure)
1005|Shell enviroment variables in for loop CI/CD
1006|How to display a simple form data to another page using Django?
1007|Vertx: request/response with response stream
1008|Python Tkinter Notebook cover other component
1009|Docker hang whenever I create a file in mount point
1010|How to set none for border color of the phone input when using react-phone-number-input
1011|Why do some SQL Server databases go into a &quot;Recovery Pending&quot; state after shutting down / restarting on Linux?
1012|Capturing or importing the To, From, Subject, and email body from an Outlook 2016 email item using C#
1013|Access object properties in shell
1014|Is a donation button in an Android app compliant with Google&#39;s rules?
1015|How to squag (I.E clean) the commit history in the midst of merge?
1016|How to move react-material-ui-carousel indicators avobe carousel
1017|Searching the current working directory and retrieving all of the files in a list in ascending order of the number at the end of the file name
1018|How to execute code in a new browser tab in selenium webdriver
1019|Laravel Routing issued
1020|Hide Font Awesome Icons if Cannot Load Font
1021|Like expload function in pyspark. Need to sort list of dicts by some VALUE in that dict to coresponding column
1022|Entering data to sections into a list
1023|How to load the children on demand in react checkbox tree along with virtual scrolling
1024|What is the format of a DSN less connection string for oracle odbc driver for Oracle 19c
1025|how to bring back the dynamic input fields appended from JQuery when there will be validation error in Laravel
1026|Android 12 Device Owner App Not Booting Correct Launcher
1027|How to build Z3 for dotnet
1028|Git sign off previous commits?
1029|How to identify all the scheduled queries in databricks SQLanalytics
1030|ArgoCD fails updating bitbucket.org private repos with: ssh: handshake failed: knownhosts: key mismatch
1031|Docker Compose, Node.js; Error: Cannot find module &#39;/home/node/app/server.js&#39;
1032|Reordering UITableViewCells (custom class). Cells reset to default once moved off-screen
1033|Why doesn&#39;t python&#39;s griddata produce identical results to MATLAB&#39;s scatteredInterpolant, and is there a python package which is identical?
1034|Flutter Tab view in the middle of the screen
1035|Multi processing Python script not pooling
1036|Select query to get the DDL of the stored procedure ,Tables in snowflake
1037|Opaque type and index signatures
1038|Typescript indexing objects with bracket notation
1039|Run the ClaimCenter server in debug mode with the command line
1040|Failed opening required &#39;../vendor/autoload.php&#39;
1041|Visual Studio 2019 color coding defaults changed?
1042|excel: create an array of averages of two ranges
1043|Webpack on a react project is slow when building
1044|connection to server at &quot;localhost&quot; (127.0.0.1), port 5432 failed
1045|NiFi Avro schema: Copying value into another parameter
1046|I want to make deep linking in flutter web
1047|Notification-less Foreground service
1048|How to switch BottomNavigationItems in Jetpack Compose without overlapping views?
1049|Developing in Unity with XR Ray Interactable, selected objects can&#39;t be detected in different function within same script
1050|AttributeError: &#39;FloatProgress&#39; object has no attribute &#39;style&#39;
1051|Loop through selection and Convert into Hyperlinks and Change (Text To Display)
1052|how to fix page redirection by useing functions
1053|Vector concatenation in Eigen returning an expression
1054|Luxon invalid date
1055|Snowflake Problem: Populate Table with Dates and its Attributes
1056|Session variable not working in another PHP file
1057|How to make view model bindings work with custom Shell App Title View - Xamarin Forms
1058|Can&#39;t use forEach on array of objects
1059|OUTLOOK - Search Folder - criteria to search attachment for text
1060|Word Variation Rectification
1061|PHP Spark Serve looking some port and exited
1062|jqassistant tool how query java method belongs to class
1063|How to Use Docker Build Secrets with Kaniko
1064|Is there any extension or tool for an automatically updating website for HTML for VS Code
1065|How to batch downsample MP3 files using lame?
1066|Hosted Wasm Blazor App with Let&#39;s encrypt. Endpoints not available
1067|Git worktrees not showing branch names, but recognizing branches
1068|calico pod is on Init:CrashLoopBackOff status
1069|MongoDB - Matching the two collections by field name
1070|How to ungroup a table in DolphinDB?
1071|Name &quot;window&quot; is not defined error is coming while executing the mentioned code
1072|Null Error in Flutter Web: MaterialApp causing NullPointerException on start
1073|Change Background Color of ListView Selected Item in Xamarin
1074|How do I display a wide table in SSRS containing lists of names by group
1075|I am having issues making my code responsive for smaller screen sizes
1076|SendGrid - Send mails from customers own domain
1077|How do I programmatically modify Edge settings for the picture in picture button?
1078|How can I see what this code is referring to
1079|Get world space Oriented Boundin Box 8 points in unreal (C++)
1080|Fetch distinct id&#39;s based on few criteria in Angular
1081|Changing the string format of the WPF DatePicker
1082|Quota exceeded log in GCP
1083|NextJS getting error on the first npm run dev
1084|How do you convert a timestamp into a datetime in python with the correct timezone?
1085|SAML setup for Azure AD B2C vs Azure AD
1086|How to perform unit test for a method which provoke a props in React 18?
1087|Unable to retrieve files on port 8085 on tomcat
1088|Yocto Bitbake not taking latest recipe changes
1089|sage plot3d fails - browser opens, but then hangs. Sometimes, I get an error that a file cannot be read
1090|Cognos excel report name not showing based on page break while scheduling why?
1091|Refused to evaluate a string as JavaScript because &#39;unsafe-eval&#39; is not an allowed source of script
1092|Problem with ThingsBoard temperature script
1093|I want to change the color of an SVG when a link is clicked
1094|VSCode dev container fails to load ms-vscode.js-debug extension correctly
1095|I want to delete the MySQL connection and create a new one
1096|Year over Year difference in Power BI matrix with year filter
1097|Cmake --config since version 3.20
1098|Fa-Spin on hover link text too, not only when hover icon
1099|How to create combination table?
1100|How to increase the memory heap size on IntelliJ IDEA?
