22125|How can make a button on a nav that scrolls to a specific point in the page, but shorthand
22126|GDB not showing any own code in stack trace when debugging a FPC app on Linux
22127|Customizing jupyterlab GUI to have a basic GU
22128|How to convert a table data to string for comparisson in php
22129|Laravel search with Meilisearch with multiple word fragments
22130|Build flag added to the configuration and causes pipeline fail
22131|Angular; debounce mouseenter event on array of items by rxjs
22132|Json Serialization Exception : Newtonsoft.Json.JsonSerializationException
22133|BSC Scan Token Holders
22134|Dante Socks5 proxy server doesn&#39;t restart
22135|Is there a way to fetch PDF from URL and extract text from it in Deno?
22136|PHP HTML div styled table rendering class: wrong indentation
22137|Use Swift with Turbo Module
22138|Other than the opcache what can require php-fpm to be restarted to see changes?
22139|gRPC request failing on Android &lt;= 9
22140|Azure openai connection with javascript
22141|Cipherd not supported by SSL engine
22142|which version of apollo-angular is compatible with angular 13
22143|Laravel Queue Job gives error Model not found
22144|Ambiguous references with the exact same namespace
22145|Using Hot Keys with Monaco Editor?
22146|How to use git command in AWS CodeDeploy command shell
22147|How to populate in a specific field in mongodb using mongoose
22148|net::ERR_SSL_PROTOCOL_ERROR on an angular application deployed on IIS
22149|Testing an async server component with Jest in Next 13
22150|How to build c++20 using modules with autotools?
22151|SAX Feature Not Supported in Spring Boot 2.6.1
22152|TKinter leaving borders around widgets
22153|I want the percentage of each category to appear above each bar of my bar chart
22154|Troubleshoot: Run Python Script in Cloud Flows
22155|Rename the add_columns columns in modelsummary and add multiple columns
22156|How to set state.backend.rocksdb.localdir with code
22157|the Assert.assertTrue(boolean condition) returns false instead of returning true
22158|Warning: A non-numeric value encountered in D:\php\Practice 1\index.php on line 61
22159|Next.js UseRouter not mounted
22160|ActiveMQ Artemis 2.27.1 $.artemis.internal.sf large messages are building up
22161|tesseract output is in single line instead of multiple lines
22162|Error: Failed to launch the browser process! /tmp/chromium: /usr/lib/x86_64-linux-gnu/libnss3.so: version `NSS_3.30&#39; not found
22163|Ask laravel function download in laravel
22164|add a sentence at the end of a column that itself has two inner-column
22165|Difference between pgpool `primary` and watchdog `MASTER` versus the load_balance_node
22166|ImportError: cannot import name &#39;load_index_from_storage&#39; from &#39;llama_index&#39;
22167|Android Studios failed to read key from store. Invalid key store format
22168|Get total rows incorrect
22169|How can I sort an object with a datetime list by ascending order?
22170|Find the elbow point of L-Curve by using np.diff() twice. But the result is not good
22171|Add Files from one CSV to another one
22172|I am trying to enter values in a MYSQL database using flask_sqlalchemy and flask but it&#39;s showing error
22173|Unexpected sizeof auto variable assigned to lambda
22174|Make HTML Audio file to be played only once?
22175|d3.js Insert() function adds child element - instead of a sibling element
22176|&lt;GAS&gt; How to create graph(s) in google doc by using google app script
22177|Carousel not compatible with a lightbox: The lightbox doesn&#39;t count the number of images correctly
22178|in mqtt qos1 i want to set dup flag true i dont know im not setting up dup falg can anybody explain this
22179|Azure Logic App SMTP error Please check your account info and/or permissions and try again
22180|Trouble achieving photorealistic room image with stable diffusion in rendering
22181|Does excel if function can&#39;t return column if text long is long?
22182|Java17 can&#39;t get field offset on a hidden class: private final java.util.regex.Pattern$CharPredicate java.util.regex.Pattern$CharPredicate$$Lambda$
22183|How to work with azure devops default service principal for keyvault variable group expansion in terraform
22184|Fail to send kubectl command using aws ssm run command?
22185|Error: Requiring module which threw an exception: Invariant Violation: &quot;background&quot; &quot;background&quot; is not a valid style property
22186|I am trying to merge three set of data that i have grouped using.group by and aggregated but I keep getting an error..what should i do?
22187|How can building a heap be O(n) time complexity?
22188|NDCG-score in top-k recommendations
22189|Optimisation of a system of inequality relations
22190|why when i add a datetime field i fail to submit my form in laravel
22191|Spring Cloud Load Balancer Sending Requests to Unavailable Services when Using Eureka
22192|Waiting for child process in other terminal works if launched with &#39;x-terminal-emulator&#39; but not if launched with &#39;gnome-terminal&#39;
22193|How to grant permissions on a MySQL database by foreign key value
22194|ModuleNotFoundError: No module named sklearn
22195|Excel: Getting specific data from table lined up
22196|Bootstrap 4 navbar dropdown not working on mobile
22197|Extract a specific domain links from HTML of a website
22198|Need to convert a table with 2 millions rows into .xlsx using Crystal Reports and C#
22199|Amazon Elastic Beanstalk - Change Timezone
22200|Return when last event occurred in Dataframe by Group
22201|how to plot a stationary series without using o marker
22202|How to fix xtensa-lx106-elf-g++: error: unrecognized command line option &#39;-std=gnu++17&#39; error on Arduino IDE
22203|How to automate upload multiple files (Katalon Studio) when there is no attribute &quot;multiple&quot; in tag input?
22204|Why are the apple keyboard shortcuts making finder the &quot;active app&quot;?
22205|Owasp ZAP not performing authentication during active scan using &quot;Form-Based-Authentication&quot; ON python project
22206|Fixing the issue of AR Oclusion quality
22207|Puppeeer old Headless deprecation warning Capture-website-cli 3-0-1
22208|Jar file doesn&#39;t read custom fonts but works fine when I run file in netbeans
22209|error in `if_else()`: ! `false` must be a logical vector, not a double vector, but this variable must be numeric in R
22210|mongoose pipeline does not work - $match does not work
22211|Changing the url of the redirected page in Laravel
22212|Unity C# Codes Not Detecting Issue
22213|Python Zip &amp; Move Script Error with Exit Code -1071120348 (0xC0280024), Exit Code Description - Lost
22214|How to get each status of a matrix job?
22215|WPF C# System.Drawing.Common is not supported on this platform - on Windows, VS2022
22216|Kubernetes : dial tcp 127.0.0.1:8080: connect: connection refused
22217|StyleGAN2-ADA-PyTorch Training Stopped Unexpectedly without Error Messages
22218|Leaflet React get map instance in functional component
22219|Optimizing performance of Python code for large datasets
22220|feature file is not running in karate framewrok in intellij
22221|How to stream back audio using External Media Channel using ARI in asterisk
22222|rss.xml file in public fold of Nextjs goes to 404 after deploying to Vercel
22223|Update value for flag column
22224|How to remove a job from mongodb in agenda jobs? in nodejs
