22001|By analyzing the blame information on this pull request, we identified @egamma and @alexandrudima to be potential reviewers
22002|Hi **@kisstkondoros**, I'm your friendly neighborhood Microsoft Pull Request Bot (You can call me MSBOT). Thanks for your contribution!     <span>         This seems like a small (but important) contribution, so no Contribution License Agreement is required at this point. Real humans will now evaluate your PR.     </span>  TTYL, MSBOT;
22003|Is this happening consistently for you?
22004|I have not come across the bug today. Note that when I did this issue I did check if I had the latest TypeScript version and updated it to `1.8.10`.  Maybe that fixed it ? I'll come back to you tomorrow at the end of the day to tell you if it ocurred or it seems fixed.  `TypeScript` release note :   > This release fixes an issue in React 15.0 and later by removing a dependency on an internal React API when emitting JSX spread attributes. As a result, TypeScript now emits its own standalone helper function for spread attributes.
22005|This happens every time I open it up it just freezes.
22006|Can you paste in the output of this?  ``` /usr/share/code/code --verbose ```
22007|A first step would be to at least have a Configure Language item under the File > Preferences menu.
22008|"Ideally, I would like to see VSCode keybindings to have the option to be context based and allow key-chords and key-chains. If these keybinding options are built in to VSCode keybinding support, most vim support could be configured into using only keybindings themselves.  For example, something like:  ``` yaml [     {         ""key"": ""l"",         ""command"": ""cursorRight"",         ""when"": ""editorTextFocus && normalMode""     },     {         // press and release 'd', then press and release 'd'         ""key"": ""dd"",          ""command"": ""editor.action.deleteLines"",         ""when"": ""editorTextFocus && normalMode""     },     {         // press and release the chord 'ctrl+a', then press and release 'ctrl+d'         ""key"": ""ctrl+a; ctrl+d"",          ""command"": ""editor.action.deleteLines"",         ""when"": ""editorTextFocus && insertMode""     } ] ```  I know this doesn't cover all of the bases but it would certainly help to be built into VSCode itself.  If amount of fancyness is no issue, supporting regex based mappings too would be amazing:  ``` yaml [     {         ""regex_key"": ""([0-9]+); d"",         ""command"": ""editor.action.delete(\1)"",         ""when"": ""editorTextFocus && normalMode""     } ] ```"
22009|Likely dupe of #5179
22010|@vaishnav4226 [these uninstall/re-install steps](https://www.microsoft.com/net/core#macosx) worked for me.
22011|No used yast to install git. I did get the ZIP file version working though. However the installer clearly didn't recognize my installed version of git.  Dave
22012|@isidorn @weinand  Hi - I have been able to fix the source display on my implementation by following means: I set sourceReference to the pointer address of the source string, and store a list of sourceReference to stack depth mapping in the debugger. So when the front-end sends a Source request I lookup the stack depth using the sourceReference.  I only need to know the stack depth to locate the source - as the source is available in the Lua VM. But since stack depth is not unique - my original solution of passing this as sourceReference would not work.   Is it possible to do following:  a) Add a stack frameId to the Source request - can the front end supply this? b) Ensure that sourceReference is sized such that it can hold pointer values (as integers). This seems to work but I am not sure what the 'number' JSON value can hold and whether it is large enough to hold a pointer value.  The stack frameId is all I need to return the source. But this may not be true for other debug adapters of course.
22013|Moved to [#337](https://github.com/Microsoft/vscode-go/issues/337)
22014|Here is what I got  $ /usr/share/code/code --verbose bash: cannot set terminal process group (-1): Inappropriate ioctl for device bash: no job control in this shell (8:02:53 PM) ### VSCode main.js ### (8:02:53 PM) /usr/share/code/resources/app { pathArguments: [],   programStart: 0,   enablePerformance: false,   verboseLogging: true,   debugExtensionHostPort: undefined,   debugBrkExtensionHost: false,   logExtensionHostCommunication: false,   debugBrkFileWatcherPort: undefined,   openNewWindow: false,   openInSameWindow: false,   gotoLineMode: false,   diffMode: false,   extensionsHomePath: undefined,   extensionDevelopmentPath: undefined,   extensionTestsPath: undefined,   disableExtensions: false,   locale: undefined,   waitForWindowClose: false } [3783:0519/200255:ERROR:texture_manager.cc(2278)] [.CommandBufferContext.Compositor-0x3cf63f8ff000]GL ERROR :GL_INVALID_ENUM : glTexImage2D: <- error from previous GL command [3783:0519/200255:ERROR:gles2_cmd_decoder.cc(2109)] [.CommandBufferContext.CompositorWorker-0x3cf63ef3ac60]GL ERROR :GL_INVALID_ENUM : GLES2DecoderImpl::DoBindTexImage2DCHROMIUM: <- error from previous GL command [3783:0519/200255:ERROR:gles2_cmd_decoder.cc(2109)] [.CommandBufferContext.CompositorWorker-0x3cf63ef3ac60]GL ERROR :GL_INVALID_VALUE : ScopedTextureBinder::dtor: <- error from previous GL command [3783:0519/200255:ERROR:gles2_cmd_decoder.cc(2109)] [.CommandBufferContext.CompositorWorker-0x3cf63ef3ac60]GL ERROR :GL_INVALID_VALUE : ScopedTextureBinder::dtor: <- error from previous GL command [3783:0519/200255:ERROR:gles2_cmd_decoder.cc(2109)] [.CommandBufferContext.CompositorWorker-0x3cf63ef3ac60]GL ERROR :GL_INVALID_VALUE : ScopedTextureBinder::dtor: <- error from previous GL command [3783:0519/200255:ERROR:gles2_cmd_decoder.cc(2109)] [.CommandBufferContext.CompositorWorker-0x3cf63ef3ac60]GL ERROR :GL_INVALID_VALUE : ScopedTextureBinder::dtor: <- error from previous GL command [3783:0519/200255:ERROR:gles2_cmd_decoder.cc(2109)] [.CommandBufferContext.CompositorWorker-0x3cf63ef3ac60]GL ERROR :GL_INVALID_VALUE : ScopedTextureBinder::dtor: <- error from previous GL command [3783:0519/200255:ERROR:gles2_cmd_decoder.cc(2109)] [.CommandBufferContext.CompositorWorker-0x3cf63ef3ac60]GL ERROR :GL_INVALID_VALUE : ScopedTextureBinder::dtor: <- error from previous GL command (8:02:59 PM) IPC#vscode:startCrashReporter [3783:0519/200301:ERROR:texture_manager.cc(2278)] [.CommandBufferContext.RenderCompositor-0x135e78c53c60]GL ERROR :GL_INVALID_ENUM : glTexImage2D: <- error from previous GL command [3783:0519/200301:ERROR:gles2_cmd_decoder.cc(2109)] [.CommandBufferContext.RenderWorker-0x135e78c536e0]GL ERROR :GL_INVALID_ENUM : GLES2DecoderImpl::DoBindTexImage2DCHROMIUM: <- error from previous GL command [3783:0519/200301:ERROR:gles2_cmd_decoder.cc(2113)] [.CommandBufferContext.RenderWorker-0x135e78c536e0]GL ERROR :GL_INVALID_OPERATION : ScopedTextureBinder::ctor: was unhandled [3783:0519/200301:ERROR:gles2_cmd_decoder.cc(2109)] [.CommandBufferContext.RenderWorker-0x135e78c536e0]GL ERROR :GL_INVALID_VALUE : ScopedTextureBinder::dtor: <- error from previous GL command [3783:0519/200301:ERROR:gles2_cmd_decoder.cc(2109)] [.CommandBufferContext.RenderWorker-0x135e78c536e0]GL ERROR :GL_INVALID_VALUE : ScopedTextureBinder::dtor: <- error from previous GL command [3783:0519/200301:ERROR:gles2_cmd_decoder.cc(2109)] [.CommandBufferContext.RenderWorker-0x135e78c536e0]GL ERROR :GL_INVALID_VALUE : ScopedTextureBinder::dtor: <- error from previous GL command [3783:0519/200301:ERROR:gles2_cmd_decoder.cc(2109)] [.CommandBufferContext.RenderWorker-0x135e78c536e0]GL ERROR :GL_INVALID_VALUE : ScopedTextureBinder::dtor: <- error from previous GL command [3783:0519/200301:ERROR:gles2_cmd_decoder.cc(2109)] [.CommandBufferContext.RenderWorker-0x135e78c536e0]GL ERROR :GL_INVALID_VALUE : ScopedTextureBinder::dtor: <- error from previous GL command [3783:0519/200301:ERROR:gles2_cmd_decoder.cc(2109)] [.CommandBufferContext.RenderWorker-0x135e78c536e0]GL ERROR :GL_INVALID_VALUE : ScopedTextureBinder::dtor: <- error from previous GL command [3783:0519/200301:ERROR:gles2_cmd_decoder.cc(2109)] [.CommandBufferContext.RenderWorker-0x135e78c536e0]GL ERROR :GL_INVALID_VALUE : ScopedTextureBinder::dtor: <- error from previous GL command [3783:0519/200301:ERROR:gles2_cmd_decoder.cc(2109)] [.CommandBufferContext.RenderWorker-0x135e78c536e0]GL ERROR :GL_INVALID_VALUE : ScopedTextureBinder::dtor: <- error from previous GL command [3783:0519/200301:ERROR:gles2_cmd_decoder.cc(2109)] [.CommandBufferContext.RenderWorker-0x135e78c536e0]GL ERROR :GL_INVALID_VALUE : ScopedTextureBinder::dtor: <- error from previous GL command [3783:0519/200301:ERROR:gles2_cmd_decoder.cc(2109)] [.CommandBufferContext.RenderWorker-0x135e78c536e0]GL ERROR :GL_INVALID_VALUE : ScopedTextureBinder::dtor: <- error from previous GL command [3783:0519/200301:ERROR:gles2_cmd_decoder.cc(2109)] [.CommandBufferContext.RenderWorker-0x135e78c536e0]GL ERROR :GL_INVALID_VALUE : ScopedTextureBinder::dtor: <- error from previous GL command [3783:0519/200301:ERROR:gles2_cmd_decoder.cc(2109)] [.CommandBufferContext.RenderWorker-0x135e78c536e0]GL ERROR :GL_INVALID_VALUE : ScopedTextureBinder::dtor: <- error from previous GL command [3783:0519/200301:ERROR:gles2_cmd_decoder.cc(2109)] [.CommandBufferContext.RenderWorker-0x135e78c536e0]GL ERROR :GL_INVALID_VALUE : ScopedTextureBinder::dtor: <- error from previous GL command (8:03:01 PM) IPC#vscode-workbenchLoaded [3783:0519/200302:ERROR:gles2_cmd_decoder.cc(2109)] [.CommandBufferContext.RenderWorker-0x135e78c536e0]GL ERROR :GL_INVALID_VALUE : ScopedTextureBinder::dtor: <- error from previous GL command [3783:0519/200302:ERROR:gles2_cmd_decoder.cc(2109)] [.CommandBufferContext.RenderWorker-0x135e78c536e0]GL ERROR :GL_INVALID_VALUE : ScopedTextureBinder::dtor: <- error from previous GL command [3783:0519/200302:ERROR:gles2_cmd_decoder.cc(2109)] [.CommandBufferContext.RenderWorker-0x135e78c536e0]GL ERROR :GL_INVALID_VALUE : ScopedTextureBinder::dtor: <- error from previous GL command [3783:0519/200302:ERROR:gles2_cmd_decoder.cc(2109)] [.CommandBufferContext.RenderWorker-0x135e78c536e0]GL ERROR :GL_INVALID_VALUE : ScopedTextureBinder::dtor: <- error from previous GL command [3783:0519/200302:ERROR:gles2_cmd_decoder.cc(2109)] [.CommandBufferContext.RenderWorker-0x135e78c536e0]GL ERROR :GL_INVALID_VALUE : ScopedTextureBinder::dtor: <- error from previous GL command [3783:0519/200302:ERROR:gles2_cmd_decoder.cc(2109)] [.CommandBufferContext.RenderWorker-0x135e78c536e0]GL ERROR :GL_INVALID_VALUE : ScopedTextureBinder::dtor: <- error from previous GL command [3783:0519/200302:ERROR:gles2_cmd_decoder.cc(2109)] [.CommandBufferContext.RenderWorker-0x135e78c536e0]GL ERROR :GL_INVALID_VALUE : ScopedTextureBinder::dtor: <- error from previous GL command [3783:0519/200302:ERROR:gles2_cmd_decoder.cc(2109)] [.CommandBufferContext.RenderWorker-0x135e78c536e0]GL ERROR :GL_INVALID_VALUE : ScopedTextureBinder::dtor: <- error from previous GL command [3783:0519/200302:ERROR:gles2_cmd_decoder.cc(2109)] [.CommandBufferContext.RenderWorker-0x135e78c536e0]GL ERROR :GL_INVALID_VALUE : ScopedTextureBinder::dtor: <- error from previous GL command [3783:0519/200302:ERROR:gles2_cmd_decoder.cc(2109)] [.CommandBufferContext.RenderWorker-0x135e78c536e0]GL ERROR :GL_INVALID_VALUE : ScopedTextureBinder::dtor: <- error from previous GL command [3783:0519/200302:ERROR:gles2_cmd_decoder.cc(2109)] [.CommandBufferContext.RenderWorker-0x135e78c536e0]GL ERROR :GL_INVALID_VALUE : ScopedTextureBinder::dtor: <- error from previous GL command [3783:0519/200302:ERROR:gles2_cmd_decoder.cc(2109)] [.CommandBufferContext.RenderWorker-0x135e78c536e0]GL ERROR :GL_INVALID_VALUE : ScopedTextureBinder::dtor: <- error from previous GL command [3783:0519/200302:ERROR:gles2_cmd_decoder.cc(2109)] [.CommandBufferContext.RenderWorker-0x135e78c536e0]GL ERROR :GL_INVALID_VALUE : ScopedTextureBinder::dtor: <- error from previous GL command [3783:0519/200303:ERROR:gles2_cmd_decoder.cc(2109)] [.CommandBufferContext.RenderWorker-0x135e78c536e0]GL ERROR :GL_INVALID_VALUE : ScopedTextureBinder::dtor: <- error from previous GL command [3783:0519/200303:ERROR:gles2_cmd_decoder.cc(2109)] [.CommandBufferContext.RenderWorker-0x135e78c536e0]GL ERROR :GL_INVALID_VALUE : ScopedTextureBinder::dtor: <- error from previous GL command [3783:0519/200303:ERROR:gles2_cmd_decoder.cc(2109)] [.CommandBufferContext.RenderWorker-0x135e78c536e0]GL ERROR :GL_INVALID_VALUE : ScopedTextureBinder::dtor: <- error from previous GL command [3783:0519/200303:ERROR:gles2_cmd_decoder.cc(2109)] [.CommandBufferContext.RenderWorker-0x135e78c536e0]GL ERROR :GL_INVALID_VALUE : ScopedTextureBinder::dtor: <- error from previous GL command [3783:0519/200303:ERROR:gles2_cmd_decoder.cc(2109)] [.CommandBufferContext.RenderWorker-0x135e78c536e0]GL ERROR :GL_INVALID_VALUE : ScopedTextureBinder::dtor: <- error from previous GL command [3783:0519/200303:ERROR:gles2_cmd_decoder.cc(2109)] [.CommandBufferContext.RenderWorker-0x135e78c536e0]GL ERROR :GL_INVALID_VALUE : ScopedTextureBinder::dtor: <- error from previous GL command [3783:0519/200303:ERROR:gles2_cmd_decoder.cc(2109)] [.CommandBufferContext.RenderWorker-0x135e78c536e0]GL ERROR :GL_INVALID_VALUE : ScopedTextureBinder::dtor: <- error from previous GL command [3783:0519/200303:ERROR:gles2_cmd_decoder.cc(2109)] [.CommandBufferContext.RenderWorker-0x135e78c536e0]GL ERROR :GL_INVALID_VALUE : ScopedTextureBinder::dtor: <- error from previous GL command [3783:0519/200303:ERROR:gles2_cmd_decoder.cc(2109)] [.CommandBufferContext.RenderWorker-0x135e78c536e0]GL ERROR :GL_INVALID_VALUE : ScopedTextureBinder::dtor: <- error from previous GL command [3783:0519/200303:ERROR:gles2_cmd_decoder.cc(2109)] [.CommandBufferContext.RenderWorker-0x135e78c536e0]GL ERROR :GL_INVALID_VALUE : ScopedTextureBinder::dtor: <- error from previous GL command [3783:0519/200303:ERROR:gles2_cmd_decoder.cc(2109)] [.CommandBufferContext.RenderWorker-0x135e78c536e0]GL ERROR :GL_INVALID_VALUE : ScopedTextureBinder::dtor: <- error from previous GL command [3783:0519/200303:ERROR:gles2_cmd_decoder.cc(2109)] [.CommandBufferContext.RenderWorker-0x135e78c536e0]GL ERROR :GL_INVALID_VALUE : ScopedTextureBinder::dtor: <- error from previous GL command [3783:0519/200303:ERROR:gles2_cmd_decoder.cc(2109)] [.CommandBufferContext.RenderWorker-0x135e78c536e0]GL ERROR :GL_INVALID_VALUE : ScopedTextureBinder::dtor: <- error from previous GL command [3783:0519/200303:ERROR:gles2_cmd_decoder.cc(2109)] [.CommandBufferContext.RenderWorker-0x135e78c536e0]GL ERROR :GL_INVALID_VALUE : ScopedTextureBinder::dtor: <- error from previous GL command [3783:0519/200303:ERROR:gles2_cmd_decoder.cc(2109)] [.CommandBufferContext.RenderWorker-0x135e78c536e0]GL ERROR :GL_INVALID_VALUE : ScopedTextureBinder::dtor: <- error from previous GL command [3783:0519/200303:ERROR:gles2_cmd_decoder.cc(2109)] [.CommandBufferContext.RenderWorker-0x135e78c536e0]GL ERROR :GL_INVALID_VALUE : ScopedTextureBinder::dtor: <- error from previous GL command [3783:0519/200303:ERROR:gles2_cmd_decoder.cc(2109)] [.CommandBufferContext.RenderWorker-0x135e78c536e0]GL ERROR :GL_INVALID_VALUE : ScopedTextureBinder::dtor: <- error from previous GL command [3783:0519/200303:ERROR:gles2_cmd_decoder.cc(2109)] [.CommandBufferContext.RenderWorker-0x135e78c536e0]GL ERROR :GL_INVALID_VALUE : ScopedTextureBinder::dtor: <- error from previous GL command [3783:0519/200303:ERROR:gles2_cmd_decoder.cc(2109)] [.CommandBufferContext.RenderWorker-0x135e78c536e0]GL ERROR :GL_INVALID_VALUE : ScopedTextureBinder::dtor: <- error from previous GL command [3783:0519/200304:ERROR:gles2_cmd_decoder.cc(2109)] [.CommandBufferContext.RenderWorker-0x135e78c536e0]GL ERROR :GL_INVALID_VALUE : ScopedTextureBinder::dtor: <- error from previous GL command [3783:0519/200304:ERROR:gles2_cmd_decoder.cc(2113)] [.CommandBufferContext.RenderWorker-0x135e78c536e0]GL ERROR :GL_INVALID_OPERATION : ScopedTextureBinder::ctor: was unhandled [3783:0519/200304:ERROR:gles2_cmd_decoder.cc(2109)] [.CommandBufferContext.RenderWorker-0x135e78c536e0]GL ERROR :GL_INVALID_VALUE : ScopedTextureBinder::dtor: <- error from previous GL command [3783:0519/200304:ERROR:gles2_cmd_decoder.cc(2109)] [.CommandBufferContext.RenderWorker-0x135e78c536e0]GL ERROR :GL_INVALID_VALUE : ScopedTextureBinder::dtor: <- error from previous GL command [3783:0519/200304:ERROR:gles2_cmd_decoder.cc(2109)] [.CommandBufferContext.RenderWorker-0x135e78c536e0]GL ERROR :GL_INVALID_VALUE : ScopedTextureBinder::dtor: <- error from previous GL command [3783:0519/200304:ERROR:gles2_cmd_decoder.cc(2109)] [.CommandBufferContext.RenderWorker-0x135e78c536e0]GL ERROR :GL_INVALID_VALUE : ScopedTextureBinder::dtor: <- error from previous GL command [3783:0519/200305:ERROR:gles2_cmd_decoder.cc(2109)] [.CommandBufferContext.RenderWorker-0x135e78c536e0]GL ERROR :GL_INVALID_VALUE : ScopedTextureBinder::dtor: <- error from previous GL command [3783:0519/200305:ERROR:gles2_cmd_decoder.cc(2109)] [.CommandBufferContext.RenderWorker-0x135e78c536e0]GL ERROR :GL_INVALID_VALUE : ScopedTextureBinder::dtor: <- error from previous GL command [3783:0519/200306:ERROR:gles2_cmd_decoder.cc(2109)] [.CommandBufferContext.RenderWorker-0x135e78c536e0]GL ERROR :GL_INVALID_VALUE : ScopedTextureBinder::dtor: <- error from previous GL command [3783:0519/200306:ERROR:gles2_cmd_decoder.cc(2109)] [.CommandBufferContext.RenderWorker-0x135e78c536e0]GL ERROR :GL_INVALID_VALUE : ScopedTextureBinder::dtor: <- error from previous GL command [3783:0519/200307:ERROR:gles2_cmd_decoder.cc(2109)] [.CommandBufferContext.RenderWorker-0x135e78c536e0]GL ERROR :GL_INVALID_VALUE : ScopedTextureBinder::dtor: <- error from previous GL command [3783:0519/200307:ERROR:gles2_cmd_decoder.cc(2109)] [.CommandBufferContext.RenderWorker-0x135e78c536e0]GL ERROR :GL_INVALID_VALUE : ScopedTextureBinder::dtor: <- error from previous GL command [3783:0519/200308:ERROR:gles2_cmd_decoder.cc(2109)] [.CommandBufferContext.RenderWorker-0x135e78c536e0]GL ERROR :GL_INVALID_VALUE : ScopedTextureBinder::dtor: <- error from previous GL command [3783:0519/200308:ERROR:gles2_cmd_decoder.cc(2109)] [.CommandBufferContext.RenderWorker-0x135e78c536e0]GL ERROR :GL_INVALID_VALUE : ScopedTextureBinder::dtor: <- error from previous GL command [3783:0519/200309:ERROR:gles2_cmd_decoder.cc(2109)] [.CommandBufferContext.RenderWorker-0x135e78c536e0]GL ERROR :GL_INVALID_VALUE : ScopedTextureBinder::dtor: <- error from previous GL command [3783:0519/200309:ERROR:gles2_cmd_decoder.cc(2109)] [.CommandBufferContext.RenderWorker-0x135e78c536e0]GL ERROR :GL_INVALID_VALUE : ScopedTextureBinder::dtor: <- error from previous GL command [3783:0519/200310:ERROR:gles2_cmd_decoder.cc(2109)] [.CommandBufferContext.RenderWorker-0x135e78c536e0]GL ERROR :GL_INVALID_VALUE : ScopedTextureBinder::dtor: <- error from previous GL command [3783:0519/200310:ERROR:gles2_cmd_decoder.cc(2109)] [.CommandBufferContext.RenderWorker-0x135e78c536e0]GL ERROR :GL_INVALID_VALUE : ScopedTextureBinder::dtor: <- error from previous GL command [3783:0519/200311:ERROR:gles2_cmd_decoder.cc(2109)] [.CommandBufferContext.RenderWorker-0x135e78c536e0]GL ERROR :GL_INVALID_VALUE : ScopedTextureBinder::dtor: <- error from previous GL command [3783:0519/200311:ERROR:gles2_cmd_decoder.cc(2109)] [.CommandBufferContext.RenderWorker-0x135e78c536e0]GL ERROR :GL_INVALID_VALUE : ScopedTextureBinder::dtor: <- error from previous GL command [3783:0519/200312:ERROR:gles2_cmd_decoder.cc(2109)] [.CommandBufferContext.RenderWorker-0x135e78c536e0]GL ERROR :GL_INVALID_VALUE : ScopedTextureBinder::dtor: <- error from previous GL command [3783:0519/200312:ERROR:gles2_cmd_decoder.cc(2109)] [.CommandBufferContext.RenderWorker-0x135e78c536e0]GL ERROR :GL_INVALID_VALUE : ScopedTextureBinder::dtor: <- error from previous GL command [3783:0519/200313:ERROR:gles2_cmd_decoder.cc(2109)] [.CommandBufferContext.CompositorWorker-0x3cf63ef3ac60]GL ERROR :GL_INVALID_VALUE : ScopedTextureBinder::dtor: <- error from previous GL command [3783:0519/200313:ERROR:gles2_cmd_decoder.cc(2109)] [.CommandBufferContext.RenderWorker-0x135e78c536e0]GL ERROR :GL_INVALID_VALUE : ScopedTextureBinder::dtor: <- error from previous GL command [3783:0519/200313:ERROR:gles2_cmd_decoder.cc(2109)] [.CommandBufferContext.CompositorWorker-0x3cf63ef3ac60]GL ERROR :GL_INVALID_VALUE : ScopedTextureBinder::dtor: <- error from previous GL command [3783:0519/200313:ERROR:gles2_cmd_decoder.cc(2109)] [.CommandBufferContext.CompositorWorker-0x3cf63ef3ac60]GL ERROR :GL_INVALID_VALUE : ScopedTextureBinder::dtor: <- error from previous GL command [3783:0519/200313:ERROR:gles2_cmd_decoder.cc(2109)] [.CommandBufferContext.CompositorWorker-0x3cf63ef3ac60]GL ERROR :GL_INVALID_VALUE : ScopedTextureBinder::dtor: <- error from previous GL command [3783:0519/200313:ERROR:gles2_cmd_decoder.cc(2109)] [.CommandBufferContext.CompositorWorker-0x3cf63ef3ac60]GL ERROR :GL_INVALID_VALUE : ScopedTextureBinder::dtor: <- error from previous GL command ^A^C(8:03:22 PM) Lifecycle#before-quit (8:03:22 PM) Lifecycle#window-before-close 1 (8:03:22 PM) Lifecycle#unload() 1 (8:03:22 PM) Lifecycle#window-before-close 1 (8:03:22 PM) Lifecycle#window-close 1 (8:03:22 PM) Lifecycle#window-all-closed (8:03:22 PM) Lifecycle#before-quit (8:03:22 PM) App#will-quit: disposing resources
22015|"@bpasero for the 4 Fareast languages, the pattern is like `Translation String(<letter>)`, with the `<letter>` denoted with ""&&""."
22016|vscode default use --debug-brk to enable the debug support which block the child process at beginning.
22017|The console always output messy code  and I do not know where to set it correctly
22018|Looks like an upstream issue that's fixed. It should be fixed eventually when we update Electron https://bugs.chromium.org/p/chromium/issues/detail?id=580259
22019|By analyzing the blame information on this pull request, we identified @egamma and @aeschli to be potential reviewers
22020|Hi **@huangenyan**, I'm your friendly neighborhood Microsoft Pull Request Bot (You can call me MSBOT). Thanks for your contribution!     <span>         In order for us to evaluate and accept your PR, we ask that you sign a contribution license agreement. It's all electronic and will take just minutes. I promise there's no faxing. https://cla.microsoft.com.     </span>  TTYL, MSBOT;
22021|**@huangenyan**, Thanks for signing the contribution license agreement so quickly! Actual humans will now validate the agreement and then evaluate the PR. <br />Thanks, MSBOT;
22022|.tar.xz might be a better way to go, 30% file saving for significantly slower compression time and slightly slower decompression time.  ``` ❯ time tar -cJf vscode.tar.xz VSCode-linux-x64/  real    0m48.358s user    0m48.396s sys 0m0.276s  ❯ time tar -xJf vscode.tar.xz  real    0m2.161s user    0m2.172s sys 0m0.180s  ❯ time tar -czf vscode.tar.gz VSCode-linux-x64/  real    0m4.808s user    0m4.732s sys 0m0.148s  ❯ time tar -xzf vscode.tar.gz  real    0m0.845s user    0m0.800s sys 0m0.164s  ❯ ls -l --block-size=M ... -rw-rw-r--  1 daniel daniel 44M May 19 22:36 vscode.tar.gz -rw-rw-r--  1 daniel daniel 31M May 19 22:35 vscode.tar.xz ```
22023|I am from windows environment and VS Code provides the same option there. I do not know why the hell it is doing discrimination with osx and not providing the same here.  it is not impossible and we need it
22024|This issue was moved to OmniSharp/omnisharp-vscode#354
22025|@sincsc what console are you talking about? What do you mean by 'messy code'?  Please provide more details about your problem.
22026|Thanks :)
22027|Hi, is this a problem of electron packager ?
22028|http://tmtheme-editor.herokuapp.com/#!/editor/theme/Solarized%20(dark) i think this color is fine
22029|+1
22030|"What we plan to do:  We will extend the concept of system variables with a mechanism to trigger commands. This makes it possible to add something like ${action.PickProcess} to a launch configuration, e.g.:  ``` json        {             ""name"": "".NET Core Attach"",             ""type"": ""coreclr"",             ""request"": ""attach"",             ""processName"": ""${action.PickProcess}""         } ```  Starting a debug session with this launch config will run the 'PickProcess' command where the user can select a process. The result is a string that becomes the value of the variable. Cancelling the command will cancel the launch of the debug session.   The implementation of the PickProcess command will live in the debugger extension and most likely is  based on the QuickPick UI. But an extension is free to use whatever UI is available for an extension.   The package.json of the debugger extension will contribute a mapping between the system variable (‘PickProcess’) and the command implemented by the extension, e.g. something like:  ``` json ""variables"": {     ""PickProcess"": ""extension.pickProcess"" } ```  At a later point we can decide to provide a default picker action in VS Core and the debugger extensions are free to remove their implementations.  /cc @isidorn @chrisdias"
22031|"@niceb5y  Please, is it possible to add ENU/KOR screenshot with mentioned string ""Later"" ?"
22032|@aeschli   Yeah this branch has got messed up.. Looks like I did a sync and it merged all from master.. I created a new branch sandy/css-variables and made a new pull request.. I will delete this branch and please do review in the new one..  Sorry for inconvenience
22033|By analyzing the blame information on this pull request, we identified @alexandrudima and @egamma to be potential reviewers
