24688|"@Tyriar I'm so used to the `âŒ˜K` shortcut to clear the terminal on Mac, that I do it automatically without thinking. And I do it a lot.  The `âŒ˜K` combination is even recognised in the Chrome DevTools Console for clearing the output - yet another reason that I'm so used to it.  I realise I may not be alone in this, so I have a suggestion: - As per your suggestion, set the default ""Clear Terminal"" shortcut to something that won't conflict with another shortcut, especially the chord keybindings. - If the user decides to override the default shortcut with `âŒ˜K`, make sure that VSCode does not consider that as initiation of a chord keybinding.  This way, there won't be a conflict by default, but the user can opt to lose chord keybindings when in the context of the terminal, in favour of using the well-recognised shortcut.  Would you mind to reopen the issue to make it easier to find, and to continue the discussion?"
24689|The task frameworks sets cwd to the workspace folder by default if not provided. So I don't understand why setting it explicitly makes it work. Need to investigate.
24690|Yes. At least 5 files with active change.
24691|"I'm having a similar issue. Electron Helper is taking 50-150% CPU and eating up memory. This only happened since my update to version 1.2.0. It is happening while I have a react native project open with lots of node_modules inside.  My `ps aux | grep Electron`:  ``` johngoering     13784  56.0  6.1  5044732 508708   ??  R    10:02AM  57:38.81 /Applications/Visual Studio Code.app/Contents/Frameworks/Electron Helper.app/Contents/MacOS/Electron Helper --type=renderer --no-sandbox --lang=en-US --node-integration=true --background-color=#131313 --num-raster-threads=2 --enable-zero-copy --enable-gpu-memory-buffer-compositor-resources --content-image-texture-target=3553,3553,3553,3553,3553,34037,3553,3553,3553,3553,34037,3553,34037,34037 --video-image-texture-target=34037 --channel=13437.1.1126164061 johngoering     13438   0.6  0.0  2787240   3144   ??  S    10:02AM   0:09.26 /Applications/Visual Studio Code.app/Contents/Frameworks/Electron Helper.app/Contents/MacOS/Electron Helper --type=gpu-process --channel=13437.0.1251607827 --no-sandbox --supports-dual-gpus=false --gpu-driver-bug-workarounds=16,17,31,36,40,50,54,61,67,70 --gpu-vendor-id=0x8086 --gpu-device-id=0x0166 --gpu-driver-vendor --gpu-driver-version johngoering     15990   0.0  0.0  3192784   3100   ??  S    10:41AM   0:01.84 /Applications/Visual Studio Code.app/Contents/Frameworks/Electron Helper.app/Contents/MacOS/Electron Helper /Applications/Visual Studio Code.app/Contents/Resources/app/out/bootstrap --type=extensionHost johngoering     15989   0.0  0.3  4066388  23252   ??  S    10:41AM   0:50.89 /Applications/Visual Studio Code.app/Contents/Frameworks/Electron Helper.app/Contents/MacOS/Electron Helper --type=renderer --no-sandbox --lang=en-US --node-integration=true --background-color=#131313 --num-raster-threads=2 --enable-zero-copy --enable-gpu-memory-buffer-compositor-resources --content-image-texture-target=3553,3553,3553,3553,3553,34037,3553,3553,3553,3553,34037,3553,34037,34037 --video-image-texture-target=34037 --channel=13437.3.1323918330 johngoering     13797   0.0  0.0  3220656   2584   ??  S    10:02AM   0:05.80 /Applications/Visual Studio Code.app/Contents/Frameworks/Electron Helper.app/Contents/MacOS/Electron Helper /Applications/Visual Studio Code.app/Contents/Resources/app/extensions/typescript/out/utils/electronForkStart /Users/johngoering/.vscode/node_modules/typescript/lib/tsserver.js johngoering     13792   0.0  0.0  3407152   2704   ??  S    10:02AM   0:33.52 /Applications/Visual Studio Code.app/Contents/Frameworks/Electron Helper.app/Contents/MacOS/Electron Helper /Applications/Visual Studio Code.app/Contents/Resources/app/out/bootstrap /usr/bin/git /Users/johngoering/Documents/workspace/HDMobileIOS2/HelpDesk utf8 /Applications/Visual Studio Code.app/Contents/MacOS/Electron 2.7.4 (Apple Git-66) johngoering     13788   0.0  0.0  3176584   2220   ??  S    10:02AM   0:01.62 /Applications/Visual Studio Code.app/Contents/Frameworks/Electron Helper.app/Contents/MacOS/Electron Helper /Applications/Visual Studio Code.app/Contents/Resources/app/out/bootstrap --type=watcherService johngoering     13787   0.0  0.0  2465068    624   ??  S    10:02AM   0:00.02 /Applications/Visual Studio Code.app/Contents/Frameworks/Electron Framework.framework/Resources/crashpad_handler --database=/tmp/VSCode Crashes --url=https://ticinocrashreporter.azurewebsites.net/crash --handshake-fd=63 johngoering     13785   0.0  0.0  3187528   2248   ??  S    10:02AM   0:01.85 /Applications/Visual Studio Code.app/Contents/Frameworks/Electron Helper.app/Contents/MacOS/Electron Helper /Applications/Visual Studio Code.app/Contents/Resources/app/out/bootstrap --type=extensionHost johngoering     13783   0.0  0.0  3195472   2576   ??  S    10:02AM   0:03.39 /Applications/Visual Studio Code.app/Contents/Frameworks/Electron Helper.app/Contents/MacOS/Electron Helper /Applications/Visual Studio Code.app/Contents/Resources/app/out/bootstrap --type=SharedProcess johngoering     13437   0.0  0.1  3538900   9172   ??  S    10:02AM   0:44.97 /Applications/Visual Studio Code.app/Contents/MacOS/Electron johngoering      8271   0.0  0.0  3175740    828   ??  S     8:41AM   0:02.68 /Applications/Visual Studio Code.app/Contents/Frameworks/Electron Helper.app/Contents/MacOS/Electron Helper /Applications/Visual Studio Code.app/Contents/Resources/app/out/bootstrap /usr/bin/git /Users/johngoering/Documents/github/pdfc-samples utf8 /Applications/Visual Studio Code.app/Contents/MacOS/Electron 2.7.4 (Apple Git-66) johngoering      7715   0.0  0.0  3397972    952   ??  S     8:33AM   0:33.36 /Applications/Visual Studio Code.app/Contents/Frameworks/Electron Helper.app/Contents/MacOS/Electron Helper /Applications/Visual Studio Code.app/Contents/Resources/app/out/bootstrap /usr/bin/git /Users/johngoering/Documents/workspace/HDMobileIOS2/HelpDesk utf8 /Applications/Visual Studio Code.app/Contents/MacOS/Electron 2.7.4 (Apple Git-66) johngoering      7711   0.0  0.0  3175928    920   ??  S     8:33AM   0:01.78 /Applications/Visual Studio Code.app/Contents/Frameworks/Electron Helper.app/Contents/MacOS/Electron Helper /Applications/Visual Studio Code.app/Contents/Resources/app/out/bootstrap --type=watcherService johngoering      7710   0.0  0.0  2473260    196   ??  S     8:33AM   0:00.04 /Applications/Visual Studio Code.app/Contents/Frameworks/Electron Framework.framework/Resources/crashpad_handler --database=/tmp/VSCode Crashes --url=https://ticinocrashreporter.azurewebsites.net/crash --handshake-fd=63 johngoering     17571   0.0  0.0  2444056    792 s002  S+   11:18AM   0:00.01 grep Electron johngoering     15995   0.0  0.0  3216476   3076   ??  S    10:41AM   0:02.14 /Applications/Visual Studio Code.app/Contents/Frameworks/Electron Helper.app/Contents/MacOS/Electron Helper /Applications/Visual Studio Code.app/Contents/Resources/app/out/bootstrap /usr/bin/git /Users/johngoering/Documents/github/pdfc-samples utf8 /Applications/Visual Studio Code.app/Contents/MacOS/Electron 2.7.4 (Apple Git-66) johngoering     15991   0.0  0.0  3207220   3868   ??  S    10:41AM   0:01.12 /Applications/Visual Studio Code.app/Contents/Frameworks/Electron Helper.app/Contents/MacOS/Electron Helper /Applications/Visual Studio Code.app/Contents/Resources/app/out/bootstrap --type=watcherService ```"
24692|Sorry, attached to the last comment.
24693|I have no problem when opening folder or crashed. It just feels lag on typing when there are some change not committed, like something blocking the cursor.
24694|Like the hover, the message part of the in-editor error display now uses the editor font.  ![screen shot 2016-06-07 at 11 32 38](https://cloud.githubusercontent.com/assets/1794099/15853043/c4ca685a-2ca3-11e6-81bd-51b4a3cef1ad.png)
24695|cc @stevencl for how to handle multiline diagnostics in the error list view
24696|You tried to use this extension (https://marketplace.visualstudio.com/items?itemName=robinbentley.sass-indented)?
24697|Yeah, we [cut](https://github.com/Microsoft/vscode/blob/master/src/vs/editor/contrib/referenceSearch/browser/referencesModel.ts#L84) the left part of a preview to roughly eight characters and prefer word boundaries, such as `.`, `-`, whitespace etc. I see how this isn't right for css. Maybe we shouldn't use `/\b/` but a custom set of splitters
24698|I am very sorry to hear you are having issues with VS Code. I wonder if this issue is being caused by an installed extension. Can you try to run VS Code without extensions? From the command line, execute: `code --disable-extensions` and try your steps again to see if it reproduces. If you see it is an issue with the extension, please file it against the extension repository itself.
24699|I still can't see the attachement.
24700|Is it possible to rebind the keys that go with click+dragging? I searched the `keybindings.json` but can't find one for that. Trying to rebind it to just `alt` rather than `alt+shift`
