24601|On second thought suspect `registerOnTypeFormattingEditProvider` might do what I want. Will report back :rose:
24602|With regards to error-lists, showing long error messages completely would occupy space. So, I am thinking to provide an expand/collapse option for the error-entry to show or hide the complete description.
24603|"This feature helps us because I often want to use ""Add Selection"" (`Ctrl+D`) while continuing the ""Find"". When I am using ""Find"" `foo` to check whether all `foo`s were written correctly, I found incorrect `bar`. I selected `bar` and pressed `Ctrl+D`, to fix the `bar`. Then, the ""Find"" text box was changed to `bar` unintentionally. I have to type `foo` again into the ""Find"" text box to continue the checking."
24604|Is this platform dependant? Finder, in OS X, does not behave that way.
24605|I install back to 1.1.1, everything is ok.
24606|@FeaRCODE #7300
24607|@FeaRCODE Sorry, there is currently no work in the folding area planned for the coming month.
24608|@bpasero Thanks, I'll just revert the changes nevertheless. We should clean up that code since it seems to never be used!
24609|I believe this is how Windows Explorer works and it's how I generally expect tree views to work. Atom works the same as I'm describing https://github.com/atom/tree-view/issues/561 (I actually did the PR before joining :stuck_out_tongue:)
24610|My bad, I tried again and it worked. I think this was either a missing comma in my keybindings or I only reloaded the window, didn't restart vscode.
24611|@Tyriar @bgse Somehow, I can't reproduce it anymore today. Now it is just not possible to change the color theme, when terminal is in focus as in #6437. Nothing changed since yesterday. Just one reboot. Some astonishing nondeterminism going on here. :D
24612|@martinring there are a few quirky bugs I'm chasing that don't make a lot of sense (#6738), I guess this is one of them :stuck_out_tongue:
24613|Duplicate https://github.com/Microsoft/vscode/issues/7062
24614|This might be caused by lack of proper locale. See #7301 for workaround.
24615|@cg-cnu try installing via the command line, I find the GUI gets a little flaky sometimes:  ``` sudo yum install <file>.rpm ```
24616|Just noticed something from a comment above:  > `Extension host terminated unexpectedly. Code: 3221225477 Signal: null`  electron/electron#3570 says that `3221225477` is a really ugly crash, as in segfault or access violation.
24617|`gulp-vinyl-zip`
24618|@bpasero First of all please accept my apologize for not responding so soon, I am afraid I can't provide you with a feedback because the issue were my AMD Radeon Graphics Drivers, after an Update was released the issue was gone. Thanks for your hard work!
24619|@zeewane I've used Google Translate and here is what it translates to: Switching Developer Tools Click Mobile view Close Developer Tools Tip exception is encountered and needs to close  However, I do not understand the steps...
24620|Also, a mono-space font should be used. Otherwise whitespace based formatting won't work
24621|@bpasero fyi
24622|I am not they guy for optimise. Maybe @joaomoreno or @alexandrudima
24623|It's standard to have View: prefixed for actions in the view menu.
24624|@Tyriar did you change **all** linux builds to produce `tar.xz` files instead of `zip`? We have tools that depend on the fact that they are `zip` files.
24625|I guess doing something like how Debug does as there are a bunch of commands coming for multi terminal handling in June.  ![image](https://cloud.githubusercontent.com/assets/2193314/15849436/6d1c3c2a-2c47-11e6-97ab-759374f35632.png)
24626|Duplicate of https://github.com/Microsoft/vscode/issues/7062
24627|You can bind any key/keys to the `acceptSelectedSuggestion` command using the keyboard configuration story. For details see: https://code.visualstudio.com/docs/customization/keybindings#_customizing-shortcuts
24628|Yeah I see the `View:` argument... but I'd not be very happy in having: - Terminal: Open System Terminal - View: Open Integrated Terminal - Terminal: Focus Integrated Terminal
24629|@phest what language/extension are you using?
24630|"@clarkcox3 You can get this behaviour for page up and page down by editing the `keybindings.json`:  ``` { ""key"": ""pagedown"", ""command"": ""scrollPageDown"", ""when"": ""editorTextFocus"" }, { ""key"": ""pageup"", ""command"": ""scrollPageUp"", ""when"": ""editorTextFocus"" } ```  I don't think we have commands that scroll to the beginning/end of the document that you can easily bind to."
24631|@steven-qi this should definitely be added to the docs when a topic is written on the terminal, I've created https://github.com/Microsoft/vscode-docs/issues/343 to follow it up in the eventual documentation. Thanks! :smiley:
24632|Yeah I've seen this in my Linux desktop, although never in our build machines...
24633|Are you on node 5.10?
24634|I see you confused yourself there :smile:   Maybe you should pose the question to the rest of the team in slack or something, this is how it's done now and I agree it's a bit ugly.
24635|@cg-cnu the insiders build should be available with the version number tomorrow I think :)  Closing as duplicate of https://github.com/Microsoft/vscode/issues/6587
24636|Duplicate of https://github.com/Microsoft/vscode/issues/6735
24637|Good idea.
24638|Cool, thanks.
24639|@jrieken Yes we can bind key by ourself. So `acceptSuggestionOnEnter` is duplicated  So I would like to have it only one for all key. And I think `acceptSuggestionOn` is far more easier to edit. So I think we should have just `acceptSuggestion` instead
24640|This might be OS X-specific, seems fine in Linux (vscode/bash left, gnome-terminal/bash right)  ![image](https://cloud.githubusercontent.com/assets/2193314/15849679/96c40b10-2c48-11e6-80f7-f8753e26f2e3.png)
24641|Duplicate of https://github.com/Microsoft/vscode/issues/6455, fix coming in v1.3
24642|@jrieken It works great, thanks!
24643|@joaomoreno potentially, I'll have to check. Could ./scripts/npm.sh, code.sh and/or gulp check the node version and warn on this if so?
24644|@Tyriar @martinring Same here, no repro on Win8.1, Win10 and F23.  I'd assume there is more to it than just changing the color theme, or could be completely unrelated breakage.
24645|If will soon delete editor/standalone-languages (14.7KLOC). Maybe that will help
24646|We more or less copied the toggles from Visual Studio's find widget.  @bgashler1 @stevencl thoughts?
24647|@githubhero What theme are you using? What you describe sounds like the Dark (Visual Studio) theme. If you like variable and function declaration highlighted, use the Dark+ theme.  If that's not the problem, please add a code snippet that shows the issue.
24648|When opening vscode, the file tsconfig.json is opend in vscode editor. After executing _F1 > 6282: Stat File System_ all directories of my workspace are scanned. In the command prompt where codeHelper is running no ouptput happens. After executing _F1 > 6282: Install Watchers_, file watchers for all files in the root directory are getting istalled (see attached file output_6282.zip).  Until this time there is still no output on to see in the codeHelper command prompt. But when I open a .ts  file in vscode editor _watcher notified events_ are fired for each file in project workspace until vscode hangs and has to be killed. At the same time (when opening a .ts file) codeHelper also generates output. The attached file contains the output of the 6282 console of vscode at the time after opening a ts file in editor, but before vscode hangs. [output_6282.zip](https://github.com/Microsoft/vscode/files/302062/output_6282.zip)
24649|"Workaround:   1) Create a file named `/usr/local/bin/bash-login` (or whatever you'd like to name it) and add the following lines to it (You might need root to create that file depending on your setup):  ``` bash #!/bin/bash bash -l ```  2) Make it executable with `chmod +x /usr/local/bin/bash-login`.  3) On your VSCode user settings, set:  ``` JSON {   ""terminal.integrated.shell.linux"": ""/usr/local/bin/bash-login"" } ```  4) Profit âœ¨   ![](https://cldup.com/6lQPeaCwcJ.png)"
24650|After thinking again, I think its not a good idea to put owner information as part of the entry as not everybody is interested in this info. Another idea is to put it as part of the filters so that interested users can filter markers based on who generate them
24651|Hmm, strange. All seems to work for me with a fresh install on 1.2-insiders: ![image](https://cloud.githubusercontent.com/assets/6461412/15850280/73351f6e-2c97-11e6-8ed3-cb709f305129.png)  That's the Dark+ theme. What platform are you? Can you try to run vscode without any extensions? `code-insiders --disable-extensions`
24652|By analyzing the blame information on this pull request, we identified @joaomoreno and @egamma to be potential reviewers
24653|Hi **@Huachao**, I'm your friendly neighborhood Microsoft Pull Request Bot (You can call me MSBOT). Thanks for your contribution!     <p>         It looks like you're a Microsoft contributor (Huachao Mao). If you're full-time, we DON'T require a Contribution License Agreement. If you are a vendor, please DO sign the electronic Contribution License Agreement. It will take 2 minutes and there's no faxing! https://cla.microsoft.com.     </p>  TTYL, MSBOT;
24654|"I agree with @RyanEwen. I really appriciate the open development and amount of communication, but these announcements being  part of the official ""Release Notes"" is really confusing.  Maybe this can be split up into actual release notes, and 'what we're working on right now' or something."
24655|@frogcjn what do you mean by 'Sourcemap section'?  VS Code supports source maps, including inlined source maps and inlined source.  VS Code does **not** support 'index maps' (see https://docs.google.com/document/d/1U1RGAehQwRypUTovF1KRlpiOFze0b-_2gc6fAH0KY0k/edit?hl=en_US)
24656|@weinand ReactNative generate source map v3, with a sections property, then vscode cannot match with this kind of source map. Vscode only can debug with source code without sections. chrome supports debug with source map sections.
24657|You can get the selection `Range` with `document.getSelection().getRangeAt(0)`.  You could then extract the client rects that form it via: `range.getClientRects()`, and create a lot of absolutely positioned white divs of the right sizes with `mix-blend-mode: difference;`. That way they reverse whatever is below them.  Would also need to use `pointer-events: none` on the divs so that they don't affect the selection.
24658|@coreh if adding the `-l` arg is all there is to it then this should make it into the next release in the form of https://github.com/Microsoft/vscode/issues/7266
24659|"Shouldn't we not try to address this issue by starting to consolidate the two Terminal types in VS Code first?  I propose to have only one ""Terminal"" in VS Code. This can be either opened from the Explorer's ""Open in Terminal"" action (which does a 'cd' to the selected folder) or with a global ""Open Terminal"" action (which opens the terminal at the project root).  Whether this Terminal is a 'System Terminal' or the 'Integrated Terminal' can be controlled via a setting."
24660|@Tyriar Yes, I was using cli all the time.
24661|updated 1.2, same thing.how to ignore it?
24662|I've actually already done this as part of https://github.com/Microsoft/vscode/pull/7288  Using `::selection`, I take the `color` and make it the selection `background-color`, then with the make the `background-color` the selection `color`. It turned out really nicely:  ![image](https://cloud.githubusercontent.com/assets/2193314/15850995/cc2db92a-2c4f-11e6-95cf-8855fc38fe61.png)
24663|@aeschli I'm using Monokai.   In the following snippet, I want to highlight: - <?php and ?> - file_get_contents - json_decode - trim - strtolower - file_exists - fopen - fwrite - fclose - in_array - header - unset  ``` <?php  $content = file_get_contents('php://input'); $update = json_decode($content, true);  $text = trim($text); $text = strtolower($text);  $filePath = 'jvm/jsm.json';  switch ($text) {     case '/start':      if (file_exists($filePath)) {         // found         $string = file_get_contents($filePath);         $obj = json_decode($string, true);         $ids = $obj['ids'];      if (in_array($chatId, $ids)) {             header('Content-Type: application/json');             $parameters = array('chat_id' => $chatId, 'text' => 'running');             $parameters['method'] = 'sendMessage';             echo json_encode($parameters);         }         else {             $ids[] = $chatId;             $a = array('ids' => $ids);             $fp = fopen($filePath, 'w');             fwrite($fp, json_encode($a));             fclose($fp);              header('Content-Type: application/json');             $parameters = array('chat_id' => $chatId, 'text' => 'Avviato');             $parameters['method'] = 'sendMessage';             echo json_encode($parameters);         }     }     else {         // not found                    $a = array('ids' => array($chatId));         $fp = fopen($filePath, 'w');         fwrite($fp, json_encode($a));         fclose($fp);          header('Content-Type: application/json');         $parameters = array('chat_id' => $chatId, 'text' => 'ok');         $parameters['method'] = 'sendMessage';         echo json_encode($parameters);     }     ;     break;     case '/stop':            if (file_exists('jvm/jvm.json')) {          $string = file_get_contents($filePath);         $obj = json_decode($string, true);         $ids = $obj['ids'];         if (in_array($chatId, $ids)) {              unset($ids[array_search($chatId, $ids)]);             $a = array('ids' => $ids);             $fp = fopen($filePath, 'w');             fwrite($fp, json_encode($a));             fclose($fp);          }         else{              // cut...          }      }     // cut... }  ?> ```  ``` ```
24664|@Tyriar Thanks. ðŸ˜„
24665|Wow, that indeed looks way better than the current selection... Time for me to get on that Insiders build I guess haha. It's moving so fast! ðŸ‘
24666|Just open the launch.json or select a launch config from the drop down menu and problem disappears.
24667|@magnasteyr thanks for trying. I created a new version of the extension that reads the content of all js and ts files. Although this usually shouldn't trigger change events it might since a read updates the last read time on Windows. So could you uninstall that last version of the 6282 extension, install the new attached version and run F1 > 6282: Read Contents with the CodeHelper running as well. Lets hope that we see file events now. Then we at least know what is happening.  [6282-0.0.1.zip](https://github.com/Microsoft/vscode/files/302141/6282-0.0.1.zip)
24668|@cg-cnu what you linked are definitely the correct rpm packages at least in the region I'm being served in, I just downloaded both 32 and 64 bit and checked the package.json inside and it said 1.2.0.
24669|@slaveofcode xdebug is php?
24670|@coreh :smile: this will probably sit in PR for a day or 2 so land in insiders around the same time. But yeah, the daily insiders just started like an hour ago and [already has some useful fixes in it](https://github.com/Microsoft/vscode/issues?q=is%3Aissue+label%3Aintegrated-terminal+milestone%3A%22June+2016%22+is%3Aclosed).
24671|@sandy081 sorry, I was not clear in my description. Corrected it. I was talking about the source attribute on a marker. And be aware that different markers on a file can have different source attibutes. So we can't make it part of the file name. Either we need a column or we integrate it into the message as we do in hovers (e.g [ts]. [js], ...)
24672|workbench.main.js:87 Cannot launch debug target (spawn node ENOENT).: Error: Cannot launch debug target (spawn node ENOENT).     at Object.E [as create](file:////Applications/Visual Studio Code.app/Contents/Resources/app/out/vs/workbench/workbench.main.js:31:17647)     at file:////Applications/Visual Studio Code.app/Contents/Resources/app/out/vs/workbench/workbench.main.js:104:23498     at Object.p [as _notify](file:////Applications/Visual Studio Code.app/Contents/Resources/app/out/vs/workbench/workbench.main.js:23:16345)     at Object.__dirname.undefined.F.enter (file:////Applications/Visual Studio Code.app/Contents/Resources/app/out/vs/workbench/workbench.main.js:23:19673)     at __dirname.undefined.t.Class.define._run (file:////Applications/Visual Studio Code.app/Contents/Resources/app/out/vs/workbench/workbench.main.js:23:20994)     at __dirname.undefined.t.Class.define._chainedError (file:////Applications/Visual Studio Code.app/Contents/Resources/app/out/vs/workbench/workbench.main.js:23:20353)     at n (file:////Applications/Visual Studio Code.app/Contents/Resources/app/out/vs/workbench/workbench.main.js:23:18181)     at Object.p [as _notify](file:////Applications/Visual Studio Code.app/Contents/Resources/app/out/vs/workbench/workbench.main.js:23:16345)     at Object.__dirname.undefined.F.enter (file:////Applications/Visual Studio Code.app/Contents/Resources/app/out/vs/workbench/workbench.main.js:23:19673)     at __dirname.undefined.t.Class.define._run (file:////Applications/Visual Studio Code.app/Contents/Resources/app/out/vs/workbench/workbench.main.js:23:20994)  ---  messageService.ts:119Error: spawn EACCES     at exports._errnoException (util.js:890:11)     at ChildProcess.spawn (internal/child_process.js:302:11)     at Object.exports.spawn (child_process.js:379:9)     at NodeDebugSession.launchRequest (/Applications/Visual Studio Code.app/Contents/Resources/app/extensions/node-debug/out/node/nodeDebug.js:457:34)     at NodeDebugSession.DebugSession.dispatchRequest (/Applications/Visual Studio Code.app/Contents/Resources/app/extensions/node-debug/node_modules/vscode-debugadapter/lib/debugSession.js:303:22)     at NodeDebugSession.ProtocolServer._handleData (/Applications/Visual Studio Code.app/Contents/Resources/app/extensions/node-debug/node_modules/vscode-debugadapter/lib/protocol.js:78:38)     at Socket.<anonymous> (/Applications/Visual Studio Code.app/Contents/Resources/app/extensions/node-debug/node_modules/vscode-debugadapter/lib/protocol.js:23:60)     at emitOne (events.js:90:13)     at Socket.emit (events.js:182:7)     at readableAddChunk (_stream_readable.js:153:18): Error: Error: spawn EACCES     at exports._errnoException (util.js:890:11)     at ChildProcess.spawn (internal/child_process.js:302:11)     at Object.exports.spawn (child_process.js:379:9)     at NodeDebugSession.launchRequest (/Applications/Visual Studio Code.app/Contents/Resources/app/extensions/node-debug/out/node/nodeDebug.js:457:34)     at NodeDebugSession.DebugSession.dispatchRequest (/Applications/Visual Studio Code.app/Contents/Resources/app/extensions/node-debug/node_modules/vscode-debugadapter/lib/debugSession.js:303:22)     at NodeDebugSession.ProtocolServer._handleData (/Applications/Visual Studio Code.app/Contents/Resources/app/extensions/node-debug/node_modules/vscode-debugadapter/lib/protocol.js:78:38)     at Socket.<anonymous> (/Applications/Visual Studio Code.app/Contents/Resources/app/extensions/node-debug/node_modules/vscode-debugadapter/lib/protocol.js:23:60)     at emitOne (events.js:90:13)     at Socket.emit (events.js:182:7)     at readableAddChunk (_stream_readable.js:153:18)     at Object.E [as create](file:////Applications/Visual Studio Code.app/Contents/Resources/app/out/vs/workbench/workbench.main.js:31:17647)     at file:////Applications/Visual Studio Code.app/Contents/Resources/app/out/vs/workbench/workbench.main.js:104:23498     at Object.p [as _notify](file:////Applications/Visual Studio Code.app/Contents/Resources/app/out/vs/workbench/workbench.main.js:23:16345)     at Object.__dirname.undefined.F.enter (file:////Applications/Visual Studio Code.app/Contents/Resources/app/out/vs/workbench/workbench.main.js:23:19673)     at __dirname.undefined.t.Class.define._run (file:////Applications/Visual Studio Code.app/Contents/Resources/app/out/vs/workbench/workbench.main.js:23:20994)     at __dirname.undefined.t.Class.define._chainedError (file:////Applications/Visual Studio Code.app/Contents/Resources/app/out/vs/workbench/workbench.main.js:23:20353)     at n (file:////Applications/Visual Studio Code.app/Contents/Resources/app/out/vs/workbench/workbench.main.js:23:18181)     at Object.p [as _notify](file:////Applications/Visual Studio Code.app/Contents/Resources/app/out/vs/workbench/workbench.main.js:23:16345)     at Object.__dirname.undefined.F.enter (file:////Applications/Visual Studio Code.app/Contents/Resources/app/out/vs/workbench/workbench.main.js:23:19673)     at __dirname.undefined.t.Class.define._run (file:////Applications/Visual Studio Code.app/Contents/Resources/app/out/vs/workbench/workbench.main.js:23:20994)
24673|@weinand I was initially opposed to that idea, but I think my aversion to it was due to multiple terminals not being supported which should come in June :+1:
24674|@codingEcho can you please provide a more complete example. Best would be a workspace including your tsconfig.json that shows the problem.
24675|"let developer debug react native with typescript file in vscode has two approaches: (1) let node-debug support sorcemap sections or  (2) let vscode-react-native transfer sections source map to normal source map.  I have make some progress on the second approach:  <img width=""1164"" alt=""2016-06-07 16 43 04"" src=""https://cloud.githubusercontent.com/assets/1777562/15851399/1e76875a-2ccf-11e6-8512-f43b10cff401.png"">"
24676|@jrieken Peek Definition seems to behave accordingly now. But what about Go To Definiton?  ![go_to_definition](https://cloud.githubusercontent.com/assets/1297882/15851468/305a88d6-2c9d-11e6-8c21-2e067b3f6949.gif)
24677|Moving to TS team since the formatter comes through the tsserver.
24678|This issue was moved to Microsoft/TypeScript#9001
24679|This should be fixed now, it happened because stable was built using some changes in vscode-distro that I wasn't expecting. I created https://github.com/Microsoft/vscode/issues/7308 to follow this up in the June release so this doesn't happen in the real switch over to tar.xz.
24680|Actually the action fixes all auto-fixable problems as defined by eslint (see http://eslint.org/docs/rules/). The action is clear in the UI, but not in the command name since the name sounded very long. We will update the documentation to explain this.  There is nothing VS Code can do since the rule is not auto fixable in eslint itself. Closing the issue.
24681|The new version of 6282 extension is missing...
24682|Is it really that the case sensitive button just isn't discoverable or is it that the need to set case sensitivity is unexpected? It does seem odd to have to turn case sensitivity on when the expression explicitly specifies a case.  Perhaps we just disable the case sensitive toggle whenever the user specifies a regex pattern? Or, we do a tooltip indicating when case sensitivity is turned off whenever the user toggles regex on?
24683|@alexandrudima  Thanks for your reply. in the system whit Chinese language ,the   **ctrl+space** usually switch the English and Chinese input by default. In the last win10 ,I even can't change the short key.SO I define a vs code setting file.it works.
24684|"So, this helped: - Reinstall VSCode - Reinstall node  ---  I had a problem with node versions.  I've used node v5.\* in a system, while local version from /usr/local/bin/node -v v4.4.5  So, VSCode was using v4.4.5, and I could not change it in settings, so I've removed a link from usr/local/bin catalog. And it was using v5 as a default for some time. But after update to a new VSCode version it started to throw an ENOENT error (as in title).  And this inconsistency in versions were preventing me to debug a project due to sass-package, build with other node version  ``` "".../node-sass/vendor/darwin-x64-46/binding.node"" exists.   testing binary. Binary is fine; exiting. ```  So, it is a bit complicated :) Anyway, I think, there should be something improved I guess :)"
24685|@aeschli Martin, I updated to 1.2.0 right now and, aside from <?php and ?>, it looks like it is working now.  Anyway, I have the same issue with JavaScript and C# files too.
24686|Hey... I just erased all the old installations and did a fresh install and that fixed the issue. Sorry for the confusion, last time when I did yum install vscode it updated the rpm. The yum installation is successful but not updating the actual files that could be the reason am seeing the old version in help menu and all the errors. I don't have the old rpm to install and try updating to the new one to test it.  This is fixed. Thanks for your time!
24687|@yortus trying this from the command line results in the following error for me:  error TS5009: Cannot find the common subdirectory path for the input files.  Interestingly I frist tried this under node version 5.10.0 and there it worked in both command line and VS Code.   Do you see the same error in the console ? ![bug](https://cloud.githubusercontent.com/assets/1931590/15852596/e4d114fc-2ca1-11e6-84b5-4be909afc7a7.gif)
